Network,Message URL,Profile,Date,Message,Type,Content Type,Followers,Engagements,Location,Likes,Dislikes,Comments,Shares,Theme
Twitter,https://twitter.com/leyv_angel/statuses/1526408876274221061,leyv_angel,5/16/2022 11:46 pm,"Jajajajajajajajajajajajajaj

Los IZMIERDISTAS MEJIKANOS DE MORENA
LLORANDOLE al CAPITALISMO

JAJAJAJAJAJAJA

BOLA de frustrados y resentidos sociales https://t.co/bOeSGrnJET | QT: 😉🍃 Esta es una gran opción para conocer gran parte de la #CDMX. 

https://t.co/UdnrvutUyM",Message,Photo,784,0,"Venustiano Carranza, Mexico City, Mexico",0,0,0,0,Backlash
Twitter,https://twitter.com/belys0758/statuses/1526408752534020096,belys0758,5/16/2022 11:46 pm,"Suscribo y comparto | QT: ¿Médicos cubanos? 
Soy médico mexicano, estudie en México, he ejercido la profesión en Estados Unidos y acá he conocido médicos de diversas partes del mundo, incluyendo médicos cubanos. Oponerse a que médicos cubanos trabajen en México es infundado, clasista, y discriminatorio.",Message,Text Only,847,0,"Apodaca, Nuevo León, Mexico",0,0,0,0,
Twitter,https://twitter.com/garciaezek/statuses/1526407120094117888,garciaezek,5/16/2022 11:39 pm,"17/05 día mundial de la lucha contra la lgbtifobia, ya que sigue existiendo discriminación, violencia y muerte.
x quienes no están, x quienes tienen miedo, x quienes tienen sueños de vivir en un mundo diferente, encendemos una velita a las 8 p.m. en la plaza de armas de Dgo. https://t.co/GKM8ho5SOL",Message,Photo,1831,0,Mexico,0,0,0,0,
Twitter,https://twitter.com/mirellemontes/statuses/1526406021110964225,mirellemontes,5/16/2022 11:35 pm,"La cultura de la paz, se construye todos los días. 

Desde nuestros espacios, pongamos nuestro granito de arena para eliminar todas las formas de violencia y discriminación.

Fomentemos el diálogo y transformemos nuestro mundo ✌🏼🤍 https://t.co/0i3zDGMduz",Message,Photo,2914,0,"Guadalajara, Jalisco, Mexico",0,0,0,0,
Twitter,https://twitter.com/varamburucano/statuses/1526397493998592001,varamburucano,5/16/2022 11:01 pm,"¿De verdad no pueden articular una idea que no sea clasista? | QT: Este tipo da clases y ""hace investigación"" en una universidad, pero debería estar en un cruce vendiendo lápices",Message,Text Only,7442,0,"Colonia del Valle, Mexico City, Mexico",0,0,0,0,
Twitter,https://twitter.com/marcela94925/statuses/1526393726666305536,marcela94925,5/16/2022 10:46 pm,BDC2773 @MaxKaiser75 @DraAnaCeci Se ve lo resentido que estás… no puedes aceptar que una joven bonita sea Mucho Mejor que tú… Bot pagado,Mention,Text Only,1943,0,"San Miguel de Allende, Guanajuato, Mexico",0,0,0,0,Backlash
Twitter,https://twitter.com/SalvadorDelRoV2/statuses/1526392015470022657,SalvadorDelRoV2,5/16/2022 10:39 pm,micuentamedica También se puede decir dra que es de amplio criterio para mí es una persona vanguardista de avanzada sin tabus complejos alguien que no se espanta que si la moral la decencia conservadora clasista,Mention,Text Only,705,0,Mexico,0,0,0,0,
Twitter,https://twitter.com/gothicfatale/statuses/1526390692020355072,gothicfatale,5/16/2022 10:34 pm,"No soy clasista, de hecho tengo amigos que no han visto Moon Knight y les hablo bien https://t.co/7fNLe3dv6Y",Message,Photo,63,0,Mexico,0,0,0,0,
Twitter,https://twitter.com/EduardoNaresR/statuses/1526385978272890880,EduardoNaresR,5/16/2022 10:15 pm,"Me sorprende la calidad del discurso de la oposición sobre los #MedicosCubanos en México. 

Una vez más evidencian su clasismo asqueroso y deleznable. 

Son tan burdos y doble moral que detestan al pueblo cubano, pero qué tal van de vacaciones a su país.",Message,Text Only,449,0,"Coyoacan, Mexico City, Mexico",0,0,0,0,
Twitter,https://twitter.com/Cecilia66090812/statuses/1526378661837828098,Cecilia66090812,5/16/2022 9:46 pm,"VictorPeMen @MSEQUEYRO Detrás de ese rechazó a Noroña que lo disimulan con que es ""contradictorio""  ""violento"" que no se baña , etc. hay muchos prejuicios clasista.  Lo triste es que es tanto de tanto de la oposición como de compañeros del movimiento.",Mention,Text Only,204,0,"Magdalena Contreras, Mexico City, Mexico",0,0,0,0,
Twitter,https://twitter.com/JAReusA/statuses/1526374907184959488,JAReusA,5/16/2022 9:31 pm,"TruebaLara ¡Vamos Trueba! Qué puedes esperar de un decrépito resentido social cuyos motores en su asquerosa vida  e inmensa mediocridad son el odio, la amargura, la envidia, la calumnia y la miseria espiritual. No pidas peras al olmo ni nobleza al alacrán; desgracia y retroceso para México. https://t.co/ty4m7zm4gt",Mention,Photo,449,3,"Medina, Guanajuato, Mexico",1,0,0,2,Backlash
Instagram,https://www.instagram.com/p/Cdo__afLzU9/,,5/16/2022 9:24 pm,"(+Portugués)
✅✏️ El curso ""Racismo y lucha de clases en Brasil"" se suma a la plataforma de cursos de la Fundación Lauro Campos y Marielle Franco y presenta de forma panorámica la dinámica de la formación social brasileña y sus desencadenantes hasta el día de hoy. 

Gracias al Partido psol50, la Fundación Lauro Campos y Marielle Franco fundacaolcmf, y a sus formadores. 🇧🇷💪🏽

✅✏️ O curso “O racismo e a luta de classes no Brasil” se soma a plataforma de cursos da Fundação Lauro Campos e Marielle Franco e apresenta de forma panorâmica as dinâmicas da formação social  brasileira e seus desencadeamentos até os dias de hoje.

Obrigado ao Partido psol50 Fundação Lauro Campos e Marielle Franco fundacaolcmf, e seus formadores. 🇧🇷💪🏽

#Psol50 #esquerdasegueesquerda #Lula13 #Racismo #Luta #estudaqueavidamuda #Brasil",Message,Photo,0,7,,7,0,0,0,
Twitter,https://twitter.com/cassimskatelml/statuses/1526371796311846912,cassimskatelml,5/16/2022 9:19 pm,"Este si es racismo disfrazado de nacionalismo | QT: Hola #Fren, que asco verte #Again Espero no des #FakeNews #Again... https://t.co/PXvoCoKHdh",Message,Text Only,213,0,"Coyoacan, Mexico City, Mexico",0,0,0,0,
Twitter,https://twitter.com/PONCHOELCHICO64/statuses/1526369367407067137,PONCHOELCHICO64,5/16/2022 9:09 pm,"DraAnaCeci La damita …. Afrentosa. Marrullera, clasista .. discriminador a … y llama a sus compañeros provincianos … terminó añejo y anquilosado … a y le tenemos que creer lo que es … pobrecita",Mention,Text Only,489,0,"Jardines de la Silla (Jardines), Nuevo León, Mexico",0,0,0,0,
Twitter,https://twitter.com/ziresmich/statuses/1526368931086315520,ziresmich,5/16/2022 9:08 pm,Mi ex jefe me dijo que me pagaba hoy y el naco me dejo menos de la mitad de lo que me debe y me dijo que el ya hizo cuentas y que eso salió? WTF neta que feo que se den a conocer por GATOS,Message,Text Only,1287,0,"Colonia del Valle, Mexico City, Mexico",0,0,0,0,Odio
Twitter,https://twitter.com/DanielV64297034/statuses/1526361206188933120,DanielV64297034,5/16/2022 8:37 pm,"azucenau Ahora resulta que el inquilino resentido, le hecha la culpa a la UNAM, por los médicos, le pregunto y los 'medicos cubanos ' ,con que calidad moral tienen para estar en México, pregunto vividores?",Mention,Text Only,0,0,"Colonia Lindavista, México, Mexico",0,0,0,0,Backlash
Instagram,https://www.instagram.com/p/Cdo6buJFxOy/,,5/16/2022 8:36 pm,"📰🌐🗺️ Comienza la semana con toda la #actualidad internacional con las #5Noticias de la semana por #aldeamundial - Del 10 al 16 de mayo de 2022

#noticias #noticia #internacional #internacionales #política #politicainternacional #politicaexterior #mundo #semana #Ucrania #rusia #otan #filandia #suecia #israel #palestina #shireenabuakle #asesinato #eeuu #racismo #paytongendron #paytongendronracist",Message,Photo,0,16,,16,0,0,0,
Twitter,https://twitter.com/paola_rios03/statuses/1526360489760104454,paola_rios03,5/16/2022 8:34 pm,"El 👑David *inserte El indio enamorado 🎶🎶🎶🎶* | QT: Se lo quedó el 🦅

David Reyes, de @elaguilabeisbol es nuestro lanzador de la semana 🔥

1⃣4⃣🍫 en 13.0 EL https://t.co/yXt9K7wPEr",Message,Text Only,10010,0,"Veracruz, Veracruz, Mexico",0,0,0,0,Origen cultural
Twitter,https://twitter.com/mariohflores/statuses/1526359712706568193,mariohflores,5/16/2022 8:31 pm,"Mexskal @Maruchanchan Jajaja en serio que si estás dañado, ya obtuviste tus 5 minutos, ya mijo, sigale de acomplejado, mi pequeño chofercito con aires de grandeza y cultura, pero que no ha logrado nada en su vida... Ve a qué te violente tu tío o tu papá...saluditos!!",Mention,Text Only,117,0,"Medina, Guanajuato, Mexico",0,0,0,0,
Twitter,https://twitter.com/hector_sinecio/statuses/1526359387547353090,hector_sinecio,5/16/2022 8:30 pm,"Jcms_1810 @gnmfcb @Alopezt2016 @IngenieroPetrol @cesarcharles Pues sólo acuérdate que #Juarez hubiera fusilado a #Cononfort si no se opone #Vidaurri quien lo protege en Nuevo León, si el indio Juárez era más canijo de lo que la gente piensa, si ganaba Ortega y Comonfort era el héroe, si perdían ya tenia en mente otra nueva generación. https://t.co/G6Qd1RJ3ta",Mention,Photo,8011,0,"El Pueblito, Querétaro, Mexico",0,0,0,0,Origen cultural
Instagram,https://www.instagram.com/p/Cdoz0YzJrHx/,,5/16/2022 7:38 pm,"La policía norteamericana reveló detalles del macabro plan del supremacista Payton Gendron, de 18 años, que mató a 10 personas en un supermercado. El adolescente planeó el ataque durante meses antes de conducir durante tres horas para llevar a cabo la emboscada que las autoridades califican como un acto de “extremismo violento” motivado por la raza.

-
#buffalo #asesino #paytongendron #eeuu #racismo",Message,Photo,0,162,,162,0,0,0,Perfilamiento racial
Twitter,https://twitter.com/TommyPadilla18/statuses/1526343703333203969,TommyPadilla18,5/16/2022 7:27 pm,"_ElFiel Y el taquero: hijo de toda tu puta madre naco de mierda , solo te pregunté si mediana no grande malparido",Mention,Text Only,242,0,"Guadalajara, Jalisco, Mexico",0,0,0,0,Odio
Instagram,https://www.instagram.com/p/CdoyFgWrwda/,,5/16/2022 7:23 pm,"📚Djamila Ribeiro: Gafas Moradas.
💵s/45.

Todo el mundo tiene su propio lugar de enunciación, el cual es necesario gestionar con crítica, responsabilidad y respeto. Hay quien siempre ha podido hablar, en su nombre y en el de los demás, y hay quien habitualmente se ha visto obligado a escuchar, pero eso está cambiando en los últimos tiempos. Ahora toman la palabra los silenciados, plantando cara al racismo patriarcal heteronormativo. La filósofa y activista Djamila Ribeiro, partiendo del punto de vista de la mujer negra, analiza todo lo que rodea al ""Lugar de enunciación"", defendiendo el derecho a una existencia digna, el derecho a la voz.

#libreriavirtual #ventadelibros #escritora #reading #libros #librorecomendado #peru #limalee #lima #bibliofilia #bookstagram #booklover #humanidades #racism #racismo #djamilaribeiro",Message,Photo,0,8,,8,0,0,0,Género
Twitter,https://twitter.com/inzunzaismael_/statuses/1526338829929488384,inzunzaismael_,5/16/2022 7:08 pm,Respecto al escándalo de los médicos cubanos: también es un asunto de clasismo. Les apuesto que si se anunciara la contratación de médicos alemanes o franceses no estuvieran con ese escozor. A la derecha conservadora siempre América Latina se le ha hecho poca cosa.,Message,Text Only,153,0,Mexico,0,0,0,0,
Twitter,https://twitter.com/inzunzaismael_/statuses/1526338400743149568,inzunzaismael_,5/16/2022 7:06 pm,También es un asunto sobre clasismo. Les apuesto que si se anunciara la contratación de médicos alemanes o franceses no estuvieran con ese escozor. A la derecha conservadora siempre América Latina se le ha hecho poca cosa.,Message,Text Only,153,0,Mexico,0,0,0,0,
Instagram,https://www.instagram.com/tv/Cdov0o5lCH_/,,5/16/2022 7:03 pm,"En un mercado de Nueva York un Joven de 18 años de edad mató a 10 ciudadanos en un  acto racial...

#ZARRAPATRAS #racismo #nuevayork #usa #noticiasdevenezuela #venezolanosporelmundo #Venezuela",Message,Video,0,6,,6,0,0,0,
Twitter,https://twitter.com/fidelito65/statuses/1526335245968150537,fidelito65,5/16/2022 6:54 pm,"Y para ejercer en EEUU tuviste que certificar tus conocimientos y títulos obtenidos?... | QT: ¿Médicos cubanos? 
Soy médico mexicano, estudie en México, he ejercido la profesión en Estados Unidos y acá he conocido médicos de diversas partes del mundo, incluyendo médicos cubanos. Oponerse a que médicos cubanos trabajen en México es infundado, clasista, y discriminatorio.",Message,Text Only,393,0,"Cuauhtemoc, Mexico City, Mexico",0,0,0,0,
Twitter,https://twitter.com/HmlopezLic/statuses/1526332784150650881,HmlopezLic,5/16/2022 6:44 pm,"lopezdoriga Sigan votando por los 4treros, liderado por éste loco resentido social.
Ya nos podrá decir de qué vive #JoseRamonLopezBeltran95",Mention,Text Only,274,0,Mexico,0,0,0,0,Backlash
Twitter,https://twitter.com/gelipavera/statuses/1526330009585037312,gelipavera,5/16/2022 6:33 pm,"etiennista Se hará más grande y más físico. Por eso hay que señalar cualquier tipo de violencia física o racial o clasista, para no perder el control de la situación. La opinión pública debe mantenerse muy alerta con estos temas.",Mention,Text Only,164,0,"Cuauhtemoc, Mexico City, Mexico",0,0,0,0,
Twitter,https://twitter.com/azaelc/statuses/1526324971701673994,azaelc,5/16/2022 6:13 pm,rivero_vic @alfredalva101 Déjalo que hable es resentido social...es un mascarita cualquiera...,Mention,Text Only,243,0,Mexico,0,0,0,0,Backlash
Twitter,https://twitter.com/azaelc/statuses/1526321700815749123,azaelc,5/16/2022 6:00 pm,alfredalva101 Para nada. Que equivocado estas. Exigir educación no me hace un resentido social. Pero no lo entenderias tu eres feliz mientras regalen dinero.,Mention,Text Only,243,0,Mexico,0,0,0,0,Backlash
Twitter,https://twitter.com/PedroAlcantar22/statuses/1526321447056162816,PedroAlcantar22,5/16/2022 5:59 pm,"TachoLadrillo Tienes razón, pero no solo es clasista y racista  también es envidia",Mention,Text Only,488,0,"Coyoacan, Mexico City, Mexico",0,0,0,0,
Instagram,https://www.instagram.com/p/CdoocdDu340/,,5/16/2022 5:58 pm,"#Repost ajplusespanol
・・・
Una de las matanzas racistas más mortales en la historia reciente de Estados Unidos ha ocurrido en Búfalo, Nueva York.
Un agresor de 18 años mató al menos 10 personas inspirado en la teoría del “gran reemplazo”, hecha por un escritor de extrema derecha.

#Bufalo #NuevaYork #Racismo #AtaqueRacista #BLM #ajplusesp_video",Message,Video,0,4,,4,0,0,0,
Twitter,https://twitter.com/Dagobertotisca1/statuses/1526321143350689793,Dagobertotisca1,5/16/2022 5:58 pm,FerCevallosF Juez y parte...? No creo...Pero la culpa no la tiene el Indio...!!!,Mention,Text Only,20,0,"Tonala, Jalisco, Mexico",0,0,0,0,Origen cultural
Twitter,https://twitter.com/azaelc/statuses/1526320633533046787,azaelc,5/16/2022 5:56 pm,"alfredalva101 Si sabes que es ser resentido social verdad?? Porque al parecer no sabes... ustedes los pro kakas les gusta pedir programas y apoyos sociales, lo de la educación es lo de menos para ustedes. Escuelas jodidas educación jodida en mexico aaa pero puentes a toda madre",Mention,Text Only,243,0,Mexico,0,0,0,0,Backlash
Instagram,https://www.instagram.com/p/Cdonrpirekv/,,5/16/2022 5:52 pm,"⭕Al menos diez personas murieron este sábado y otras tres resultaron heridas en un tiroteo ocurrido en un supermercado de un barrio predominantemente negro en la ciudad de Buffalo, Estados Unidos.

👨🏻‍✈️El FBI está investigando el tiroteo como un crimen de odio por motivos raciales.

🔹 Esto no es ajeno a nuestra realidad. Esta en manos de cada uno de nosotros como padres y como sociedad de no fomentar el racismo. En cada comentario, broma y queja con contenido racial que hacemos, estamos reforzando odio a personas que no merecen ser discriminadas. A más de la muerte, como en este caso, la discriminación racial genera violencia de todo tipo, menos oportunidades, afecta a la autoestima y genera inequidad. Adicional, predispone al desarrollo de trastornos mentales como ansiedad, depresión y puede conducir al suicidio. 
. 
. 
. 
👁‍🗨ceciliaviteri.saludmental
🗣Lic. Comunicación
🧠Psic. Clínica
👩‍💼Psic. Organizacional
.
.
.
.
#saludmental #psicologiaclinica #psicologiaclínica #trastornosmentales #trastornosmentalesgraves #psiquiatría #saludmental #ataque #racismo",Message,Photo,0,6,,6,0,0,0,
Twitter,https://twitter.com/MauricioGT66/statuses/1526317369202728960,MauricioGT66,5/16/2022 5:43 pm,LuchoAguilar14 @MarthaZamora029 Unas indio apenas jajajajaja,Mention,Text Only,661,0,"Monterrey, Nuevo León, Mexico",0,0,0,0,Origen cultural
Facebook,https://www.facebook.com/633767657076047/posts/1430882660697872/?comment_id=336003422004260,Unknown Profile,5/16/2022 5:32 pm,".  Cuentos cortos de las “increíbles” noticias mexicanas y otros cuentos:
El cuento de … 
SOY “BLANQUITO”
Niño dice:
Oye má que terrible lo que pasó en Estado Unidos, 
Mataron a varias personas , dicen que por  racismo
Qué bueno que vivimos en México y de eso no hemos sufrido.
Mamá contesta:
Hijo creo que te equivocas , 
Comentarios racistas , los escucho a diario por tus compatriotas:

Cuando  tu naciste  fuimos con la familia a un bonito restaurante
Era el favorito de tus abuelitos, iban de manera constante
La mesera ya conocía a los  abuelitos, se acercó a nuestra mesa y les dio un saludito.
Tu ibas  en la carriola dormido
Y andabas tapado , tu cara a la mesera no se le había revelado
Y que la mesera levanta la cobija , y exclama:
¡Es blanquito!,, y yo pensando , y si fueras morenito habría drama?
Me sentí  muy extrañada  del comentario de la mesera
¿Acaso ser “blanquito” más beneficios genera?

Paso el tiempo y un familiar  nos dijo
Qué bueno que “blanquito” sea tu hijo
Tendrá ventaja  te acordaras de mí , es un plus, así me dijo.

Y qué me dices  de la fiesta que le hicieron a tu amiga  Susanita
Su mamá reiteraba que  su hija era “blanquita”
Y el motivo por el cual  se veía morenita
Era por la  natación ya que  se exponía mucho al sol
Y su piel agarró esa pigmentado color
Su comentario me molestó
La piel de nuestros hijos no es un tema relevante
Pero para la  mamá de Susanita si era un tema importante

Niño dice:
Má,  yo tengo amigos  morenos y blanquitos
Eso no me importa , o ser “blanquito” en México es requisito?
Pues con todos ellos yo juego , Fornite es nuestro favorito
Y lo del color de piel, no me importa , yo no crítico.

La tía que escucha dice:
Mijito a ti el color de piel no te debe importar
Es más , eso nunca te va afectar
Pues eres “blanquito”  y a la discríminación no te vas a enfrentar
Y en México  tu piel ventajas te dará. 
Además eres güerito, de ojos azulitos 
No saliste como nuestra familia  que somos morenitos
Tu mamá Australiana  ha mejorada la raza mexicana. bla bla bla

Rimador Reflexiona:
“Cásate con un güero para mejorar la raza”
“El niño es morenito  pero esta bonito”
“Traes el nopal en la cara”
Frases que alguna vez hemos mencionado
Y andamos criticando a los gringos, estamos muy equivocados
Soy moreno y a mis 40 años , sigo siendo discriminado.
Es más llamaré ala CONAPRED bla bla bla…

Rimador,¿ este cuento ya terminó? Híjole Aún NO…de este cuento  saldrán más cuentos para contar, Si me deseas seguir, aquí está el link
https://www.facebook.com/losrimadores
Y si no , un excelente día te deseo a ti…",Mention,Text Only,0,0,,0,0,0,0,Odio
Twitter,https://twitter.com/Cgur28/statuses/1526314384259051520,Cgur28,5/16/2022 5:31 pm,"LordAbogado Pero muchos de ellos son mamones, egocéntristas e incluso clasistas, lo digo por qué al menos acá en Reynosa en dónde vivo, la mayoría te mira con inferioridad y eso está mal 
No es la regla pero la mayoría es así.
Lastima que los títulos no dan humildad y empatia",Mention,Text Only,855,0,Mexico,0,0,0,0,
Instagram,https://www.instagram.com/p/Cdogs2UP2tN/,,5/16/2022 4:51 pm,"MAÑANA 17/5 seguimos con COMÚN en 📍 trabajosocialunlp (63 y 9 - aula 5)
 ⏰ desde las 11hs. 

🌎 11:00 Bodypainting + Charla sobre la Ley de educación ambiental integral y ley 15.276 para la formación en materia ambiental de la administración pública provincial.
🌱 12:00 Taller de Huertas urbanas y compostaje como herramientas de transformación social con sergmagazzini y belensilvaa 
🖌 14:55 Performance Bodypainting: anaclararte y candelaar_ 
🗣 15:00 Conversatorio Arte y Soberanía: de los cuerpos, de los pueblos, de la alimentación, del ambiente, con Miryam Gorban y tizianocruzok

entrada libre y gratuita
¡lxs esperamos!

apoya: ambienteprovincia

#arte #derechoshumanos #memoria #géneros #diversidadcultural #diversidadsexual #ciclo #ddhh #racismo #soberaniaalimentaria #ciclocomún #soberania #soberaniaalimentaria #huertaurbana",Message,Photo,0,48,,44,0,4,0,
Instagram,https://www.instagram.com/tv/CdofNimjOrO/,,5/16/2022 4:39 pm,"NOS VAMOS A LA V... Así están las cosas, esta todo claro y andan tratando de negar lo que YA ESTÁ ESCRITO.. Si gana el apruebo Chile será una 💩
.
.
.....
#convencionculia #convencionracista #racismo sexismo 
#sevieneregimencomunista #telodije  #mamertolandia #rechazo #socialismo
#chile #chilecomunista  #convencionalesweones 
#datomatasocialismo #logicamatasocialismo
#ciframatasocialismo  #tantoweonenchile  #TontosÚtiles 
#weones #pelotudos #piensaunpoco
#capitalismo #comunistas #nolovimosvenir  #chileno #comunismochile #comunismo 
#chilezuela #bienvenidosachilezuela 
#preguntaleaunvenezolano #progres",Message,Video,0,8,,8,0,0,0,
Instagram,https://www.instagram.com/p/Cdoee8vvozg/,,5/16/2022 4:31 pm,"El tirador identificado como Payton Gendron, de 18 años, fue arrestado en la escena de la tragedia, una tienda de comestibles en un vecindario de mayoría negra, después de que la policía respondiera a llamadas de emergencia.

Los funcionarios encargados de hacer cumplir la ley dijeron que el presunto pistolero Payton Gendron, condujo 200 millas desde su ciudad natal de Conklin, Nueva York, hasta Buffalo después de buscar y apuntar específicamente a un vecindario predominantemente negro.

Gendron vestía chaleco antibalas, portaba un rifle de asalto y llevaba un casco equipado con cámara para transmitir su crimen en vivo por internet

Le disparó a 11 personas negras y dos personas blancas en la tienda de comestibles, dijeron las autoridades. Diez personas murieron.

Un documento de 180 páginas, supuestamente escrito por Gendron, da planes para el ataque y hace referencia a otros tiroteos racistas ya Roof. El documento también describe una ideología racista arraigada en la creencia de que Estados Unidos debería pertenecer solo a los blancos. Todos los demás, decía el documento, eran “reemplazos” que deberían ser eliminados por la fuerza o el terror. El ataque tenía la intención de intimidar a todas las personas que no eran blancas ni cristianas y hacer que abandonaran el país, dijo.

La noche del sábado, las autoridades locales estudiaron detenidamente el documento que describe cada paso de un plan para matar a la mayor cantidad posible de personas negras.

Habla del rifle de asalto semiautomático Bushmaster que utilizaría y da detalles del área de estacionamiento al que conduciría y de la red por la que transmitiría en vivo el acto de violencia.

En el documento de 180 abundan los comentarios racistas y antiinmigrantes que argumentan que los estadounidenses blancos corrían el riesgo de ser reemplazados por personas de color, una ideología común en la extrema derecha conocida como la teoría del «gran reemplazo».

Se trata de una teoría que ha inspirado a otros extremistas en el pasado.

#racismo #tirador #tiroteo #bufalo #matanza #ataque #usa#florida #jacksonville #noticias #notijax",Message,Photo,0,1,,1,0,0,0,Perfilamiento racial
Instagram,https://www.instagram.com/p/Cdocs3OqRa4/,,5/16/2022 4:16 pm,"Empezamos la semana y el tema elegido es el #racismo. 
El domingo publicaremos nuestro programa de psicología (Yo, un perro verde) en nuestro canal de Youtube. Contaremos con la participación de ngadi10 , quien nos explicará, desde su experiencia, todo lo vivido y relacionado con el racismo al que se ha visto expuesto en multitud de ocasiones.

Os agradecemos el apoyo.

¡Seguimos!

#estudiogalatea #EG #podcast #programa #entretenimiento #psicología #psicologiaanalitica #crecimientopersonal #racism #entretenimiento #revistadigital #revista #artículos#younperroverde #yupv #grabacion #discriminación #racismo #autocritica #confianza #radio #televisión #youtube #entrevista #programas",Message,Photo,0,8,,8,0,0,0,
Twitter,https://twitter.com/SlpUpcop/statuses/1526295135004377096,SlpUpcop,5/16/2022 4:14 pm,Gektor09 La raza carroñera que imperó en el Gobierno hasta antes de Diciembre de 2018 solo pone en evidencia su tremenda frustración porque ya no volverán a meter la mano al cajón. Ese miserable excremento humano llamado @pablinator30 es el más pestilente de los ejemplos. https://t.co/BSG8UlwLfO,Mention,Photo,1111,0,Mexico,0,0,0,0,
