Network,Message URL,Profile,Date,Message,Type,Content Type,Followers,Engagements,Location,Gender,Age,Likes,Dislikes,Comments,Shares,Theme
Twitter,https://twitter.com/Hugo07527330/statuses/1516624326031683589,Hugo07527330,4/19/2022 11:46 pm,"El Sábado me tome unas Indio muy Agustín Lara, en  la fiesta del @carloskevin22",Message,Text Only,299,0,Mexico,Men,,0,0,0,0,Origen cultural
Twitter,https://twitter.com/semillitaregia/statuses/1516620963127099407,semillitaregia,4/19/2022 11:33 pm,"CervezaModeloMX La mejor y en Monterrey se ofende cuando pido negra modelo en el bar. 
Me dice:
-Chilanga aqui somos territorio indio
Yo - 😏obvio 😅",Mention,Text Only,3,0,"Jardines de la Silla (Jardines), Nuevo León, Mexico",,,0,0,0,0,Origen cultural
Twitter,https://twitter.com/Luciorm/statuses/1516617647894540296,Luciorm,4/19/2022 11:19 pm,"Fdo Belaunzarán
Muchos pedimos respeto p @CitlaHM x la discriminación q era objeto x su físico y hasta @ArturoZaldivarL salió en su defensa
Ahora ella discrimina y estigmatiza a quienes piensan distinto, llamándolos “traidores a la patria” e instigando a su linchamiento
Revelador",Message,Text Only,2755,0,"Toluca, México, Mexico",Men,,0,0,0,0,
Twitter,https://twitter.com/gotf74/statuses/1516613885536743428,gotf74,4/19/2022 11:05 pm,"GlodeJo07 Aquí el problema no es del indio, sino de quien lo hace compadre, por desgracia los mexicanos en su gran mayoría emiten su voto sin analizar perfiles, ni propuestas, ahí esta el verdadero problema, ojalá esto cambie en las próximas elecciones.",Mention,Text Only,154,0,"Cuautitlan Izcalli, México, Mexico",Men,,0,0,0,0,Origen cultural
Twitter,https://twitter.com/javargasr/statuses/1516611726099333121,javargasr,4/19/2022 10:56 pm,"EmilioAlvarezI @GOrtegaRuiz @SCJN @gpplural @senadomexicano Bonitas recomendaciones, nada clasistas, no discriminatorias y muy respetuosas de la diversidad de opiniones

https://t.co/XedcBTTsYD | QT: Si por ""ideal"" hay que entender que será el mismo tipo de simio naco, inepto, corrupto y bocón, es correcto.",Mention,Link,145,0,"Cuauhtemoc, Mexico City, Mexico",Men,,0,0,0,0,Odio
Twitter,https://twitter.com/grillommg/statuses/1516605162156138500,grillommg,4/19/2022 10:30 pm,"Lonja por lonja.. Cachete por cachete. La ley de  la Citlalli Hernández. 🤪🤪🤪🐷🐷🐷 | QT: Muchos pedimos respeto para @CitlaHM por la discriminación que era objeto por su físico y hasta @ArturoZaldivarL salió en su defensa.

Ahora ella discrimina y estigmatiza a quienes piensan distinto, llamándolos “traidores a la patria” e instigando a su linchamiento.

Revelador.",Message,Text Only,2,0,"Naucalpan de Juarez, México, Mexico",,,0,0,0,0,
Twitter,https://twitter.com/IretaLeon/statuses/1516595258682925062,IretaLeon,4/19/2022 9:51 pm,"patydeobeso ...de casitas de colores, se veía un castillito a lo lejos. Conocí los edificios, los elevadores y las clases sociales, como que en Celaya no notaba el contraste. Aprendí que había vespertino y que las escuelas eran públicas. Una gran Ciudad.",Mention,Text Only,72,0,"Coyoacan, Mexico City, Mexico",,,0,0,0,0,
Twitter,https://twitter.com/Luis_Chikorita/statuses/1516595087622512647,Luis_Chikorita,4/19/2022 9:50 pm,Yo soy indio pero de los finos xd,Message,Text Only,139,0,"Coatzacoalcos, Veracruz, Mexico",,,0,0,0,0,Origen cultural
Twitter,https://twitter.com/Marin_Leo/statuses/1516593876622053379,Marin_Leo,4/19/2022 9:45 pm,"Pero sigan aplaudiendo a este misógino y nefasto personaje. Dicen en mi pueblo que la culpa no es del indio sino de quien lo hace compadre. Se siente intocable porque según es ""opositor"" y sí dicen todo lo contrario acusará agresión a la libertad de expresión. | QT: El Litio es el metal más ligero de la tabla periódica. No siempre. https://t.co/UPegl35VOr",Message,Text Only,12180,0,"Villahermosa, Tabasco, Mexico",Men,,0,0,0,0,"Origen cultural, Género"
Instagram,https://www.instagram.com/p/CcjgeOsrzWi/,,4/19/2022 9:41 pm,"Gaza bajo ataques!!! 
Las fuerzas areas de la ocupación “israelíes” bombardearon brutalmente a las zonas civiles en #Gaza. 

اللهُم لطفك بأهل غزة !💔💔
‏ ⁧‫#غزه_تحت_القصف‬⁩

‏‎‏⁦‪#IsraeliCrimes‬⁩ ⁧‫#الأقصى_في_خطر‬⁩
‏#Palestina #Jerusalén #Ataque #Brutal #Inhumanidad #Racismo #Ocupación #Injusticia #CrimenesDeGuerra #TerrorismoDeEstado #PalestinaLibre 
‏‎#فلسطين #القدس #عدالة #حرية #احتلال",Message,Photo,0,0,,,,0,0,0,0,
Instagram,https://www.instagram.com/p/CcjfcJ7JIZJ/,,4/19/2022 9:32 pm,"MI MADRE ES LA QUE TIENE Y MERECE ABRIR EL BLOG. PRIMERA ENTRADA. ESPERO Y DESEO  QUE ALGÚN DÍA PUEDAS LEERLO.

LINK EN MI BIOGRAFIA
DISFRUTARLO!

#ekuavive #guineaecuatorial #futuroguineaecuatorial #senegal #panafricanismo #panafricanism #cimarrones #panafricanistas #racismo #sosracismo #sosracisme #camerun #sierraleone #vudu #haiti",Message,Photo,0,5,,,,5,0,0,0,
Twitter,https://twitter.com/quagmario/statuses/1516588289523867650,quagmario,4/19/2022 9:23 pm,"twistedwritings Ah bueno, sí, seguro ya conociéndola es racista y homofóbica como los republicanos.",Mention,Text Only,250,0,"Colonia del Valle, Mexico City, Mexico",,,0,0,0,0,
Facebook,http://www.facebook.com/633767657076047/posts/1413334819119323,Racismo_MX,4/19/2022 9:15 pm,"No te pierdas el ""PRIMER ENCUENTRO EMPRESARIAL CONTRA EL RACISMO"", en donde empresas como Accenture, Coca-Cola, Netflix Mexico, Nike Mexico, Pfizer México, Scotiabank México , Walmart México, entre otras, firmarán un compromiso público para implementar prácticas antirracistas tanto al interior como al exterior.

Asimismo, se darán a conocer los resultados de la ""Encuesta sobre la erradicación de la discriminación por motivo de raza, etnia y tono de piel"" en alianza con la American Chamber of Commerce of Mexico y tendremos un foro sobre cómo se manifiesta el racismo dentro y fuera de las empresas.

Jueves 21 de abril, 11:00 a.m., FB Live, ¡No te lo pierdas!

Convocan COPRED, EY México y #RacismoMX. | No te pierdas el ""PRIMER ENCUENTRO EMPRESARIAL CONTRA EL RACISMO"", en donde empresas como Accenture, Coca-Cola, Netflix Mexico, Nike Mexico, Pfizer México, Scotiabank México , Walmart México, entre otras, firmarán un compromiso público para implementar prácticas antirracistas tanto al interior como al exterior.

Asimismo, se darán a conocer los resultados de la ""Encuesta sobre la erradicación de la discriminación por motivo de raza, etnia y tono de piel"" en alianza con la American Chamber of Commerce of Mexico y tendremos un foro sobre cómo se manifiesta el racismo dentro y fuera de las empresas.

Jueves 21 de abril, 11:00 a.m., FB Live, ¡No te lo pierdas!

Convocan COPRED, EY México y #RacismoMX.",Message,Photo,0,49,,,,25,0,0,24,
Twitter,https://twitter.com/cerotreintay9/statuses/1516585978139447299,cerotreintay9,4/19/2022 9:14 pm,SandraCuevas_ @Mzavalagc @maryjosegamboa échale la culpa al indio... seguro un güey que no le tocó pelota de 500 varos.,Mention,Text Only,74,0,"Coyoacan, Mexico City, Mexico",,,0,0,0,0,Origen cultural
Instagram,https://www.instagram.com/p/CcjaPLAO78z/,,4/19/2022 8:47 pm,"Nada mejor que terminar este tremendo cuadro de #muhammadali 
Un peleador nato. Controvertido, potente y directo. #muhammad lucho fuertemente por los derechos de su gente y contra el #racismo 
Me encantan sus reflexiones y cómo se plantea frente al público. Un tipo crítico, muy ácido pero con una contundente personalidad 
Chile es un país racista, pero el racismo es tan profundo que nadie cree que lo somos. Lo hemos sido desde la colonia. Estudie un poco y comprenderá donde parten las diferencias en este país. 
Mas de quinientos años de castas
Grande Muhammed !!!!
Oie espero les guste el cuadro -
A mi me encanta 🥰 
(Imagen portada de la revista life)
#boxeador 
#life #lifemagazine #cassiusclay #black #ali #racism",Message,Photo,0,43,,,,41,0,2,0,
Twitter,https://twitter.com/SDCrisOficial/statuses/1516577651946778624,SDCrisOficial,4/19/2022 8:41 pm,"Qué sucede aquí @Aeromexico? @CONAPRED @INPImx | QT: David Marcelino, cineasta, maestro de lengua Náhuatl con sacrificios compró 1 boleto para asistir a la presentación de su película en Australia. No lo dejaron abordar, tampoco le dieron explicación alguna. @AM_Escucha  @Aeromexico es un acto de discriminación?  🆘 urge atención https://t.co/8DHxGw21dU",Message,Text Only,567,0,Mexico,Women,,0,0,0,0,
Twitter,https://twitter.com/amonge71/statuses/1516577060126224386,amonge71,4/19/2022 8:38 pm,"GlodeJo07 No, porque entonces no estarían representadas todas las voces de todos los estratos. Sería discriminación. Lo que si debería ser obligatorio es que se capaciten en sus deberes una vez que son electos, para eso hay unos meses previo a la toma de posesión.",Mention,Text Only,243,0,Mexico,Men,,0,0,0,0,
Instagram,https://www.instagram.com/p/CcjXZgyuw0P/,,4/19/2022 8:22 pm,"#Repost escapeapluton. 🔥🔥🔥
・・・
🚀Les presentamos nuestra selección LIBRO DEL MES de abril: Lucy, de Jamaica Kincaid, con traducción de Inés Garland 

👉 Hace unos años, cuando leímos Autobiografía de mí madre, quedamos completamente fascinados con la prosa, el ritmo y la mirada de Jamaica Kincaid, y cuando nos enteramos que lapartemaldita estaba preparando el lanzamiento de un nuevo libro de Kincaid, no dudamos un segundo. Y por si fuera poco, en una nueva traducción de Inés Garland 🔥

👉 La narradora de Lucy es una joven antillana de 19 años que deja su país natal para viajar a Estados Unidos y trabajar como au pair para el matrimonio de Lewis y Mariah y sus cuatro hijas. Pero detrás de esta fachada de familia feliz, Lucy va desgranando una realidad opaca, un mundo que se deshace para dejar entrever una nueva realidad, en un verdadero viaje de transformación, que como en muchas novelas de Kincaid coquetea con su propia biografía: la autora también viajó de joven a Estados Unidos para trabajar como niñera antes de empezar a escribir para el New Yorker.

👉 ¡Que librazo que vamos a leer este mes!

#Kincaid #Lucy #novela #racismo #bookclub",Message,Photo,0,48,,,,46,0,2,0,
Twitter,https://twitter.com/Hiramtorres/statuses/1516570889243873283,Hiramtorres,4/19/2022 8:14 pm,"GlodeJo07 Hay que ser muy clasista e ignorante para hacer este tipo de declaraciones, no sorprende apoyes a partidos como MC",Mention,Text Only,7073,0,"Armeria, Colima, Mexico",Men,,0,0,0,0,
Twitter,https://twitter.com/gomvar63/statuses/1516570370945404933,gomvar63,4/19/2022 8:12 pm,"FreseniusKabi cómo es posible que retengan contra su voluntad a las empleadas de limpieza?, Su clasismo define los valores a sus empleadas, están en México y todos valemos igual.",Mention,Text Only,602,0,"Tesistan, Jalisco, Mexico",,,0,0,0,0,
Twitter,https://twitter.com/HOISAD1/statuses/1516563636411633674,HOISAD1,4/19/2022 7:45 pm,"Pueblo son los conformistas sumisos y acomplejados. Nosotros somos ciudadanos aspiracionistas y críticos del sistema de gobierno. | QT: No permitamos que nos digan ""pueblo"". Somos ciudadanos de libre pensamiento, somos diversos y orgullosos de serlo.
Nunca diremos "" es un honor estar con...""
No tenemos ídolos, tenemos ideas, metas, objetivos, planes y.....
Amor por México.",Message,Text Only,188,0,"Fuentes del Valle, México, Mexico",,,0,0,0,0,
Twitter,https://twitter.com/AarnMendozaEsp1/statuses/1516551846294429699,AarnMendozaEsp1,4/19/2022 6:58 pm,"La partida de traidores ahora se dicen perseguidos e insultados por los mexicanos. No tienen vergüenza y sobre todo no tienen madre los HDPT. Cómo se trata a un desleal,traidor,mentiroso,corrupto,entreguistas,clasista,racista que dice representar al pueblo que apuñala?. https://t.co/1ZiMQBgY3U",Message,Photo,26,0,"Morelia, Michoacán, Mexico",,,0,0,0,0,
Twitter,https://twitter.com/eojeda1588/statuses/1516550538879512583,eojeda1588,4/19/2022 6:53 pm,bereaguilarv Super Naco de la 4 T,Mention,Text Only,2,0,"San Lorenzo Acopilco, Mexico City, Mexico",Men,,0,0,0,0,Odio
Twitter,https://twitter.com/MexicoSinMorena/statuses/1516549922178445315,MexicoSinMorena,4/19/2022 6:50 pm,"YinyMorales López Obrador es
Vengativo
Mediocte
Mentiroso
Hipócrita
Envidioso
Acomplejado
Frustrado
Peleado con la vida
Un personaje eso si bien manipulador que engaña a la gente ignorante. https://t.co/frShepzRUb",Mention,Photo,495,0,"Xalapa de Enriquez, Veracruz, Mexico",Women,,0,0,0,0,
Instagram,https://www.instagram.com/p/CcjMT42Lyjs/,,4/19/2022 6:45 pm,"🤔 ¿Cómo entendemos la peruanidad en términos étnico raciales?🇵🇪 ¿De qué manera están vinculadas la identidad nacional y la diversidad o la asimilación/igualdad? Te dejamos algunas reflexiones al respecto. Desliza a la derecha 👆🏽👆🏾👆🏿

*Espinosa, A. (2011). Estudios sobre identidad nacional en el Perú y sus correlatos psicológicos, sociales y culturales [Tesis Doctoral, Universidad del País Vasco].
**Cueto, R. (2017). Estudios sobre relaciones intergrupales, identidades colectivas e ideología política en dos regiones del Perú [Tesis Doctoral, Pontificia Universidad Católica del Perú]. 
***Espinosa, A. & Calderón-Prada, A. (2009). Relaciones entre la identidad nacional y la valoración de la cultura culinaria peruana en una muestra de jóvenes de clase media de Lima. Liberabit, 15, 21-28.
****Valdivia, N., Benavides, M. & Torero, M. (2007). Exclusión, identidad étnica y políticas de inclusión social en el Perú: el caso de la población indígena y la población afro descendiente. En Investigación, políticas y desarrollo en el Perú (pp. 603-655).GRADE.

#peru #peruanidad #racismo #racism #discriminacion #identidad #identidadnacional",Message,Photo,0,47,,,,46,0,1,0,
Twitter,https://twitter.com/MARIAINESMENDEZ/statuses/1516547202793021446,MARIAINESMENDEZ,4/19/2022 6:40 pm,"Elizabe06369368 @kjma91 @HernanGomezB De loco! Con esas chapitas sonrosadas se ve muy extraño y ahí todo embarrado en el sillón. Qué insoportable ha de ser convivir cotidianamente con este sujeto materialista, inmoral, superfluo, ignorante, pedante, ambicioso, clasista, convenciero, retograda, falso, encubridor, etc.",Mention,Text Only,404,0,"Tlalpan, Mexico City, Mexico",Women,,0,0,0,0,
Twitter,https://twitter.com/sosajhons/statuses/1516544990150856704,sosajhons,4/19/2022 6:31 pm,adolfomateog Prohibido? 😅 que anti demócrata.. amiguito lindo si soy mexicano legalmente y aquí es donde vivo y por experiencia se que los gobiernos socialistas autoritarios que no acatan las opiniones que no son de su agrado son sumamente peligrosos.Y más si quién manda es un resentido.,Mention,Text Only,375162,0,"Colonia del Valle, Mexico City, Mexico",,,0,0,0,0,Backlash
Twitter,https://twitter.com/medinom/statuses/1516543471221456899,medinom,4/19/2022 6:25 pm,El monero clasista que demerita a los boleadores de zapatos. | QT: OPOSICIÓN TRIUNFANTE. https://t.co/Gdzi2m7UgH,Message,Text Only,930,0,"Miguel Hidalgo, Mexico City, Mexico",,,0,0,0,0,
Twitter,https://twitter.com/HijueLaChingada/statuses/1516543193113837576,HijueLaChingada,4/19/2022 6:24 pm,"Una vez una tía dijo ""Mijo para la carne asada voy a hacer salsa borracha"" y luego le dio un tragote a su caguama indio.

Me dio mucha risa. https://t.co/hUVlRPWUEB",Message,Photo,699,0,"Monterrey, Nuevo León, Mexico",,,0,0,0,0,Origen cultural
Twitter,https://twitter.com/JavierPerezAram/statuses/1516542840720998402,JavierPerezAram,4/19/2022 6:22 pm,"ChumelTorres Eres un misógino, racista bulgar y corriente. Hoy en día cualquier pendejo es tendencia en redes sociales. https://t.co/17WmjFty4A",Mention,Photo,102,0,"Ocotlan, Jalisco, Mexico",Men,,0,0,0,0,Género
Twitter,https://twitter.com/JavierPerezAram/statuses/1516541814207090695,JavierPerezAram,4/19/2022 6:18 pm,marcosesp78 @ChumelTorres Que esperabas de un misógino racista?,Mention,Text Only,102,0,"Ocotlan, Jalisco, Mexico",Men,,0,0,0,0,Género
Twitter,https://twitter.com/Morgannelo/statuses/1516539825914093570,Morgannelo,4/19/2022 6:10 pm,"Y ahora, una Indio bien helada.",Message,Text Only,136,0,"Monterrey, Nuevo León, Mexico",,,0,0,0,0,Origen cultural
Instagram,https://www.instagram.com/p/CcjG6OeLSb6/,,4/19/2022 5:58 pm,"Voces para el legado de la Comisión de la Verdad es una franja de siete conversaciones alrededor de literatura y conflicto del 22 al 30 de abril. 
ComisionVerdadC
FILBogota
idartes
#literatura #conflicto #libros #cómic #periodismo #crónica #cuento #novela #racismo",Message,Photo,0,19,,,,19,0,0,0,
Twitter,https://twitter.com/sandra_zaizar/statuses/1516533405663604741,sandra_zaizar,4/19/2022 5:45 pm,bereaguilarv Así o más naco?,Mention,Text Only,488,0,"Naucalpan de Juarez, México, Mexico",Women,,0,0,0,0,Odio
Twitter,https://twitter.com/rocio_union/statuses/1516532244814389255,rocio_union,4/19/2022 5:40 pm,"CamMttz @victorhy Igualitas este par de acomplejadas @SandraCuevas y @maryjosegamboa: prepotentes y nefastas, que se marean al subir al ladrillo. Una creo que cacheteó a sus abogados y otra llegó a morder a su abogado. Sinceramente creo que es un vil montaje, no lo dudaría.",Mention,Text Only,2729,0,"San Miguel Xico Viejo, México, Mexico",Women,,0,0,0,0,
Instagram,https://www.instagram.com/p/CcjE0cxlAEL/,,4/19/2022 5:40 pm,"#Música | La banda mexicana Molotov (molotovbanda ) regresa con la canción ‘No Olvidamos’ es una invitación a analizar, criticar y externar la inconformidad sobre distintas hipocresías de los que alguna vez estuvieron al mando, del Distrito Federal. 

El tema adelanta el regreso de la agrupación a sus orígenes musicales, pues Molotov se ha caracterizado por ser una banda polémica, contestataria y a su vez llena de humor, por el uso del lenguaje burlón, directo, crudo y de doble sentido en sus letras.

En sus canciones abundan las críticas hacia los medios de comunicación y su poder ideológico en la sociedad, la sátira política y problemáticas como el racismo y la migración, situación que los llevó a ser censurados de las grandes televisiones del país.

La canción fue escrita por la banda mexicana y contó con el trabajo de Ross Robinson, quien ha trabajado con bandas como The Cure y Slipknot. También estuvieron presentes como coproductor Meme Del Real, integrante de Café Tacvba, y Mike Fraser, quien ha colaborado con AC/DC y Metallica.

Conoce más información en el link de la BIO 

#molotov #bandas #nuevosencillo #nuevacancion #noolvidamos #LaudEstereo #bogota #colombia #mexico #canciones #critica #mediosdecomunicacion #sociedad #satira #satirapolitica #racismo #migracion",Message,Photo,0,62,,,,62,0,0,0,
Twitter,https://twitter.com/salvadormanriq/statuses/1516529254653124614,salvadormanriq,4/19/2022 5:28 pm,"Cosas increíbles que uno no alcanza a comprender porque hay tanta estupidez en el mundo. | QT: David Marcelino, cineasta, maestro de lengua Náhuatl con sacrificios compró 1 boleto para asistir a la presentación de su película en Australia. No lo dejaron abordar, tampoco le dieron explicación alguna. @AM_Escucha  @Aeromexico es un acto de discriminación?  🆘 urge atención https://t.co/8DHxGw21dU",Message,Text Only,2373,0,"Villahermosa, Tabasco, Mexico",Men,,0,0,0,0,
Instagram,https://www.instagram.com/p/CcjBINmNNS0/,,4/19/2022 5:07 pm,"Este joven sufrió una brutal agresión por parte de los vigilantes de la discoteca myavalenciaoficial. Mientras le agredían, según ha denunciado, le gritaban y le insultaban con frases como “moro de mierda, te mato”. Es #racismo, y las empresas deben responsabilizarse de los comportamientos de sus empleados y ponerles fin. Especialmente en el caso de la seguridad en las discotecas #StopRacismo #Islamofobia",Message,Photo,0,403,,,,392,0,11,0,Perfilamiento racial
Twitter,https://twitter.com/EMMAMIC74170675/statuses/1516522151117213697,EMMAMIC74170675,4/19/2022 5:00 pm,"ELBARON_NEWS Jajajajaja que les expliquen que el litio,petróleo y todo lo del subsuelo es de la Nación desde 1917.pero el Bulto No tiene dinero Ni Idea como sacarlo y no crea que estamos nadando en el viernes y para sacarlo se necesita inversión extranjera y ING.especializados  naco ignorante https://t.co/3W16aGLPaC",Mention,Photo,304,0,"Tesistan, Jalisco, Mexico",Women,,0,0,0,0,Odio
Twitter,https://twitter.com/Alfredo54267811/statuses/1516520251923566594,Alfredo54267811,4/19/2022 4:52 pm,"MemeYamelCA Y por cierto la muy jija, no se hizo responsable. Así es de clasista y racista es esta diputada, por eso la,apoya la inclita @LillyTellez 
@MemeYamelCA",Mention,Text Only,49,0,"Colonia Lindavista, México, Mexico",Men,,0,0,0,0,
Twitter,https://twitter.com/maomelca/statuses/1516519737412440073,maomelca,4/19/2022 4:50 pm,"arr1910 López, vulgar porro resentido social “ engaña bobos”",Mention,Text Only,501,0,Mexico,Women,,0,0,0,0,Backlash
Twitter,https://twitter.com/PedroAlcantar22/statuses/1516516590740811786,PedroAlcantar22,4/19/2022 4:38 pm,"SoniaSenz4 Por el solo hecho de ser panistas, sabemos que son deshechos sociales, sus pensamientos y creencias son deleznables, clasistas",Mention,Text Only,470,0,"Coyoacan, Mexico City, Mexico",,,0,0,0,0,
Twitter,https://twitter.com/FERDESSAVRE/statuses/1516515058448314372,FERDESSAVRE,4/19/2022 4:32 pm,m_ebrard Que se alegra!! Tienen a puro naco en las embajadas!! (Los nuevos ),Mention,Text Only,836,0,"Ixtapa, Jalisco, Mexico",Men,,0,0,0,0,Odio
Twitter,https://twitter.com/JuampiSwan/statuses/1516514650590003200,JuampiSwan,4/19/2022 4:30 pm,pequenogoebels Impresionante ver lo bajo que caen ustedes con tal de justificar su discriminación. No se sorprenda cuando termine en prisión.,Mention,Text Only,369,0,"Magdalena Contreras, Mexico City, Mexico",Men,,0,0,0,0,
Instagram,https://www.instagram.com/p/Cci6RNpOwRy/,,4/19/2022 4:07 pm,"//NOVEDADES L.A.S.O.S//
 abierta y Gratuita.
En el marco del curso ""Aprendizajes Interculturales: herramientas para la diversidad y la inclusión"" te invitamos a esta actividad gratuita. Para recibir el link del zoom completa este formulario: https://forms.gle/hFefc7ckFaYBwxN57

#interculturaleducation 
#interculturalidad #politicaspublicas 
#racismo 
#educacioninternacional",Message,Photo,0,8,,,,6,0,2,0,
Instagram,https://www.instagram.com/p/Cci34ZMqvg3/,,4/19/2022 3:46 pm,"La #educación no cambia el mundo, pero cambia a la gente que va a cambiar el mundo. 

Por ello, el Plan Director por la Convivencia y Mejora de la Seguridad en los Centros Educativos y sus Entornos es fundamental para informar a los alumnos/as sobre los principales problemas de #seguridad y formarles en las herramientas para evitar que se conviertan en víctimas de todo tipo de #delitos.

Este Plan ofrece todo tipo de charlas sobre #acosoescolar, Internet y #redessociales, adicciones, #Racismo, #discriminación e #intolerancia #LGTBI y Violencia sobre la mujer
 
Hoy, tocaba sobre #bandasjuveniles porque las bandas no son un juego, son un camino muy peligroso que te conducen a un lugar muy oscuro: cometer delitos y perder tu vida o la de tus amigos. 

Gracias al IES Imperatriz María de Austria en #Carabanchel y a 
policianacional por hacerlo posible.",Message,Photo,0,72,,,,69,0,3,0,Género
Twitter,https://twitter.com/miguelazcano/statuses/1516500116286455813,miguelazcano,4/19/2022 3:32 pm,"versuserwin Esto es un tanto clasista mi buen amigo, tu no eres así... ¿Qué pasó? ¿no me digas que te convertiste al lado oscuro de la fuerza? Qué se exhiba la traición, el ultraje y ña hipocresía, eso es más vergonzoso qué no terminar la escuela...",Mention,Text Only,347,0,"Progreso de Alvaro Obregon, Hidalgo, Mexico",Men,,0,0,0,0,
Instagram,https://www.instagram.com/p/Cci1rS_qYSf/,,4/19/2022 3:27 pm,"🕯️Las tradiciones y rituales ligados a la religión pueden reducir el malestar que supone el proceso migratorio.

 ¿Consideras que la religión puede ser una fuente de apoyo en esta situación?

✝️☪️🕉️☸️✡️🔯🕎☯️☦️

✅ En el próximo post os daremos algunas claves acerca de este tema

#CONOCIMIENTOSSINFRONTERAS

#HistoriasSinFronteras #nuevoproyecto #psicología #saludmental #migración #procesosmigratorios #racismo #xenofobia #concienciar #visibilizar #integración #aculturación #acomodación #testimonios #conocimientos #cuentos #educación",Message,Photo,0,12,,,,12,0,0,0,
Twitter,https://twitter.com/rocio_union/statuses/1516495982862741509,rocio_union,4/19/2022 3:16 pm,"SandraCuevas_ @diorlvprada @maryjosegamboa Ajá sí, ya me la creí que la señora Cuevas acaba con los males de la Alcaldía Cuauhtémoc. Nefasta acomplejada.",Mention,Text Only,2725,0,"Acatzingo, Puebla, Mexico",Women,,0,0,0,0,
Twitter,https://twitter.com/Carlos4545Jcb/statuses/1516492125365587971,Carlos4545Jcb,4/19/2022 3:01 pm,"No m4m3s, si solo te dan 2 minutotes, ridícula @LillyTellez y sigues con tu comentarios clasistas y racistas p3nd3ja https://t.co/cFw83OQDyp",Message,Photo,213,0,"Casa Blanca, Puebla, Mexico",Men,,0,0,0,0,
Twitter,https://twitter.com/Sssil_/statuses/1516481117343215618,Sssil_,4/19/2022 2:17 pm,"Clases de biología quiere dar el cñor q le dice “alcancía” a la vulva.
Neta no lo comparto para darle eco al discurso de odio -porque eso es- sino para q vean las opiniones ridículas a las q se aferran y q nope, no llegan a categoría de argumentos. Discriminación y antiderechos. | QT: – ¿No merecen ser tratados con amor?
– En cuanto a homosexuales, no.
Esto declaró Juan Sandoval Íñiguez, arzobispo emérito de Guadalajara
Entrevista completa en La Octava: https://t.co/v4oynGiHdz https://t.co/TftPdAeukF",Message,Text Only,434,2,"Miguel Aleman (La Doce), Sonora, Mexico",,,1,0,0,1,
