Network,Message URL,Profile,Date,Message,Type,Content Type,Followers,Engagements,Location,Likes,Dislikes,Comments,Shares,Theme
Instagram,https://www.instagram.com/p/CdcUf66LTHV/,,5/11/2022 11:13 pm,"No, la inclusión forzada no existe; lo que existe es la exclusión normalizada.

En México, así como en Latinoamérica, existe esta tendencia poco racional a querer convertirse en este amo hegeliano que es representado en la industria a través de comportamientos tóxicos disfrazados de clase y glamour; es, en esta falta de consciencia social, en donde el latino promedio se queja de la «inclusión forzada» sin comprender que su estado latino lo ha hecho a ojos de la industria y el sistema, una “minoría” que salta de la falsa normalidad que nos vende el entretenimiento. 

No, la inclusión no es forzada; y el simple hecho de llamar “inclusión” a la representación diversa en etnia y sexualidad que existe en el planeta, indica lo muy adoctrinados que estamos, alienados en este heteropatriarcado que nos indica que los medios deben ser ocupados por personas blancas y privilegiadas que se convierten en líderes de opinión para aquellos esclavos que no sueñan con liberarse de sus cadenas, sino convertirse en amos.

No, tu infancia no va a destruirse si le cambian el color a la Sirenita o la convierten en lesbiana para representar a las nuevas generaciones; pero el hecho de que lo creas y que tengas el descaro de indignarte por ello, habla de lo muy débil y frágil que es tu formación, dependiente de la industria, para poder tener modelos de comportamiento. Recuerda, la representación no está para ti, millennial maduro que está cerca de las cuatro décadas; sino para todos aquellos chicas, chicos y chiques que están en su proceso de crecimiento y formación, y que, como tú en su momento, merecen sus voces sean escuchadas.

La generación no es de cristal, compa; pero tu fragilidad histérica ante el cambio, sí.

#sinkuerda #inclusion #inclusión #feminismo #lgbt #racismo",Message,Photo,0,22,,15,0,7,0,Sexodiversidad
Twitter,https://twitter.com/SofiaAltieri/statuses/1524586267576455168,SofiaAltieri,5/11/2022 11:04 pm,"Awante el arte callejeroooo los museos siempre han tenido los mismos pedos que las galerías pero la calle sigue siendo de todxs 🔪🔪🔪 | QT: Un joven en prisión me cuenta entusiasmado que fue por 1ª vez a un museo. Pregunto a cuál.

""A ese de la tolerancia, donde hablan de Hitler"", dice.

Le pregunto por qué nunca había ido a un museo.

Se ríe y dice: ""Ay, a poco con este color de piel me iban a dejar entrar ahí"".",Message,Text Only,5229,0,"Casa Blanca, Puebla, Mexico",0,0,0,0,
Twitter,https://twitter.com/andres_cubo/statuses/1524583439269253127,andres_cubo,5/11/2022 10:53 pm,"Se me hace muy de prietos en aprietos que usan en exceso Cringe y nunca Ñáñaras. ¿No que hay que hablarles en español a gringos acá, tirar el sistema colonial occidental y revivir a Mictecacihuatl?",Message,Text Only,1584,0,"Cuauhtemoc, Mexico City, Mexico",0,0,0,0,
Twitter,https://twitter.com/EdwardDPichales/statuses/1524582600630849537,EdwardDPichales,5/11/2022 10:49 pm,"#TecNMCampusCancúnInforma
Asiste y #Culturízate 
XVIII Jornada Literaria ""La No Discriminación""
Mayo 11, 2002 - Aula Magna
Entrada libre
#SomosTecNM #TodosSomosTecNM #somostucanes https://t.co/k8oZtbygaB",Message,Link,29,0,"Cancun, Quintana Roo, Mexico",0,0,0,0,
Twitter,https://twitter.com/EdwardDPichales/statuses/1524581140165660672,EdwardDPichales,5/11/2022 10:44 pm,"#TecNMCampusCancúnInforma
Asiste y #Culturízate 
XVIII Jornada Literaria ""La No Discriminación""
Mayo 11, 2002 - Aula Magna
Entrada libre
#SomosTecNM #TodosSomosTecNM #somostucanes https://t.co/4ADLTXI2Qj",Message,Link,29,0,"Cancun, Quintana Roo, Mexico",0,0,0,0,
Instagram,https://www.instagram.com/p/CdcQ6c1OPDx/,,5/11/2022 10:42 pm,"Los medios de comunicación tampoco son la excepción al momento de presentar contenido cuestionable, por lo que hay que prestar mucha atención a lo que consumimos en estos y no pasar por alto ciertos comportamientos.
Puedes encontrar información adicional aquí: https://alertacontraelracismo.pe/observatorio/racismo-y-medios-de-comunicacion

#racism #racismo #blacklivesmatter #peru",Message,Photo,0,12,,12,0,0,0,
Twitter,https://twitter.com/angelinferno8/statuses/1524578021293707266,angelinferno8,5/11/2022 10:31 pm,"NO AUTORIZO a Ary Borovoy como diputado.
NO AUTORIZÓ a Silvia Pinal siendo explotada en el ocaso de su vida.
NO AUTORIZÓ otra temporada de la más draga.
NO AUTORIZÓ que en pleno 2022 aún existan chairos con carteras y maestrías.
NO AUTORIZÓ acomplejados quejándose del privilegió.",Message,Text Only,563,0,Mexico,0,0,0,0,
Twitter,https://twitter.com/uziel_mendoza/statuses/1524575482049708033,uziel_mendoza,5/11/2022 10:21 pm,MILYLUPEREYESC1 @BetoLealX2 Ser prieto es chido 😎,Mention,Text Only,356,0,"Tantoyuca, Veracruz, Mexico",0,0,0,0,
Twitter,https://twitter.com/sebmendozaalvar/statuses/1524574287092490241,sebmendozaalvar,5/11/2022 10:16 pm,BetoLealX2 De los Prietos🤣,Mention,Text Only,673,0,"Veracruz, Veracruz, Mexico",0,0,0,0,
Twitter,https://twitter.com/DTJuanTorresP/statuses/1524568516371763201,DTJuanTorresP,5/11/2022 9:53 pm,"Seguimos con trabajos Físico Técnico, trabajo de movilidad para transiciones, conservación del balón con superioridades, recuperación con inferioridad, velocidad, resistencia y más #DTJuanTorresPérez #DT_Juan_Torres_Pérez #entrenandofutbol #pasiónporelfutbol #Ejercicosdefutbol https://t.co/mIR1aj3jug",Message,Video,12,0,"Ixtapa, Jalisco, Mexico",0,0,0,0,
Twitter,https://twitter.com/jonathan_landa/statuses/1524560649719730176,jonathan_landa,5/11/2022 9:22 pm,"#lahipotenusa No saben ni lo que quieren están bien perdidos pobrecitos son tan minúsculos! Les gusta tirar la piedra y esconder la mano! | QT: -""Nosotros, los mexicanos de bien, los antiAMLO, los que sí pagamos impuestos, los que generamos empleos, los blanquitos, a diferencia de los chairos resentidos violentos ignorantes y huevones, estamos en contra de la división entre mexicanos.""",Message,Text Only,377,0,"Cuauhtemoc, Mexico City, Mexico",0,0,0,0,"Backlash, Odio"
Twitter,https://twitter.com/27Analeon/statuses/1524558951433457664,27Analeon,5/11/2022 9:15 pm,Había visto en Tiktok que eran bien mamones ahí y esas cosas clasistas pero la neta 👌🏻 controlaron a mi chamaco y encontré lo que buscaba jajajaj  10/10,Mention,Text Only,225,0,"Guadalajara, Jalisco, Mexico",0,0,0,0,
Twitter,https://twitter.com/MaraMarvalMarv2/statuses/1524558884416876545,MaraMarvalMarv2,5/11/2022 9:15 pm,"La verdad considero que se trata de discriminación y exclusión por parte del club , las chica están en traje de baño como todos y disfrutando su día. El club actúa haciendo juicios de valor sobre sus usuarios y tratándolos por clases, como si hubiera mejores personas que otras | QT: El pasado domingo, un caballero tomó la decisión de contratar sexo servidoras e invitarlas a pasar una tarde relax en las alberquitas. https://t.co/TuZfZuYCYe",Message,Text Only,4989,0,"Colonia del Valle, Mexico City, Mexico",0,0,0,0,
Instagram,https://www.instagram.com/p/CdcEyaLs6T2/,,5/11/2022 8:56 pm,"Vivimos en un mundo donde todos somos iguales y no debería existir el odio 🤍

#discriminacion #racismo #lgbt #discrimination #diversidad #derechoshumanos #igualdad #inclusion #violenciadegenero #homofobia #xenofobia #discapacidad #violencia",Message,Photo,0,42,,39,0,3,0,
Twitter,https://twitter.com/karmachaosmx/statuses/1524552785089466373,karmachaosmx,5/11/2022 8:51 pm,"alekspizana @Katt96134883 @iDanielSolis @zanermtz @Jazmn6001 Mmmmm defendiendo un punto con clasismo.

Interesante",Mention,Text Only,248,0,"Cuautitlan, México, Mexico",0,0,0,0,
Instagram,https://www.instagram.com/p/CdcCdsZNtZ1/,,5/11/2022 8:36 pm,"Ciclo Mixto
PE (Panel de Expertos)
Tópico: Discriminación mundial como problema cultural.
Casos a estudiar: 
a) Discriminación religiosa.
b) Discriminación racial.

En la actualidad, la discriminación racial y religiosa, a pesar de haber dejado de ser tan intensa, sigue siendo considerada un cáncer en la sociedad.

En 2018, El Banco Mundial informo sobre la inminente presencia de discriminación racial hacia las personas afroamericanas en América Latina, teniendo como consecuencia que estos sufran una desventaja ante las personas blancas y mestizas. 

De la misma forma, se han visto muchos casos de discriminación hacia minorías religiosas, lo cual es inaceptable.

Fuente principal: lafemun2022 
#lafemun #modelodenacionesunidas #2022 #discriminacion #racismo #discriminaciónracial #discriminaciónreligiosa",Message,Photo,0,3,,3,0,0,0,
Instagram,https://www.instagram.com/p/Cdb-p-6sPu8/,,5/11/2022 8:02 pm,"CIERRE DE TEMPORADA 
Domingo 15 de Mayo con la más reciente producción del formato de teatroporwhatsap_deca

Domingo 6:30 pm en el teatrobernardoromerolozano conmemorando el mes de la afrocolombianidad! ❤️

Reserva tus entradas en el WhatsApp 312-3514148 📲 Link directo en la BIO ☝️

“SHAILA, una heroína entre cadenas” 

¿Ya la viste? 
¿Ya hiciste parte de esta pieza interactiva y didáctica? 

🎬Una producción de decateatro 
🎥Dirección de danieldecacalderon 
📝Escritura de edvegaescritor 
🎭Con la actuación de aura.xbalanta kells_singer james_artista quiquesanmartin zambodeamerica absalonyafropacifico jefferssonq leopoldarojasmena

#teatro #TeatroPorWhatsapp  #teatrocolombiano #theatre #theatrelife #art #arte #ArteBogotá #actor #actorcolombiano #friends #actors #lifestyle  #afro #workoutmotivation #workout #work #trabajo #photooftheday #photographer #blackpower #photography #working #love #happy #afrocolombia #afroart #Actriz #esclavitud #racismo",Message,Photo,0,11,,10,0,1,0,
Twitter,https://twitter.com/TaniaOrVe/statuses/1524538240656711680,TaniaOrVe,5/11/2022 7:53 pm,"liliammejia02 @agusantonetti @XiomaraCastroZ Hay que trabajar ese complejo de inferioridad, eh?!",Mention,Text Only,12137,0,"Colonia del Valle, Mexico City, Mexico",0,0,0,0,
Instagram,https://www.instagram.com/p/Cdb82BrOWIu/,,5/11/2022 7:47 pm,"¿Has sido víctima de discriminación o racismo? ¿Sabías que lo puedes denunciar? Ayúdanos a erradicar este mal de nuestra sociedad denunciando.
#racismo #discriminacion #denuncia #peru",Message,Photo,0,11,,11,0,0,0,
Twitter,https://twitter.com/bisturitx/statuses/1524534446774374400,bisturitx,5/11/2022 7:38 pm,"XtianMinrod No tiene la culpa el indio, si no el que lo hace compadre. No sirve para nada pero un bien de médicos también lo hacen",Mention,Text Only,1580,0,"Veracruz, Veracruz, Mexico",0,0,0,0,Origen cultural
Twitter,https://twitter.com/V1ckyuresti/statuses/1524530892504449026,V1ckyuresti,5/11/2022 7:24 pm,Rob23958443 @chavodelchoro @ANTOARGAEZ2005 @Diana_Libreros Che resentido social y resentido de género. Espero no tengas hermanas.,Mention,Text Only,1681,0,"Magdalena Contreras, Mexico City, Mexico",0,0,0,0,Backlash
Twitter,https://twitter.com/cocrajuve/statuses/1524530866617204736,cocrajuve,5/11/2022 7:24 pm,"¿Ideas?
Solo necesito saber una ""idea"" por favor solo una, es para una tarea.
🙏🏼
Que significado tiene ""ideas"" ????
Ser lacayo de un ignorante, inepto, resentido, sucio, misógino, mitómano, macaco croquetero de un viejo guango no son ideas.
Saludos. | QT: Lo normal, atacan a @CitlaHM por su físico porque no pueden contra sus ideas.

Abrazo solidario.",Message,Text Only,324,0,"Santa Rosa Jauregui, Querétaro, Mexico",0,0,0,0,"Backlash, Género"
Twitter,https://twitter.com/_luisquinonez/statuses/1524529747027390464,_luisquinonez,5/11/2022 7:19 pm,No lo pudo haber dicho mejor | QT: como voy a ser clasista si yo también tomo shots de $10 en la feria,Message,Text Only,496,0,Mexico,0,0,0,0,
Twitter,https://twitter.com/CesarCortes61/statuses/1524523559326003201,CesarCortes61,5/11/2022 6:55 pm,"jgnaredo @LillyTellez Claro que lo dice de manera tacita.

Racistas, clasistas, aspiracionistas, trepadores, hipócritas, traidores, inmorales, conservadores, adversarios, entre otros.

O sea que tú amo si puede hacer y decir lo que sea?

Tienen la piel muy delgadita.",Mention,Text Only,1369,0,"San Andres Cholula, Puebla, Mexico",0,0,0,0,
Twitter,https://twitter.com/varamburucano/statuses/1524519965000314880,varamburucano,5/11/2022 6:40 pm,"Espejito, espejito: ¿cuál es el partido más machista, xenófobo, misógino, clasista, racista y homofobo de México?

Sí, @AccionNacional https://t.co/gYctOoqxhA | QT: No sólo los van a afiliar al IMSS, sino que guatemaltecos y salvadoreños, ¡También tendrán CURP‼️

Que no nos extrañe que mañana puedan votar y tengan becas pagadas por los impuestos de los mexicanos.
 https://t.co/YkktSkpjee",Message,Photo,7426,0,"Colonia del Valle, Mexico City, Mexico",0,0,0,0,"Sexodiversidad, Género"
Instagram,https://www.instagram.com/p/CdbzEw3parJ/,,5/11/2022 6:21 pm,"Ahora entiendo a marbelle.oficial 
Esto no es una campaña #politica es una #campaña en contra del #bullying  #racismo #clasismo y la #ignorancia 
Dejo este paralelo por acá para que entendamos un poco la dinámica del país y el perfil profesional de las personas que acosan , se burlan y critican sin fundamentos. franciamarquezm que ejemplo de #mujer colombiana luchadora una verdadera #bichota #masamor #blacklivesmatter #afro #lidersocial #colombia laorejaroja
Disculpen la edición ☺️ cucuenblanco no me ha enseñado; esto fue en un ratico libre ❤️❤️❤️",Message,Video,0,3,,3,0,0,0,Género
Twitter,https://twitter.com/Jess44099828/statuses/1524506311542640640,Jess44099828,5/11/2022 5:46 pm,_ryo_hermoso En pedazos está la oposición totalmente derrotada sin propuestas solo gritos y odió rasistas clasistas corruptos hipócritas y lo peor traídores del pueblo,Mention,Text Only,1107,0,"Miguel Hidalgo, Mexico City, Mexico",0,0,0,0,
Twitter,https://twitter.com/DiabulusT/statuses/1524506032965402626,DiabulusT,5/11/2022 5:45 pm,"Tu_IMSS gracias por el pésimo trato de todo el personal, los juicios de valor emitidos por el mismo, la falta de medicamentos y sobre todo, que sigan pensando que toda fiebre es covid.

De antemano, gracias. La discriminación a todo lo que da.",Mention,Text Only,392,0,"Miguel Hidalgo, Mexico City, Mexico",0,0,0,0,
Twitter,https://twitter.com/UrsulaBethManzo/statuses/1524505004710797314,UrsulaBethManzo,5/11/2022 5:41 pm,De lo mismo que ella es así de recortona con otras señora y mira como se le ven las varices😱a esa viejita y yo🙄y mira las nalgas tan aguadas de esa muchacha… y yo ay mamá y ¿a tí que te importa? Por eso estás tan acomplejada por lo recortona que tu eres. Así creció en 1578🤷🏽‍♀️,Mention,Text Only,1121,0,Mexico,0,0,0,0,
Twitter,https://twitter.com/LiberSeba/statuses/1524504888176226304,LiberSeba,5/11/2022 5:41 pm,"lafundacionsol Miserables, mentiroso y resentidos",Mention,Text Only,2795,0,"Cuauhtemoc, Mexico City, Mexico",0,0,0,0,Backlash
Twitter,https://twitter.com/nellop13/statuses/1524504849861259266,nellop13,5/11/2022 5:40 pm,Pues la realidad es que escondidos no estaban | QT: El anuncio de que 25 mil personas de Guatemala cotizarán en el Seguro Social en México ha servido para sacar a los racistas de sus guaridas.,Message,Text Only,3538,0,Mexico,0,0,0,0,
Twitter,https://twitter.com/KriztianRojaz/statuses/1524499955486007298,KriztianRojaz,5/11/2022 5:21 pm,"Imaginen q va a decir su fam cuando topen que anda ligando con un wey prieto ajajajaj, privilegiada 🥵 https://t.co/QYebHUuTuH",Message,Photo,49,0,"Colonia Lindavista, México, Mexico",0,0,0,0,
Twitter,https://twitter.com/Fernand29261778/statuses/1524499687012720643,Fernand29261778,5/11/2022 5:20 pm,"J_Pietra vamos con todo con el Inter, y en la noche gana mi @C_A_Morelia saludos prieta desde Morelia",Mention,Text Only,116,0,"Morelia, Michoacán, Mexico",0,0,0,0,
Twitter,https://twitter.com/THebalderrama/statuses/1524499539599757314,THebalderrama,5/11/2022 5:19 pm,Se quejan de la derecha por su clasismo y son iguales los “pro 4T” 🙄 | QT: Más de dos errores ortográficos y ya es considerado reggaetón 😉,Message,Text Only,867,0,"Ecatepec, México, Mexico",0,0,0,0,
Twitter,https://twitter.com/sergesca/statuses/1524495201078857731,sergesca,5/11/2022 5:02 pm,CaroBeauregard El conflicto está en tu cabeza racista y llena de Xenofobia! Atiende te primero y luego hablas de los centro americanos..con estadísticas verdaderas!,Mention,Text Only,151,0,"Cuauhtemoc, Mexico City, Mexico",0,0,0,0,
Twitter,https://twitter.com/rubmaza/statuses/1524494221830369281,rubmaza,5/11/2022 4:58 pm,"Conversando con futures mediques sobre el Protocolo para el Acceso sin Discriminación a la Prestación de Servicios de Atención Médica de las personas LGBTTTI. 

Gracias por la invitación. 🌈 https://t.co/vCT92tpqFl",Message,Photo,13879,0,"Monterrey, Nuevo León, Mexico",0,0,0,0,
Twitter,https://twitter.com/Bbataelpit/statuses/1524492738481344512,Bbataelpit,5/11/2022 4:52 pm,"MSNMex Ese vjt porro se ríe ríe ríe de todo,  imbecil naco estulto https://t.co/DkezTGUpu9",Mention,Photo,43,0,"Tlalpan, Mexico City, Mexico",0,0,0,0,Odio
Twitter,https://twitter.com/boss4x5/statuses/1524491638508179457,boss4x5,5/11/2022 4:48 pm,"Ciertísimo!!!
Tartufo... Cada día es más cínico para convertir a México en dictadura narco-sociaslista. Así que fue por refuerzos para adoctrinar a resentidos sociales, huevones y ansiosos al protagonismo para exigir $uParte del botín que generó el pueblo trabajador y emprendedor | QT: Ni esos médicos cubanos son médicos, ni los secretarios de defensa y Marina  fueron a Cuba a pasear , y  ni tampoco inasistir a la cumbre es casualidad ...
Esto no huele nada bien !",Message,Text Only,181,0,"Casa Blanca, Puebla, Mexico",0,0,0,0,Backlash
Twitter,https://twitter.com/PoloVidal4/statuses/1524485374067707904,PoloVidal4,5/11/2022 4:23 pm,"fisgonmonero @_VicenteSerrano Al chillón corriente y vulgar de Vicente Marrano. Otro ignorante, resentido y mitómano como el invasor paracaidista de Palacio Nacional.",Mention,Text Only,5,0,"Villahermosa, Tabasco, Mexico",0,0,0,0,Backlash
Twitter,https://twitter.com/Namy17/statuses/1524485168031019008,Namy17,5/11/2022 4:22 pm,"¡Sí, estoy de pinches malas! Anoche un vecino naco se quejó que mi gatita le tira la basura y el muy peneque se ofendió e hizo un desvergue porque le dije que no había problema que yo le compraba un bote de basura para que no volviera a pasar eso. Corte a...",Message,Text Only,271,0,"Merida, Yucatán, Mexico",0,0,0,0,Odio
Instagram,https://www.instagram.com/p/CdblZsbuluS/,,5/11/2022 4:22 pm,"Es necesario ser conscientes de las frases que se normalizan y que siguen perpetuando el racismo, no solo si las has escuchado, dicho o recibido, esa realidad que viven las mujeres afro es importante visibilizar y reflexionar, el trasfondo de estas frases.

Cada semana daremos un espacio de diálogo y reflexión a diferentes frases, para nosotros es importante crear este espacio de discusión con su apoyo.

Cuéntanos en los comentarios.
🙄
#afro #colombia #racism #racismo #diálogo #reflexión",Message,Photo,0,264,,261,0,3,0,Género
Twitter,https://twitter.com/CrisElGeek/statuses/1524483997883150336,CrisElGeek,5/11/2022 4:18 pm,"Si hay rockeros prietos porque no pistoleros güeros | QT: Los Alemanes AMAN la Música Norteña 🤠🇩🇪
Créditos: Los Pistoleros Gueros https://t.co/hZAGAf3r56",Message,Text Only,314,0,"Villa de Costa Rica, Sinaloa, Mexico",0,0,0,0,Odio
Instagram,https://www.instagram.com/p/Cdbii6qInas/,,5/11/2022 3:57 pm,"👇👇👇 Tipos de discapacidades y sus características

👉Discapacidad física: Las personas con discapacidad física o motora presentan una alteración en su aparato locomotor debido a un mal funcionamiento de los sistemas nervioso, muscular, y/o óseo-articular. Esta alteración dificulta o imposibilita la movilidad funcional de una o varias partes del cuerpo.Esta puede ser transitoria, por ejemplo debido a inmovilizaciones por traumatismos o permanente como las producidas por procesos infecciosos, por malformaciones neurológicas o accidentes.

👉Discapacidad sensorial: Las personas con discapacidad sensorial, debido a la afectación de uno o varios de los sentidos, presentan una disminución importante del volumen de información que recogen del ambiente que les rodea. Atendiendo al sentido afectado se clasifican en:
●Discapacidad visual: Hace referencia a la pérdida o disminución de la visión, englobando toda la etiología y grados de severidad.
●Discapacidad auditiva: Se define como la pérdida o anormalidad funcionalidad del sistema auditivo y tiene su consecuencia inmediata en una dificultad para oír, lo que implica también dificultades en el acceso al lenguaje y el habla.

👉Discapacidad intelectual: Implica una serie de limitaciones significativas en las habilidades que la persona aprende para funcionar en su vida diaria, comprender el entorno e interactuar con el mismo. Las personas con discapacidad intelectual tienen dificultades en las habilidades cognitivas, es decir, todas aquellas relacionadas con el procesamiento de la información: atención, percepción, memoria, resolución de problemas, comprensión, establecimiento de analogías,…

Además de estos tres grandes grupos de discapacidad, otras clasificaciones menos conocidas diferencian entre:

●Discapacidad psíquica
●Discapacidad visceral
●Discapacidad múltiple

Si quieres que explique un poco más sobre estos tres últimos tipos de discapacidad, dime de las comentarios.
.
.
. 
#pcd
#discapacidad
#deficiência
#capacitismo
#racismo
#flamenco
#ciganos
#gitanos
#gitanas
#opreroma
#Antigitanismo",Message,Photo,0,115,,114,0,1,0,
Instagram,https://www.instagram.com/p/Cdbg-TLuNmj/,,5/11/2022 3:43 pm,"Esta es una de las razones por las cuales el racismo es incorrecto y no debe de practicarse, ya que hace sentir mal a la gente que lo sufre 
#racism #todosiguales #igualdad #racismo #racismisavirus",Message,Photo,0,63,,63,0,0,0,
Instagram,https://www.instagram.com/p/Cdbg2ENDM1I/,,5/11/2022 3:42 pm,"😍El libro recomendado de esta semana es ""Nuestra Piel Arcoíris"", escrito por la psicóloga Manuela Molina Cruz mindheart.kids e ilustrado por Natalia Agudelo sellic.studio , ambas colombianas, y publicado por Penguin Random House.

🤓Este libro informativo explica en un lenguaje sencillo las razones por las cuales las personas tienen la piel de distinto color debido a la cantidad de melanina presente en su cuerpo. 

😊Las ilustraciones complementan el texto y le ayudan a los pequeños lectores a comprender que, a pesar de las diferencias, todos somos iguales y que el color es un regalo de nuestros ancestros. 

🔥“Nuestra Piel Arcoíris”nuestrapielarcoiris aborda con tacto el tema de los prejuicios, la discriminación y el racismo e invita a los niños/as a usar su “gran voz” para defenderse, cuidarse y hacer respetar sus derechos. 

💯Este libro puede ser una buena herramienta para tratar esta tematica con nuestros hijo/as migrantes que pueden ser victimas o ser testigos de discriminacion en su nuevo pais debido a su color de piel o el de sus padres.

🎉El libro se consigue en librerías en Colombia, Mexico, Chile, USA, Portugal y también está disponible en algunos países vía Amazon. 

❤️Si eres colombiano/a y estás criando a tu familia en el exterior, te invitamos a unirte a nuestra comunidad www.curubaycocuyo.com

#curubaycocuyo #primeroslectores #ilustracioninfantil #libroalbum #librorecomendado #LIJcolombiana #librosinfantilesrecomendados #librosinfantilesenespanol #leerencasa #leerenfamila #crianzabilingue #mamaslatinas #mamascolombianas #mamalatina #sehablaespañol #mamablogger #crianzamultilingue #mujermigrante #colombianosenelexterior 
#racismo #antiracismo",Message,Photo,0,16,,13,0,3,0,
Twitter,https://twitter.com/mikey_rg97/statuses/1524474709047484417,mikey_rg97,5/11/2022 3:41 pm,"WillyG60853342 @New11374141 No son criminales.
No puedes entender que a ella sus padres la están apoyando en sus decisiones?
Tanto te arde verla a ella feliz?
Eres un chillón y un resentido.",Mention,Text Only,105,0,"San Vicente Chicoloapan, México, Mexico",0,0,0,0,Backlash
Twitter,https://twitter.com/JAReusA/statuses/1524474251847348224,JAReusA,5/11/2022 3:39 pm,WeraReynoso Pero mejor que vaya Ebrard y no el naco y vergonzante presimiente. https://t.co/UKYhlPvzan,Mention,Photo,450,0,"Medina, Guanajuato, Mexico",0,0,0,0,Odio
Instagram,https://www.instagram.com/p/Cdbf8HzOCX-/,,5/11/2022 3:34 pm,#racismo#vendedor#,Message,Photo,0,22,,22,0,0,0,
Instagram,https://www.instagram.com/tv/CdbfGWCIU68/,,5/11/2022 3:27 pm,"Artemisa Samedo nació en Cabo Verde, pero a los cinco años llegó a Galicia acompañada de su madre y de su hermano mayor para reunirse con su padre. Pasó por la Universidad de A Coruña y comenzó a formar parte del colectivo afrogalegas, desarrollando diferentes proyectos artísticos. En la actualidad es una activista que se encarga de contar la realidad de las mujeres negras y el feminismo ✊🏽

#femenismo #mujer #activismo #racismo",Message,Video,0,3,,3,0,0,0,Género
Twitter,https://twitter.com/peryguay/statuses/1524470945833967616,peryguay,5/11/2022 3:26 pm,jfiliberto @mauril99 @AlanAdameMX @JJDiazMachuca @Garcimonero @Antizombies @caracusmx @VivoEnLeon @habibland @DeniseMeadeG @cuartodemillamx @ShelzyMx @Dafneconefe Totalmente de acuerdo..es un acomplejado a todas luces ....además de tantos adjetivos calificativos nefastos....hipócrita ....mitómano ..etc etc etc,Mention,Text Only,262,0,Mexico,0,0,0,0,
