Network,Message URL,Profile,Date,Message,Type,Content Type,Followers,Engagements,Location,Gender,Age,Likes,Dislikes,Comments,Shares,Theme
Twitter,https://twitter.com/FelixHdz2/statuses/1514823762356621312,FelixHdz2,4/15/2022 12:31 am,"Con todo respeto, no debería sentir orgullo todo lo contrario hace demasiada falta erradicar el analfabetismo en nuestro país, pero claro eso no le conviene a ciertos políticos, un pueblo educado se daría cuenta que no todo es como se lo pintan. | QT: Dice el clasista de Martín Moreno que a mí sólo me apoyan los analfabetas del país, lo cual, dicho sea de paso, me llena de orgullo porque, entre otras cosas, no es lo mismo educación que cultura. 1/2 https://t.co/PsxAPNwXvp",Message,Text Only,481,0,Mexico,Men,,0,0,0,0,
Twitter,https://twitter.com/gotf74/statuses/1514823099992223745,gotf74,4/15/2022 12:29 am,"SergioSarmiento No pueden negar su ADN, son priistas resentidos con el viejo régimen, pero aman sus prácticas mañosas, saben que eso los perpetuo en el poder por más de 70 años, y los morenos quieren repetir la misma película.",Mention,Text Only,151,0,"Ciudad Lopez Mateos, México, Mexico",Men,,0,0,0,0,Backlash
Instagram,https://www.instagram.com/p/CcW7pvOs4sz/,,4/15/2022 12:29 am,"El es olivier_rousteing
 y todo en su vida es DESTACABLE empezando por ser el  primer ⭐diseñador mestizo⭐ a cargo de la #direccióncreativa de la maison balmain
Oliver nace en un orfanato, en 1986 a los 5 días es adoptado por una pareja blanca de orígenes modestos de la zona de Burdeos, Francia.
A los 19 años estudia moda en la prestigiosa studiomodeparis ,antes de finalizar sus estudios entra a roberto_cavalli donde permanecera por 5 años .
Vuelto a París ingresa en balmain con solo 25 años de edad e inicia una revolucion donde atraviesa temas socioculturales como #genero #racismo #diversidad #sexualidad y como comunicar esta nueva era de la MoDa.
Es la historia de un verdadero niño prodigio o mejor dicho un #wonderboy como el nombre del documental que pueden ver por netflixargentinaoficial
Te aseguro que no es otro Documental del #fashionworld

Despues contame.",Message,Photo,0,30,,,,28,0,2,0,
Twitter,https://twitter.com/jondgce/statuses/1514822400512339968,jondgce,4/15/2022 12:26 am,"Vi ~La camarista~ y recordé como se debe tender la cama para que no queden arrugas.

También al fin vi ~Las niñas bien~ y confirmé que usar pupilentes de color es naco. Al menos desde 1982 que es cuando la historia de la película pasa. ;)",Message,Text Only,53,0,"Benito Juarez, Mexico City, Mexico",,,0,0,0,0,Odio
Instagram,https://www.instagram.com/p/CcW6bZeO-oV/,,4/15/2022 12:18 am,"Uno de relleno para no estar inactivos 👍🏻
-
-
-
-
-
-
-
-
-
❌❌❌IGNORAR❌❌❌
#meme#relleno#carrasca#racismo#piel#racism#negro#blanco#tipa#mujer#mujeres#todasmienten#xd#f#shitpost#piropo#chamuyo#hola#sigueme
❌❌❌IGNORAR❌❌❌",Message,Photo,0,32,,,,32,0,0,0,Género
Twitter,https://twitter.com/UriNoriega/statuses/1514817357088104452,UriNoriega,4/15/2022 12:06 am,"La desesperanza convertida en desesperación | QT: ¿Con esta sagacidad, el bodoque con obesidad mórbida es abogado en USA? @30JR41_ 

Curioso que hable de acomplejados porque si no fuera por ellos, el Benito Juárez wannabe de su papá, no sería tan populachero.

¡Un acéfalo aconsejando a @elonmusk! 😂🤣 https://t.co/fMnmh1p7Nl",Message,Text Only,278,0,"Tuxtla Gutierrez, Chiapas, Mexico",,,0,0,0,0,
Twitter,https://twitter.com/Pauxhis/statuses/1514815051210760196,Pauxhis,4/14/2022 11:57 pm,"Hay como ocho fichas al día de hoy, de mujeres y jovencitas desaparecidas en Oaxaca. Figura más una por encima de otras en la búsqueda; obviamente el fenómeno de clase, raza y orígen atraviesa éste accionar. Se comenta que hay clasismo y racismo, automáticamente: https://t.co/HgTbuLoAnL",Message,Photo,1364,0,"San Jeronimo Ixtepec, Oaxaca, Mexico",,,0,0,0,0,Género
Twitter,https://twitter.com/LtMarykarmen/statuses/1514814922365964299,LtMarykarmen,4/14/2022 11:56 pm,"No mms ya se parecen al vecino naco de zapopan, No Griten!!",Message,Text Only,2908,0,"Guadalajara, Jalisco, Mexico",,,0,0,0,0,Odio
Twitter,https://twitter.com/LaExTuitera/statuses/1514811007511629828,LaExTuitera,4/14/2022 11:41 pm,"Este pendejo con cual se droga, ya mejor dinos cuanto ganas... | QT: Con esa actitud, disposición y ganas de cambiar las cosas, @elonmusk debería empezar por limpiar @TwitterMexico. Dirigida por unos cuantos acomplejados simpatizantes de @felipecalderon, que lo único que hacen es llenar de bots @twitter para su absurda y patética guerra sucia 💩.",Message,Text Only,1244,0,"San Miguel de Allende, Guanajuato, Mexico",Men,,0,0,0,0,
Twitter,https://twitter.com/rolavp/statuses/1514809847677550597,rolavp,4/14/2022 11:36 pm,"30JR41_ te hablan #bodoquedelbienestar01 #JoseRamonLopezBeltran60 | QT: ¿Con esta sagacidad, el bodoque con obesidad mórbida es abogado en USA? @30JR41_ 

Curioso que hable de acomplejados porque si no fuera por ellos, el Benito Juárez wannabe de su papá, no sería tan populachero.

¡Un acéfalo aconsejando a @elonmusk! 😂🤣 https://t.co/fMnmh1p7Nl",Mention,Text Only,203,0,"Las Delicias, Baja California, Mexico",Men,,0,0,0,0,
Twitter,https://twitter.com/dnlhdz/statuses/1514805580887588870,dnlhdz,4/14/2022 11:19 pm,"Ya señor, por favor... trabaje | QT: Dice el clasista de Martín Moreno que a mí sólo me apoyan los analfabetas del país, lo cual, dicho sea de paso, me llena de orgullo porque, entre otras cosas, no es lo mismo educación que cultura. 1/2 https://t.co/PsxAPNwXvp",Message,Text Only,383,0,"Apodaca, Nuevo León, Mexico",Men,,0,0,0,0,
Twitter,https://twitter.com/Faby_Nava77/statuses/1514803521073266704,Faby_Nava77,4/14/2022 11:11 pm,"OOOOOIIIILLLOOOO al impresentable e irresponsable 🤬 #UsaCubrebocas 😷 | QT: Dice el clasista de Martín Moreno que a mí sólo me apoyan los analfabetas del país, lo cual, dicho sea de paso, me llena de orgullo porque, entre otras cosas, no es lo mismo educación que cultura. 1/2 https://t.co/PsxAPNwXvp",Message,Text Only,11584,0,"Veracruz, Veracruz, Mexico",,,0,0,0,0,
Twitter,https://twitter.com/garlogab/statuses/1514801913832693767,garlogab,4/14/2022 11:04 pm,"José Ramón López Beltrán @30JR41_
Te habla @Arouet_V 
Y yo lo secundo: eres un bueno para nada. | QT: José Ramón López Beltrán @30JR41_:

1) No soy bot.
2) El acomplejado eres tú que vives como rey gracias a papi.
3) En qué trabajas. Daniel Chávez, tu ""empleador"", fue beneficiado con un convenio por mil 83 mdp para transportar pasajeros las Islas Marías.
4) Sinvergüenza. https://t.co/WRUFoxDOsB",Message,Text Only,536,0,"Santa Rosa Jauregui, Querétaro, Mexico",Men,,0,0,0,0,
Twitter,https://twitter.com/anasoy_/statuses/1514801680419745805,anasoy_,4/14/2022 11:03 pm,"Que me apunten en la lista 🙋🏼‍♀️🫡🤗 | QT: Dice el clasista de Martín Moreno que a mí sólo me apoyan los analfabetas del país, lo cual, dicho sea de paso, me llena de orgullo porque, entre otras cosas, no es lo mismo educación que cultura. 1/2 https://t.co/PsxAPNwXvp",Message,Text Only,2354,0,"Colonia del Valle, Mexico City, Mexico",,,0,0,0,0,
Twitter,https://twitter.com/MariaSa00005452/statuses/1514798455507410954,MariaSa00005452,4/14/2022 10:51 pm,"Pués aquí tienes mas de muestras patéticas y guerras sucias . https://t.co/hj4cHVNVIt | QT: José Ramón López Beltrán @30JR41_:

1) No soy bot.
2) El acomplejado eres tú que vives como rey gracias a papi.
3) En qué trabajas. Daniel Chávez, tu ""empleador"", fue beneficiado con un convenio por mil 83 mdp para transportar pasajeros las Islas Marías.
4) Sinvergüenza. https://t.co/WRUFoxDOsB",Message,Photo,19,0,"Colonia del Valle, Mexico City, Mexico",Women,,0,0,0,0,
Twitter,https://twitter.com/alviruela/statuses/1514798187499835405,alviruela,4/14/2022 10:50 pm,c_dnielle @JLozanoA Acomplejados los conservadores que se arrodillan ante el poder económico y el imperialismo yanqui.,Mention,Text Only,12696,0,"El Pueblito, Querétaro, Mexico",Men,,0,0,0,0,
Twitter,https://twitter.com/LeticiaReynoso/statuses/1514790841549688832,LeticiaReynoso,4/14/2022 10:20 pm,PelonGomis Ni aguanta nada el trivago bueno para nada @30JR41_ y luego dice que el resentido es uno 😂,Mention,Text Only,771,0,"Chapala, Jalisco, Mexico",Women,,0,0,0,0,Backlash
Twitter,https://twitter.com/LoboDePuebla/statuses/1514788011308769288,LoboDePuebla,4/14/2022 10:09 pm,ItzA_Tinyr0wlet Precisamente ¿qué pendejo aseguraría que es discriminación hablar con la verdad científica?,Mention,Text Only,18,0,"Casa Blanca, Puebla, Mexico",,,0,0,0,0,
Twitter,https://twitter.com/dober77/statuses/1514786660071849993,dober77,4/14/2022 10:04 pm,"Chinga tu upta madre pinché naco miserable. | QT: Ustedes no se miden en las ofensas yo no me mediré en las respuestas, advertidos están.",Message,Text Only,1821,0,"Acapulco de Juarez, Guerrero, Mexico",,,0,0,0,0,Odio
Twitter,https://twitter.com/LoboDePuebla/statuses/1514785850688561158,LoboDePuebla,4/14/2022 10:01 pm,"Davidglzdgz @marcearmenta No es discriminación, es biología, realidad, lógica, sentido común, verdad, etcétera; no son mujeres, se creen mujeres, pero eso no debe obligar a los demás a vivir su fantasía o enfermedad mental.",Mention,Text Only,18,0,"Casa Blanca, Puebla, Mexico",,,0,0,0,0,Género
Instagram,https://www.instagram.com/p/CcWosqLALXB/,,4/14/2022 9:44 pm,"#Repost raquelobaton with let.repost 
• • • • • •
Acabo de ver este 
extraordinario vídeo de brutmexico en el perfil de lafatshionista . Es una joya! No puedes dejar de verlo. Si el tema te interesa te recomiendo ampliamente los libros “Fearing the black body” de Santina Strings y “Body of truth” de Harriet Brown.
En el vídeo participa también hannahtalksbodies , una activista Gorda que produce grandiosos vídeos informativos en temas de gordofobia y estigma de peso. 

Cobrar conciencia de cómo la gordofobia se intersecciona con el racismo y el sexismo es imperativo para la deconstrucción.

Posted withregram • brutmexico “Durante los últimos 300 años, los blancos han comercializado la gordura como un rasgo negro”.

¿Cuál es el vínculo entre la cultura de la dieta, la gordobia y el racismo? La investigadora Harriet Brown nos responde a esta pregunta…

#gordobobia #racismo #culturadeladieta",Message,Video,0,23,,,,23,0,0,0,
Twitter,https://twitter.com/marco_cervantes/statuses/1514777015416590343,marco_cervantes,4/14/2022 9:25 pm,"DeniseDresserG Deberías ir a la Alameda Central!, A la UAM, al IPN. Siempre el clasismo por delante! Que hueva!",Mention,Text Only,54,0,"Medina, Guanajuato, Mexico",Men,,0,0,0,0,
Twitter,https://twitter.com/V1ckyuresti/statuses/1514772639297912844,V1ckyuresti,4/14/2022 9:08 pm,"Siempre dicen “Virgencita de Guadalupe, mi morenita” 
y a las personas no las bajan de “prietos, negros y nacos” y de ver menos por su color. 
“Gente di merda e ipocrita”",Message,Text Only,1693,0,"Magdalena Contreras, Mexico City, Mexico",Women,,0,0,0,0,Odio
Instagram,https://www.instagram.com/p/CcWkSrMv_rK/,,4/14/2022 9:04 pm,"🤨🤨🤨

#barbie #humor #ramdom #shitpost #negro #racismo #memesenespañol #mexico #tienda #monkey",Message,Photo,0,6,,,,6,0,0,0,
Twitter,https://twitter.com/Brisa_M_Alvarez/statuses/1514767250720534533,Brisa_M_Alvarez,4/14/2022 8:47 pm,"MariettoPonce Cuando el naco se compra un Mercedes, naco se queda.",Mention,Text Only,267,0,"Tesistan, Jalisco, Mexico",,,0,0,0,0,Odio
Twitter,https://twitter.com/ameolguin_/statuses/1514766187829215233,ameolguin_,4/14/2022 8:42 pm,Estaba mame y mame y mame que quería un rubio de ojo azul para comprobar que lo mío lo mío son los prietos.,Message,Text Only,31,0,"Casa Blanca, Puebla, Mexico",,,0,0,0,0,
Twitter,https://twitter.com/van_damme2/statuses/1514765807598936067,van_damme2,4/14/2022 8:41 pm,"muafro2 @TenochHuerta @GobOax @ISBeauvoir @INPImx @Nayiten @JimenezMijane @OVelezA @nadgasman @Cimacnoticias @AnimalMX @Racismo_MX @CN_MujeresI Claro que no, tienen que ser productivas a la sociedad 😉 jajajaja jajajaja https://t.co/3wSD1YP320",Mention,Photo,1620,0,"Tesistan, Jalisco, Mexico",,,0,0,0,0,
Twitter,https://twitter.com/Wony007/statuses/1514763158048681988,Wony007,4/14/2022 8:30 pm,30JR41_ @Rafaherrera1983 @PelonGomis @elonmusk Bravo! Así se le contesta a un resentido que no es ni la sombra de su papá.,Mention,Text Only,204,0,"Coyoacan, Mexico City, Mexico",,,0,0,0,0,Backlash
Twitter,https://twitter.com/42Adolfo/statuses/1514757078505734155,42Adolfo,4/14/2022 8:06 pm,"Empieza por aquí con éste cómic.....porro resentido | QT: @latinus_us Hay quien participó con su abstención o señalando cualquiera de las opciones... PERO hay quien solo fue a hacerse el chistosito echando a perder la BOLETA, para escribir textos absurdos sin razón de ser ... https://t.co/WXjkB8uYmn",Message,Text Only,68,0,"Iztapalapa, Mexico City, Mexico",,,0,0,0,0,Backlash
Facebook,http://www.facebook.com/633767657076047/posts/1409968372789301,Racismo_MX,4/14/2022 8:04 pm,"Racismo MX y el ""Racistómetro"", primer observatorio sobre esta forma de discriminación | Gracias a Capital Por Cual por la entrevista. ¡No se pierdan el Racistómetro!",Message,Text Only,0,11,,,,8,0,0,3,
Twitter,https://twitter.com/JAReusA/statuses/1514755850820235271,JAReusA,4/14/2022 8:01 pm,"Gabo180166 @VicMac123 Una verdadera desgracia para México que su destino esté permanentemente en lucha en una poza de mierda donde los resentidos morenistas y sus rameras del PT y PVEM arrastran al país al retroceso via corrupción e impunidad, violando las leyes, mintiendo y atacando a periodistas. https://t.co/XqNaW2rJvy",Mention,Photo,447,0,"Medina, Guanajuato, Mexico",Men,,0,0,0,0,Backlash
Twitter,https://twitter.com/j_bautistaC/statuses/1514749267193212949,j_bautistaC,4/14/2022 7:35 pm,"Arouet_V @30JR41_ Tu eres el acomplejado. Mantenido, aprovechado. Sin vergüenza. Patetico. Que no deberías ni de opinar",Mention,Text Only,12,0,Mexico,Men,,0,0,0,0,
Twitter,https://twitter.com/MtroDelgado/statuses/1514748398112550916,MtroDelgado,4/14/2022 7:32 pm,"El titular de @Profeco Ricardo @SheffieldGto promociona consumo local en Guanajuato para este periodo vacacional.

@LorenaAlfaroG @irapuatogob @Neto_Prieto @MORENA_Gto @PANGuanajuato @lalolopezm @David_Saucedo_ @davidmunozt31 @lcmanzano @diegosinhue @JLMartinezNava @diegosinhue https://t.co/l20BmDiem9",Message,Video,1071,0,"Irapuato, Guanajuato, Mexico",Men,,0,0,0,0,
Twitter,https://twitter.com/gatusso100/statuses/1514742247081791498,gatusso100,4/14/2022 7:07 pm,"MariettoPonce Jaja pinches chairos, dale poder al indio",Mention,Text Only,153,0,"Iztacalco, Mexico City, Mexico",Men,,0,0,0,0,Origen cultural
Twitter,https://twitter.com/ElCavernal/statuses/1514737330707443719,ElCavernal,4/14/2022 6:48 pm,Cherry_Bomb_bom No puedo creerxwue se tan racista!,Mention,Text Only,49,0,"Guadalajara, Jalisco, Mexico",,,0,0,0,0,
Twitter,https://twitter.com/JimmysaurusZMl/statuses/1514736292587839492,JimmysaurusZMl,4/14/2022 6:44 pm,"Insisto, la transfobia está ligada con el clasismo.
Lo que no saben es que no hay cosa que ame más que ser Oaxaqueño. | QT: @JimmysaurusZMl Aquí el claro ejemplo que dios si castiga 2 veces oaxaco y j¤t○",Message,Text Only,156,0,"Oaxaca de Juarez, Oaxaca, Mexico",Men,,0,0,0,0,
Twitter,https://twitter.com/JimmysaurusZMl/statuses/1514735017313906702,JimmysaurusZMl,4/14/2022 6:39 pm,"sergio_techdent Ohh vaya, otro mas que saca los tintes clasistas.
Me sorprende? Claro que no.
Menos viniendo de un bato que claramente tiene problemas.
Ojalá trates la ira amigo, no me gustaría que un día agreda a tus hijos por decir algo fuera de lugar.
Salu2 bye.",Mention,Text Only,156,0,"Oaxaca de Juarez, Oaxaca, Mexico",Men,,0,0,0,0,
Twitter,https://twitter.com/PlanDeLaRastra/statuses/1514731147091222539,PlanDeLaRastra,4/14/2022 6:23 pm,"deniseramosm Ella habla de empleos dignamente remunerados y tú de 'donaciones'. Se te nota el clasismo de lejos. Y no, no soy obradorista.",Mention,Text Only,143,0,"Apatzingan, Michoacán, Mexico",Men,,0,0,0,0,
Twitter,https://twitter.com/florenciolozano/statuses/1514729307091968004,florenciolozano,4/14/2022 6:16 pm,"Que no fue por falta de energía eléctrica!!??? Ya andan locos de tanta nota jajajajaja
#NL | QT: Ante la falta de agua por cuatro días, vecinos de la colonia Independencia realizaron un bloqueo en la Avenida Morones Prieto, que causó complicaciones a la vialidad. 

#LasNoticiasMty #Bloqueo #Protesta #Vialidad https://t.co/MO7hZPyXVW",Message,Text Only,414,0,"Santa Catarina, Nuevo León, Mexico",Men,,0,0,0,0,
Twitter,https://twitter.com/samymtzl/statuses/1514727189584904207,samymtzl,4/14/2022 6:07 pm,"Asco de personas! Eso es su movimiento pedorro, la descripción clara de una bola de inadaptadas, frustradas y acomplejadas. | QT: Hoy mi mamá fue atacada afuera de la casa Okupa en la calle de Cuba por 4 mujeres encapuchadas. MI MAMÁ ESTABA DENTRO DEL COCHE CUANDO LA ATACARON. Estoy furiosa y muy triste de que estas cosas se hagan en nombre del feminismo. [1] https://t.co/NrFbUTAOET",Message,Text Only,149,0,"Las Delicias, Baja California, Mexico",Men,,0,0,0,0,Género
Twitter,https://twitter.com/Quersha_/statuses/1514726742262525953,Quersha_,4/14/2022 6:06 pm,__GordoG Racista,Mention,Text Only,1064,0,"Monterrey, Nuevo León, Mexico",Men,,0,0,0,0,
Twitter,https://twitter.com/luciernagamorr1/statuses/1514721118342553602,luciernagamorr1,4/14/2022 5:43 pm,"elonmusk @TwitterSeguro 
El sujeto @30JR41_, es el hijo de López, es un tipo que nunca ha trabajado, pero ahora vive como millonario en Estados Unidos, él y su padre no han podido comprobar cómo es que ahora vive tan bien.
Es una familia de corruptos, rateros y cínicos. | QT: José Ramón López Beltrán @30JR41_:

1) No soy bot.
2) El acomplejado eres tú que vives como rey gracias a papi.
3) En qué trabajas. Daniel Chávez, tu ""empleador"", fue beneficiado con un convenio por mil 83 mdp para transportar pasajeros las Islas Marías.
4) Sinvergüenza. https://t.co/WRUFoxDOsB",Mention,Text Only,393,0,"Iztapalapa, Mexico City, Mexico",,,0,0,0,0,
Instagram,https://www.instagram.com/tv/CcWMYMzo7RF/,,4/14/2022 5:36 pm,"Escuchad lo que dice esta mujer, miradlo hasta el final.  Viene del norte de África pero no de donde los negritos 🤔😠... #racismoentv #racismo",Message,Video,0,0,,,,0,0,0,0,"Tono de piel, Género"
Twitter,https://twitter.com/Manzano97337299/statuses/1514718725638864896,Manzano97337299,4/14/2022 5:34 pm,"tan_reales Jajajajajaja.  Te van a caer los políticamente correctos: Odian a los racistas...y a los negros, obviamente 🤭🤣😂.",Mention,Text Only,4193,0,"Magdalena Contreras, Mexico City, Mexico",,,0,0,0,0,
Twitter,https://twitter.com/luciernagamorr1/statuses/1514718597268054028,luciernagamorr1,4/14/2022 5:33 pm,"Cubre el perfil.. apoco no? | QT: Estar feo, naco y ser corrupto es el sello de los cuatreros? https://t.co/mpws0qOMOc",Message,Text Only,393,0,"Iztapalapa, Mexico City, Mexico",,,0,0,0,0,Odio
Instagram,https://www.instagram.com/p/CcWL3XLv2ci/,,4/14/2022 5:31 pm,"When: 😂😃
But: 😨😰

Si te gustan mis memes no te olvides en seguirme 🤑👇🏽👇🏽👇🏽👇🏽 
momosarnosos2.0 momosarnosos2.0 momosarnosos2.0 

•
•
•
•
•
•
•
.
.
.
.
•
•
(🔴IGNORAR🔴)
#shitpostmexico #chileanmemes
#memescebollo  #momoscorp #cmamut #legionholk #ellanoteama  #videosgraciosos #deepfriedmemes #momazo #memesespañol #memeslatinos #momoscorp #caídas #racoonunity  #mapachesombrero #shitpostingespañol #shitposter #memelatinoamerica #latinoamérica  #realmadrid #lobosgang #shitpost #shitposting #momos #momazos #racismo #shitpostlatino #shitpostinglatino #amongus #centroamerica",Message,Photo,0,35,,,,35,0,0,0,
Instagram,https://www.instagram.com/p/CcWK55qLlYW/,,4/14/2022 5:23 pm,"Racismo: un hincha de River tiró bananas a la tribuna de Fortaleza

Fue durante el partido que jugaron en el Monumental por la Copa Libertadores y provocó un repudio generalizado de los hinchas de ambos clubes

“River Plate manifiesta su más absoluto repudio ante los gestos racistas y xenófobos de un hincha hacia la parcialidad visitante, y comunica que ya está implementando las medidas correspondientes para identificar al culpable y aplicarle las debidas sanciones”, indicó el club en un comunicado

""Fortaleza Esporte Clube repudia con vehemencia el acto de racismo y xenofobia que tuvo lugar en el Estadio Monumental de Núñez por parte de un hincha del equipo local"", afirmó la entidad brasileña en sus redes sociales

“Somos 2 millones de fans, somos de todas las clases y de todos los colores. River Plate, uno de los clubes más grandes del mundo, nos recibió de una manera cortés y honorable, que nada se compara con el acto en cuestión”, indicó

#River #RiverPlate #Fortaleza #CopaLibertadores #Racismo",Message,Video,0,89,,,,71,0,18,0,
Instagram,https://www.instagram.com/p/CcWKubgJ4Ro/,,4/14/2022 5:21 pm,"El primer ministro británico, Boris Johnson, buscar enviar a centros de detención en Ruanda a inmigrantes que cruzan el Canal de la Mancha, causa polémica por militarización y xenofobia. 
.
Más información en la sección internacional de La Izquierda Diario
. 
https://www.laizquierdadiario.mx/Boris-Johnson-planea-enviar-migrantes-a-Ruanda-reforzando-la-xenofobia
.
.
.
.
#internacional #noticias  #granbretaña #migracion #borisjohnson #britain #racism #racismo #xenofobia #izquierdadiario",Message,Photo,0,12,,,,12,0,0,0,Perfilamiento racial
Instagram,https://www.instagram.com/p/CcWHwXPu_sH/,,4/14/2022 4:55 pm,"🚫 Un hincha de River le tiró una banana a los fanáticos de Fortaleza: se espera una dura sanción contra él.
El club abrió un expediente y el caso será analizado en la Asamblea de Socios.

📲Las imágenes rápidamente recorrieron las redes sociales y llegaron a manos de los dirigentes del club, quienes lanzaron un comunicado en el qué aseguran que se encuentra identificado al socio que cometió semejante atrocidad.

✍“River Plate manifiesta su más absoluto repudio ante los gestos racistas y xenófobos de un hincha hacia la parcialidad visitante, y comunica que ya está implementando las medidas correspondientes para identificar al culpable y aplicarle las debidas sanciones”, escribió el club en sus redes.

#riverplate 
#brasil 
#racismo 
#futbol",Message,Photo,0,1,,,,1,0,0,0,
Twitter,https://twitter.com/zumburulullo/statuses/1514708783859077125,zumburulullo,4/14/2022 4:54 pm,"esteban @SocCivilMx @VicenteFoxQue Y los memes?
Las anécdotas?
Los escándalos?
El racismo y el machismo?
La oportunidad desperdiciada?",Mention,Text Only,199,0,"Ciudad Lopez Mateos, México, Mexico",,,0,0,0,0,
Instagram,https://www.instagram.com/p/CcWGsA3MRio/,,4/14/2022 4:46 pm,"📌🇵🇪 Perú es un país donde el racismo y la discriminación están presentes en cada esquina, pero la boda de una pareja de novios de la elite peruano-española ha superado lo predecible. El enlace entre Belén Barnechea, hija de un excandidato presidencial peruano , y el aristócrata español Martín Cabello de los Cobos, celebrado en la ciudad de Trujillo, a unos 550 kilómetros al norte de Lima, ha levantado una ola de indignación en el país sudamericano. El motivo de tanto revuelo ha sido la publicación en internet de varios fragmentos de vídeos de la boda que muestran la ambientación que rodea la ceremonia y el posterior convite, con personajes de la época en la que Perú era un virreinato de la corona española (siglo XVI) simulando trabajos forzados, lo que ha generado un rechazo masivo de los medios de comunicación peruanos

🖋 jfowks 

Lee más en el enlace de la BIO ☝🏻📲

#perú #boda #racismo #discriminación #belénbernechea #martíncabellodeloscobos #elpaísamérica",Message,Photo,0,694,,,,644,0,50,0,
Twitter,https://twitter.com/sirinhuanico/statuses/1514705111985053696,sirinhuanico,4/14/2022 4:40 pm,Tomando ese color oro prieto cambujo característico de tierra caliente Gro. A huevo!,Message,Text Only,496,0,"Jiutepec, Morelos, Mexico",Men,,0,0,0,0,
Twitter,https://twitter.com/gordrigo91/statuses/1514701042382000133,gordrigo91,4/14/2022 4:24 pm,"Oilo 🤣🤣🤣🤣🤣

""Ayuda que ya me quemaron y mi papá ni como ayudarme"" 😢😢😢😢😢 | QT: Con esa actitud, disposición y ganas de cambiar las cosas, @elonmusk debería empezar por limpiar @TwitterMexico. Dirigida por unos cuantos acomplejados simpatizantes de @felipecalderon, que lo único que hacen es llenar de bots @twitter para su absurda y patética guerra sucia 💩.",Message,Text Only,525,0,"Colonia Lindavista, México, Mexico",,,0,0,0,0,
Twitter,https://twitter.com/LaloAragonOax/statuses/1514699901862563851,LaloAragonOax,4/14/2022 4:19 pm,"""Cualquier progreso debe ser colectivo. Todo progreso individual significa un retroceso para la humanidad. Por lo tanto, el individualismo resulta pernicioso para la comunidad""

- Lalo El Indio (2022)

; ) https://t.co/kP4go8xEBL",Message,Photo,514,0,"Oaxaca de Juarez, Oaxaca, Mexico",Men,,0,0,0,0,Origen cultural
Instagram,https://www.instagram.com/p/CcWCxa-MutR/,,4/14/2022 4:12 pm,"🚫 Un hincha de River le tiró una banana a los de Fortaleza: se espera una dura sanción contra él 

Las imágenes rápidamente recorrieron las redes sociales y llegaron a manos de los dirigentes del club, quienes lanzaron un comunicado en el que aseguran que se encuentran identificando al socio que cometió semejante atrocidad.

#river #riverplate #brasil #racismo #futbol #tn",Message,Video,0,9074,,,,7930,0,1144,0,
Twitter,https://twitter.com/destino_dulce/statuses/1514689680675164164,destino_dulce,4/14/2022 3:38 pm,Será cierto o será fake tan buena estará la fiesta que asta la cerveza indio lo sabe sean bienvenidos a los juegos de la resaca https://t.co/ZK8imdWnO2,Message,Photo,2957,0,"Xico, Veracruz, Mexico",Men,,0,0,0,0,Origen cultural
