Network,Message URL,Profile,Date,Message,Type,Content Type,Followers,Engagements,Location,Gender,Age,Likes,Dislikes,Comments,Shares,Theme
Twitter,https://twitter.com/Cuemar/statuses/1505278401040506884,Cuemar,3/19/2022 4:21 pm,"AlfredoLecona @ZuritaCarpio El que no das una eres tú!! Servil, corrupto, ruin, naco, eso si eres tú!!",Mention,Text Only,3181,2,"Cuauhtemoc, Mexico City, Mexico",Women,,1,0,1,0,Odio
Twitter,https://twitter.com/LaloAragonOax/statuses/1505277043562455043,LaloAragonOax,3/19/2022 4:16 pm,"Uno sabe que el espíritu empieza a morir, cuando se conforma viendo el vive latino por YouTube, en vez de estar parado bajo el rayo del sol con una horrible cerveza Indio bien fría

Me volví viejo y ni cuenta me di, a pesar de que opuse toda la resistencia que me fue posible

: (",Message,Text Only,513,2,"Oaxaca de Juarez, Oaxaca, Mexico",Men,,2,0,0,0,Origen cultural
Twitter,https://twitter.com/torrez_guillo/statuses/1505270019789365251,torrez_guillo,3/19/2022 3:48 pm,"Quiero que inventen ya la vacuna contra el racismo, y que el planeta acepte que en el fondo todos somos lo mismo. en Villahermosa, Tabasco https://t.co/SwvIODdtv2",Message,Link,1008,0,"Villahermosa, Tabasco, Mexico",Men,,0,0,0,0,
Twitter,https://twitter.com/VicMac123/statuses/1505266714317107202,VicMac123,3/19/2022 3:35 pm,"AndhyPlant @rosy1alex Jajaja , pobre Goey , Clasista jajaja , SON CANCER QUE NO SE ATREVEN A DAR SU CARA POR QUE SE LES DEBE DE ESTAR CAYENDO DE VERGÜENZA POR DEFENDER A UN MITÓMANO , ASESINO Y CORRUPTO",Mention,Text Only,5813,0,"Medina, Guanajuato, Mexico",Men,,0,0,0,0,
Twitter,https://twitter.com/samymtzl/statuses/1505266116053983232,samymtzl,3/19/2022 3:33 pm,"ElizaSonrisas De hecho, el tema SÍ es que tienen una ventaja física. Por más que quieran negarlo es una realidad y no es discriminación, ni se trata de victimizarse. Ni al caso que ""incomoden"" o sea qué te crees o qué? 😂 Qué afán de insertarse. Eso no es triunfar ni destacar, sorry.",Mention,Text Only,148,23,"Las Delicias, Baja California, Mexico",Men,,21,0,1,1,Backlash
Twitter,https://twitter.com/Edys53/statuses/1505262741816328196,Edys53,3/19/2022 3:19 pm,"DavidAyalaRomer @jorg3leiner Habla Ud de la pinche estatua que pusieron ahí y q nuestros militares fueron obligados x 1 pendejo @epigmenioibarra a hablarle de forma estúpida? Esos militares q hoy no tienen dignidad, los tienen haciendo caprichos del Kks qué pena q Ud no entienda q apoya a 1 resentido social",Mention,Text Only,169,1,"Colonia del Valle, Mexico City, Mexico",,,1,0,0,0,Backlash
Twitter,https://twitter.com/alexxxluna/statuses/1505261998497579017,alexxxluna,3/19/2022 3:16 pm,LOVREGA Dice cultura popular para no decir naco.,Mention,Text Only,1525,0,Mexico,Men,,0,0,0,0,Odio
Twitter,https://twitter.com/cruelladeweed/statuses/1505260857130983426,cruelladeweed,3/19/2022 3:12 pm,Momentos indio 5 pm a tu nombre @esamipaw allá nos vemos ❤️‍🔥 #Cumbiódromo  y pa q veas que no nada más es el nombre yo saco las 3. 🔥,Mention,Text Only,730,3,"Colonia del Valle, Mexico City, Mexico",,,0,0,3,0,Origen cultural
Twitter,https://twitter.com/Jacquie_LHoist/statuses/1505258783198621703,Jacquie_LHoist,3/19/2022 3:03 pm,"Mi padre fue un honorable hombre francés.Yo una mujer feminista, defensora de los Derechos humanos

Porque no el feminismo no es un tema de resentimientos, sino de la búsqueda del trato igualitario, sin discriminación,sin perjuicio y sin roles de género que nos impidan ser libres https://t.co/WwwwTYu48T | QT: Las mujeres que tuvimos un padre honorable, jamás seremos feministas porque no hay resentimientos qué sanar.",Message,Link,20905,18,"Coyoacan, Mexico City, Mexico",Women,,16,0,0,2,"Backlash, Género"
Twitter,https://twitter.com/Veros_Ruiz/statuses/1505258603728494600,Veros_Ruiz,3/19/2022 3:03 pm,"gcastroibarra Qué horror, este tipo siempre ha sido un narcisista, racista 🤮",Mention,Text Only,680,2,"Tlalnepantla, México, Mexico",,,1,0,0,1,
Twitter,https://twitter.com/ElRobDeLosAutos/statuses/1505258598829543432,ElRobDeLosAutos,3/19/2022 3:03 pm,"martibatres No es un aeropuerto borreguito, ni es internacional, es un vil aeródromo mal hecho, poco funcional y con el toque chairo.

Naco, vulgar y corriente.
#UrnasVacias 
#NoALaRevocacionDeMandato",Mention,Text Only,1372,0,"Miguel Hidalgo, Mexico City, Mexico",Men,,0,0,0,0,Odio
Twitter,https://twitter.com/Ur4Juan/statuses/1505255509036699649,Ur4Juan,3/19/2022 2:50 pm,"irmoralesl Pinche naco!!!! conocemos y muchos, no cabe duda te sale lo clasista y eres un simio con traje!!!.😂😂😂😂😂😂😂",Mention,Text Only,3408,0,"El Pueblito, Querétaro, Mexico",,,0,0,0,0,Odio
Twitter,https://twitter.com/mscampanario/statuses/1505252593970434049,mscampanario,3/19/2022 2:39 pm,juancar35546865 A mi con Cristóbal Colón para pedirle disculpas por el trato que ha recibido de los traumados y acomplejados de la 4t y sus parientes... pero se va poder porque lo tienen escondido!!,Mention,Text Only,165,0,"Casa Blanca, Puebla, Mexico",,,0,0,0,0,
Twitter,https://twitter.com/_rikardo18/statuses/1505251602734755843,_rikardo18,3/19/2022 2:35 pm,No estoy prieto estoy polarizado para verme placoson jajajajajajaja en 𝒯𝑒𝓆𝓊𝒾𝓁𝒶 𝒥𝒶𝓁𝒾𝓈𝒸𝑜 𝒫𝓊𝑒𝒷𝓁𝑜 𝑀𝒶𝑔𝒾𝒸𝑜 https://t.co/mlRfZUMczI,Message,Link,28,0,"Tequila, Jalisco, Mexico",Men,,0,0,0,0,
Instagram,https://www.instagram.com/tv/CbS3CAfMa99/,,3/19/2022 2:00 pm,"El soldado Medrano denunció maltrato por un superior, pensó que lo despedirían por denunciar, pero la reacción del comandante del Ejército lo sorprendió. 

Más detalles de esta historia en semana.com 

#Soldado #Colombia #Ejercito #SemanaEn2022 #Racismo #Historia  #Denuncia",Message,Video,0,10125,,,,8998,0,1127,0,
Twitter,https://twitter.com/MaALoC7/statuses/1505232267857342479,MaALoC7,3/19/2022 1:18 pm,"La audacia.
El clasismo de quien tiene una impresionante cola que le pisen... https://t.co/DltR23jNFK | QT: Aquellos que piensen que la central avionera es una obra impresionante les hace falta un poco de mundo.",Message,Link,437,0,Mexico,Men,,0,0,0,0,
Twitter,https://twitter.com/Gerardo13502558/statuses/1505216180444925958,Gerardo13502558,3/19/2022 12:14 pm,"Pancho59119525 @Xavitopa @CarlitosMarx5 @CiroMurayamaINE @INEMexico Se les criticaba ?  jajajaja jajajaja no MMS, se les exigía por medio de manifestaciones, marchas, mítines  y los hijos de su p...mad. recurrían a la represión, persecución y desapariciones forzadas, ahora ustedes solo son una bola de revoltosos resentidos haciendo el ridículo,",Mention,Text Only,69,1,"Iztapalapa, Mexico City, Mexico",Men,,0,0,1,0,Backlash
Twitter,https://twitter.com/sordomas/statuses/1505214243314012165,sordomas,3/19/2022 12:06 pm,"cecortesr Me rompió el corazón, yo que siempre creí que ella era un oasis de ""esperanza""
en medio de tanto protagonismo, clasismo y discriminación (sarcasmo)",Mention,Text Only,295,1,"Sanctorum, Puebla, Mexico",Men,,1,0,0,0,
Twitter,https://twitter.com/jkoyocku/statuses/1505213240757952513,jkoyocku,3/19/2022 12:02 pm,"Qué ejemplo de Racismo incluyente. “Autodenominxs” mayas, porque a las otras nacionalidades no se les cuestiona su origen, pero hay de los indígenas que solo pueden aspirar a ser “autodenominxs”. https://t.co/zrPum54LDK | QT: @kalycho @Paaytaanlacita cantantes bolivianos, perfumistas franceses, etc. y algunxs personas autodenomidxs Mayas. Todxs compartiendo sus perspectivas de lo intangible a través de tradiciones y ritos. Ellxs mismxs a su propia cultura, nadie más.

De hecho, ahora mismo estoy saliendo de una plática...",Message,Link,7490,54,"Merida, Yucatán, Mexico",,,48,0,2,4,Origen cultural
Twitter,https://twitter.com/JuampiSwan/statuses/1505213169114963969,JuampiSwan,3/19/2022 12:02 pm,"mayelo___ No , lo que sucede es que como ustedes son incapaces de respetar sumado a su ignorancia ustedes terminan mezclando y tergiversando conceptos para dar discursos de discriminación.",Mention,Text Only,365,1,"Cuauhtemoc, Mexico City, Mexico",Men,,0,0,1,0,
Twitter,https://twitter.com/chamuquito/statuses/1505201938568253440,chamuquito,3/19/2022 11:18 am,"Me recordó a mis 2 primos chairos.

Amargados, resentidos, fracasados. https://t.co/iWqk5iNw57 | QT: La pura verdad 
La #RedAmlo son el cáncer de México 

#LopezFracasoPresidencial 

 https://t.co/InnCEE2jF0",Message,Link,1330,0,"Tesistan, Jalisco, Mexico",Men,,0,0,0,0,Backlash
Twitter,https://twitter.com/TezoRomero/statuses/1505190723850756102,TezoRomero,3/19/2022 10:33 am,"MemeYamelCA Porque la derecha es prejuiciosa y acomplejada!

El tipo da lástima!

@MemeYamelCA eres genial y que bueno que los sigas exhibiendo.

Un abrazo https://t.co/bvjgcHHMb6",Mention,Photo,1415,1,"Ciudad Lopez Mateos, México, Mexico",,,1,0,0,0,
Twitter,https://twitter.com/PilarGodoy__/statuses/1505168697027145731,PilarGodoy__,3/19/2022 9:05 am,El_Universal_Mx Chulada de maíz prieto! https://t.co/JA98zDmtoV,Mention,Photo,269,0,"Santa Rosa Jauregui, Querétaro, Mexico",,,0,0,0,0,
Twitter,https://twitter.com/mikelspread/statuses/1505154489174700032,mikelspread,3/19/2022 8:09 am,"Como ven a la minoría estupida con sus cadenitas d WhatsApp y en Facebook q algún PANdejo les redactó, pobres ilusos, luego dicen q los ignorantes son otros vasta ver el odio y el clasismo en sus letras. 
La #RevocacionDeMandatoVa xq la VERDADERA MAYORÍA MEXICANA ASÍ LO QUIERE https://t.co/YbgW5U7W3S",Message,Photo,4548,1,"Tuxpan de Rodriguez Cano, Veracruz, Mexico",Men,,0,0,1,0,
Twitter,https://twitter.com/JuampiSwan/statuses/1505142753822486529,JuampiSwan,3/19/2022 7:22 am,"miradaPerdida5 @DiegoMMFire @laforjadeltitan Lo bueno es que acaba de expresar públicamente que ustedes saben que sus discursos son de discriminación.
Thnks",Mention,Text Only,365,1,"Magdalena Contreras, Mexico City, Mexico",Men,,0,0,1,0,
Twitter,https://twitter.com/JuampiSwan/statuses/1505141776725819395,JuampiSwan,3/19/2022 7:18 am,rafmontoya @MaPaulinaP La discriminación no se tolera se denuncia,Mention,Text Only,365,1,"Magdalena Contreras, Mexico City, Mexico",Men,,0,0,1,0,
Twitter,https://twitter.com/JuampiSwan/statuses/1505125817420034050,JuampiSwan,3/19/2022 6:15 am,"MissOaks3 @georgeorwell67 No, ni la discriminación, ni la calumnia ni la difamación se amparan en libertad de expresión, puede consultarlo en la Comisión de derechos humanos y en la Constitución.",Mention,Text Only,365,0,"Magdalena Contreras, Mexico City, Mexico",Men,,0,0,0,0,
Twitter,https://twitter.com/JuampiSwan/statuses/1505120869072445442,JuampiSwan,3/19/2022 5:55 am,"MissOaks3 @georgeorwell67 Derecho a la no discriminación, calumnia o difamación.
💁🏽‍♂️",Mention,Text Only,365,1,"Magdalena Contreras, Mexico City, Mexico",Men,,0,0,1,0,
Twitter,https://twitter.com/JuampiSwan/statuses/1505120609507889152,JuampiSwan,3/19/2022 5:54 am,"Anticom90292284 No, no es como ""quiera llamarlo"". Que ustedes llamen ""ideología de género"" a todo lo que les arde pues es otra cosa.
Por eso es que ustedes necesitan mentir y difamar para justificar su discriminación.
Sus comentarios solo aceleran las reformas educativas y constitucionales.",Mention,Text Only,365,1,"Magdalena Contreras, Mexico City, Mexico",Men,,0,0,1,0,
Twitter,https://twitter.com/herdez1977/statuses/1505119517600530433,herdez1977,3/19/2022 5:50 am,"Ruben_Txarraga @JosLoya7 @LuisaAlcalde Sumenle, ¿cuantos de la 4T son delincuentes? Muchos lo han sido toda su vida. Quienes los siguen son simplemente solitarios acomplejados que siguen el ""no somos machos pero somos muchos"" sin entender que a la 4T no les importan nada. No los necesitan, gobiernan con el estado.",Mention,Text Only,538,0,Mexico,Men,,0,0,0,0,
Twitter,https://twitter.com/JuampiSwan/statuses/1505117456901283841,JuampiSwan,3/19/2022 5:42 am,RocioN @hector1fox @JavierVillamor No necesito que desaparezca porque no existe. Lo que tiene que desaparecer son sus discursos de discriminación.,Mention,Text Only,365,3,"Magdalena Contreras, Mexico City, Mexico",Men,,0,0,3,0,
Twitter,https://twitter.com/JuampiSwan/statuses/1505105052087767040,JuampiSwan,3/19/2022 4:53 am,"rafa22222222222 @JavierVillamor Sigue, sigue. Cuando dejes de citar artículos sensacionalistas para justificar tu discriminación me avisas.",Mention,Text Only,365,1,"Magdalena Contreras, Mexico City, Mexico",Men,,0,0,1,0,
Twitter,https://twitter.com/jkoyocku/statuses/1505104811619979267,jkoyocku,3/19/2022 4:52 am,"Cierto no es apropiación cultural. Es extractivismo y despojo, mentir y vender fantasías sobre lo maya para impulsar su festival. Inaudito que siga viniendo la gente al Mayab y pase de noche la colonización imperante. Un ejemplo vivo del racismo que se vive en Mexico. https://t.co/0NwF81UDUn",Message,Link,7490,134,Mexico,,,107,0,2,25,Origen cultural
Twitter,https://twitter.com/jkoyocku/statuses/1505097921284526080,jkoyocku,3/19/2022 4:24 am,Porque por supuesto que el racismo y mercantilización de lo maya languidece ante el esfuerzo de lo “cosmopolita” predicado por los merolícos de la inclusión e interculturalidad.,Mention,Text Only,7490,22,Mexico,,,18,0,2,2,Origen cultural
Twitter,https://twitter.com/jkoyocku/statuses/1505097233653501952,jkoyocku,3/19/2022 4:21 am,Este es el racismo buena onda del que habló @EzerMay con Julio Astillero.,Mention,Text Only,7490,15,Mexico,,,11,0,1,3,
Twitter,https://twitter.com/jkoyocku/statuses/1505096050209701888,jkoyocku,3/19/2022 4:17 am,"Ufffff es que el extractivismo y exotización ahora resulta que es un “área de oportunidad”, e. El racismo ahora es un “área de oportunidad”. Lo que uno tiene que leer. https://t.co/PRUPVy9c75",Message,Link,7490,50,Mexico,,,40,0,1,9,
Twitter,https://twitter.com/JuampiSwan/statuses/1505088332111491081,JuampiSwan,3/19/2022 3:46 am,"ghurtadoy @Jorgebuxade Más? Pues sí más. Le falta mucho. 
Para qué? Para que deje de desinformar y de mentir con tal de justificar su discriminación.. degradante? Repugnante? Injuriaosa? Aberración?
Estudie y edúquese, hasta ahora tales adjetivos la describen a usted.
👀",Mention,Text Only,365,0,"Magdalena Contreras, Mexico City, Mexico",Men,,0,0,0,0,
Twitter,https://twitter.com/JuampiSwan/statuses/1505070941205848067,JuampiSwan,3/19/2022 2:37 am,IPS__08 @waffleccoon @IfHitoriko @PseudoGenios Deje de desinformar y de usar a los niños como estandarte para justificar su discriminación.,Mention,Text Only,365,2,"Magdalena Contreras, Mexico City, Mexico",Men,,2,0,0,0,
Twitter,https://twitter.com/vaquero_rockero/statuses/1505064418173890562,vaquero_rockero,3/19/2022 2:11 am,JalilMajulG Pero no es tu decisión. Tienes un mes poniendo post que lo peor es traer hijos al mundo. Deja a la raza humana hacer lo que les haga feliz si no están metiéndose con los derechos de nadie. Easy as that ✌🏼,Mention,Text Only,23348,2,"Miguel Aleman (La Doce), Sonora, Mexico",,,1,0,1,0,
Twitter,https://twitter.com/JuampiSwan/statuses/1505056765863464963,JuampiSwan,3/19/2022 1:41 am,"Guz_animador Ah... Entonces ustedes justificando sus discursos de discriminación contra la comunidad Trans por algo que hicieron hombres heterosexuales.
Mmmmm 🤔 interesante.",Mention,Text Only,365,1,"Miguel Hidalgo, Mexico City, Mexico",Men,,0,0,1,0,Género
Twitter,https://twitter.com/PaolaRdzGz/statuses/1505056310684835840,PaolaRdzGz,3/19/2022 1:39 am,"🤦🏻‍♀️ yo igual mañana iré con el indio Yaqui https://t.co/nPXkC9cz1s | QT: Mañana mismo voy a presentarme con los Indios Verdes para ponerme a sus muy apreciables órdenes… 
de haber sabido. 🤷🏻‍♂️
https://t.co/QjozaHHTEH",Message,Link,48,0,"Miguel Aleman (La Doce), Sonora, Mexico",Women,,0,0,0,0,Origen cultural
Twitter,https://twitter.com/serchbondd/statuses/1505055322137931776,serchbondd,3/19/2022 1:35 am,"AndarPueTlax @Biestro @TrabajoGobPue @Itandehui_RoMa @CarlosTorresF_ @mazatlea @RaulEcc1977 @MAS_Puebla @BruceJulis Con su barbita ridícula, no cabe duda que eres todo un pinche NACO BIESTRO",Mention,Text Only,21742,1,"Casa Blanca, Puebla, Mexico",Women,,1,0,0,0,Odio
Twitter,https://twitter.com/krlzmt/statuses/1505053751907958785,krlzmt,3/19/2022 1:29 am,"Se le nota la falta de tacto, si fuera un niño hijo de algún amigo suyo lo hubiera tratado diferente. Vaya, es amable de manera muy selectiva, por no decir: clasista. https://t.co/5uhnavrPj4 | QT: Mariana Rodríguez no sabía que la estaban grabando por eso se comportó como en realidad es. 

Qué escándalo.  https://t.co/IAooEbbbUV",Message,Link,957,0,"Monterrey, Nuevo León, Mexico",Men,,0,0,0,0,
Twitter,https://twitter.com/FeelCarlosCesar/statuses/1505049531993321476,FeelCarlosCesar,3/19/2022 1:12 am,"Me volteas y pones de espaldas para inundarme con tu carne prieta.

Agarras mis caderas y penetras hasta terminar en mi entrepierna...🔥

✍🏼 @relatosdeali

#relatosdeali #lengua #fierasalvaje #furia #marzo  #pidememaquetasdeamor https://t.co/Zzca2lFV9C",Mention,Photo,1512,0,Mexico,Men,,0,0,0,0,
Twitter,https://twitter.com/srcaye/statuses/1505048593006313475,srcaye,3/19/2022 1:08 am,Nymphaa_Tonks Quien fuera indio,Mention,Text Only,293,1,"Colonia del Valle, Mexico City, Mexico",,,1,0,0,0,Origen cultural
Twitter,https://twitter.com/AnomiaMichael/statuses/1505046491886456842,AnomiaMichael,3/19/2022 1:00 am,"5 cosas que sucedieron gracias al metal local
1 El apoyo de mi Madre por elgirlo
2 Amar su lucha y transformación social
3 Me dio esperanza
3 cuestionar todo, con la metodología de la investigación
4 Leér siempre
5 ser feo, pobre, prieto, olvidable, no me impide a ser feliz.",Message,Text Only,17,0,"Miguel Aleman (La Doce), Sonora, Mexico",Men,,0,0,0,0,
Twitter,https://twitter.com/Arcalim4/statuses/1505044661437706241,Arcalim4,3/19/2022 12:53 am,jgnaredo @roma_niac Clasismo? Racismo? Discriminación? De qué diablos hablas?,Mention,Text Only,7947,2,"Tlalnepantla, México, Mexico",,,2,0,0,0,
Twitter,https://twitter.com/SDCrisOficial/statuses/1505040473391603716,SDCrisOficial,3/19/2022 12:36 am,"Chingonas, sororas, constructoras de procesos organizativos, alianzas y red de defensa para el ejercicio de nuestros humanos, cero tolerancia a la Violencia, discriminación y racismo. Sigue siendo nuestro momento porque somos mujeres CHINGONAS 😍🤗 https://t.co/AtFLUou1lA | QT: Ya dije ! @claussanz @SDCrisOficial https://t.co/hvp52DRyFj",Message,Link,564,6,"Cuauhtemoc, Mexico City, Mexico",Women,,4,0,1,1,Género
Twitter,https://twitter.com/LuismaQro/statuses/1505027949409419265,LuismaQro,3/18/2022 11:46 pm,"Si lo aplican porque lo aplica si no por que no, así se manejan estos cahiros resentidos https://t.co/aMWveVQvOL | QT: @JuANeRi @ricky_martin Luego de la #Corregidora y de su pesca , ahora muy aplicado secretario @PCIVILQRO q hasta se atrevió a afectar el feudo de los Torres Landa",Message,Link,2483,0,"Santa Rosa Jauregui, Querétaro, Mexico",Men,,0,0,0,0,Backlash
Twitter,https://twitter.com/_FridaSaldivar/statuses/1505027065401204737,_FridaSaldivar,3/18/2022 11:43 pm,Ni vengan al sayu de barrio jajajaa ni tienen indio que chafaaaaa,Message,Text Only,76,0,"Monterrey, Nuevo León, Mexico",Women,,0,0,0,0,Origen cultural
Twitter,https://twitter.com/RicardoArcaraz/statuses/1505022109243756546,RicardoArcaraz,3/18/2022 11:23 pm,dj_79 @myriwonka Soy indio de corazón y cuerpo 😍 https://t.co/tFc5eTfOCm,Mention,Photo,2295,2,"Coatzacoalcos, Veracruz, Mexico",Men,,1,0,1,0,Origen cultural
Twitter,https://twitter.com/maximatomf/statuses/1505021777302499328,maximatomf,3/18/2022 11:22 pm,"Resumen del día

Se me poncho la llanta. 
La tesorería no me resolvió nada. 
Casi se me sale la llanta mientras iba de regreso. 
Apenas y llegue a casa con el aire que traía la otra llanta. 

Hoy si fue mi día de Prieto en aprietos.",Message,Text Only,42,0,"Cuautitlan Izcalli, México, Mexico",Men,,0,0,0,0,
Twitter,https://twitter.com/jmartinez67/statuses/1505005570688008194,jmartinez67,3/18/2022 10:17 pm,"Puro acomplejado
#GobiernoDeResentidos
#GobiernoCriminalCorruptoyMentiroso https://t.co/Zmjxt9Czbc | QT: Platicamos con Epigmenio, que aportará a la causa un documental sobre el Aeropuerto Internacional Felipe Ángeles titulado 'Una obra del pueblo'. Mañana estará disponible en las redes. https://t.co/qBmtQNBndJ",Message,Link,855,0,Mexico,Men,,0,0,0,0,
Twitter,https://twitter.com/JoaqunValladar1/statuses/1504994161073790980,JoaqunValladar1,3/18/2022 9:32 pm,"MalthusGamba @guilbert_ga @JRCossio @JRCossio corruptizimo 
clasista alineado con los
siniestros personages 
políticos de la ultraderecha
patéticos sus comentarios",Mention,Text Only,194,2,"Patzcuaro, Michoacán, Mexico",,,1,0,0,1,
Twitter,https://twitter.com/saulfrancoz/statuses/1504974411677544450,saulfrancoz,3/18/2022 8:13 pm,Más prieto porfa ❤️‍🔥❤️‍🔥❤️‍🔥 https://t.co/sy2xId0RrA,Message,Photo,616,3,"Venustiano Carranza, Mexico City, Mexico",,,3,0,0,0,
Twitter,https://twitter.com/_FerLeonMex/statuses/1504960576295895041,_FerLeonMex,3/18/2022 7:18 pm,"Que dice el miserable resentido que vayan a votar...
#NoALaRevocacionDeMandato https://t.co/3Xf8h8ouWb",Message,Photo,158,1,"Monterrey, Nuevo León, Mexico",,,1,0,0,0,Backlash
Twitter,https://twitter.com/Petcorp/statuses/1504957201370079233,Petcorp,3/18/2022 7:05 pm,TejevientosFilm @ElDiabloRoboc Lo que está diciendo es altamente racista y clasista. Retráctese.,Mention,Text Only,371,1,"Miguel Aleman (La Doce), Sonora, Mexico",,,0,0,1,0,
Twitter,https://twitter.com/birdienamnams/statuses/1504951316451319821,birdienamnams,3/18/2022 6:42 pm,"Mitchultlan Exacto, me parece clasista, también",Mention,Text Only,1517,1,"Tuxtla Gutierrez, Chiapas, Mexico",Men,,1,0,0,0,
Twitter,https://twitter.com/marianabtch/statuses/1504943574974181386,marianabtch,3/18/2022 6:11 pm,"Siempre hay un ex naco los viernes en la tarde 🙄🙄🙄🤣🤣🤣🤣🤷

https://t.co/5qbHUFdTnd",Message,Link,3391,2,"Guadalajara, Jalisco, Mexico",Women,,1,0,1,0,Odio
Twitter,https://twitter.com/RobertoBalbuen3/statuses/1504936680612053001,RobertoBalbuen3,3/18/2022 5:43 pm,jgnaredo Así es eso se llama clasismo,Mention,Text Only,226,0,"Cuauhtemoc, Mexico City, Mexico",Men,,0,0,0,0,
Twitter,https://twitter.com/JuampiSwan/statuses/1504933825532637188,JuampiSwan,3/18/2022 5:32 pm,"EuskoGuayanes @Saxophonist87 Diga lo que quiera.
Su demagogia me la sé de memoria. Llevan años queriendo justificar su discriminación y lo único que hacen es demostrar lo urgente que es que la autoridad proteja a la sociedad de personas como usted.",Mention,Text Only,365,1,"Magdalena Contreras, Mexico City, Mexico",Men,,0,0,1,0,Perfilamiento racial
Twitter,https://twitter.com/JuampiSwan/statuses/1504932550615175175,JuampiSwan,3/18/2022 5:27 pm,Guz_animador Sí lo hacen. Es otra evidencia de su discriminación.,Mention,Text Only,365,1,"Magdalena Contreras, Mexico City, Mexico",Men,,0,0,1,0,
Twitter,https://twitter.com/JuampiSwan/statuses/1504932132417900552,JuampiSwan,3/18/2022 5:25 pm,"EuskoGuayanes @Saxophonist87 En el grupo de los que inventaron la supuesta ""ideología de género"" y que se encargan de escandalizar a la sociedad para justificar su discriminación.
A ese grupo.",Mention,Text Only,365,1,"Magdalena Contreras, Mexico City, Mexico",Men,,0,0,1,0,
Twitter,https://twitter.com/Sagdamagdawey/statuses/1504929570037850112,Sagdamagdawey,3/18/2022 5:15 pm,Salcedo_Hugo No mames naco estupido,Mention,Text Only,17,0,"Casa Blanca, Puebla, Mexico",,,0,0,0,0,Odio
Twitter,https://twitter.com/JuampiSwan/statuses/1504928709463224323,JuampiSwan,3/18/2022 5:12 pm,"Guz_animador En ese caso usted tendría que estar preocupado por el reglamento de aquella competencia escolar. En vez de utilizar un hecho aislado para justificar su discriminación hacia toda una comunidad.
Por eso es que ustedes inventaron la supuesta ""ideología de género"" justificarse",Mention,Text Only,365,1,"Magdalena Contreras, Mexico City, Mexico",Men,,0,0,1,0,
Twitter,https://twitter.com/ElRobDeLosAutos/statuses/1504922926218420233,ElRobDeLosAutos,3/18/2022 4:49 pm,"guruchuirer ¿Y usaron CGI para similar que el viejo cagado durmió en la obra negra?

Pobre borreguitos sin cerebro, al menos el PRIAN si entregaba las obras a tiempo en forma y con estilo.

No como sus mamadas... https://t.co/9wdbvek9we",Mention,Photo,1372,0,"Miguel Hidalgo, Mexico City, Mexico",Men,,0,0,0,0,
Twitter,https://twitter.com/JuampiSwan/statuses/1504920947878514700,JuampiSwan,3/18/2022 4:41 pm,PacoH71025578 @drmongole @Jose77Josito77 @juanenruta @bustingorri721 @vigobulldog @dsegoviaatienza A que más gente sepa que sus discursos de discriminación y su demagogia tienen como pretexto un enemigo imaginario que ustedes inventaron.,Mention,Text Only,365,1,"Magdalena Contreras, Mexico City, Mexico",Men,,0,0,1,0,
Twitter,https://twitter.com/al312000/statuses/1504920921446010880,al312000,3/18/2022 4:41 pm,HernanGomezB se ve que A ese perro  clasista le cala que cuestionen....,Mention,Text Only,35,0,"Magdalena Contreras, Mexico City, Mexico",,,0,0,0,0,
Twitter,https://twitter.com/JuampiSwan/statuses/1504920593103306758,JuampiSwan,3/18/2022 4:40 pm,"PacoH71025578 @drmongole @Jose77Josito77 @juanenruta @bustingorri721 @vigobulldog @dsegoviaatienza Al contrario. Le arde tanto que necesita creer en enemigos imaginarios con tal de justificar su discriminación.
Edúquese",Mention,Text Only,365,1,"Magdalena Contreras, Mexico City, Mexico",Men,,0,0,1,0,
Twitter,https://twitter.com/JuampiSwan/statuses/1504919932647182342,JuampiSwan,3/18/2022 4:37 pm,"diegorjc02 @NickyMarquez1 @AgustinLaje Aaaah... Agustín Laje, ese mentiroso que solo buscaba ganancias económicas a partir de un discurso de discriminación y difamación.
Patético.",Mention,Text Only,365,0,"Magdalena Contreras, Mexico City, Mexico",Men,,0,0,0,0,
