Network,Message URL,Profile,Date,Message,Type,Content Type,Followers,Engagements,Location,Gender,Age,Likes,Dislikes,Comments,Shares,Theme
Twitter,https://twitter.com/_JoseAntonio_MX/statuses/1515416818151743489,_JoseAntonio_MX,4/16/2022 3:48 pm,"Chilango, prieto y callejero...

Prros con actitud! https://t.co/1PCRK0lvtW",Message,Photo,1512,0,"Cuernavaca, Morelos, Mexico",Men,,0,0,0,0,
Twitter,https://twitter.com/cesarhernandz/statuses/1515413665431924737,cesarhernandz,4/16/2022 3:35 pm,"¿Por qué siempre justifican la discriminación con “mantener un ambiente familiar”? Ya dejen ese discurso de odio. La transfobia no es “malentendido” es un delito, y para esas disculpas mejor no digan nada. | QT: Comunicado oficial. https://t.co/nyYPB6KT38",Message,Text Only,658,0,"Guadalajara, Jalisco, Mexico",,,0,0,0,0,
Twitter,https://twitter.com/FenixTigre16/statuses/1515413583311646723,FenixTigre16,4/16/2022 3:35 pm,"Solo evidencias  tus pinches complejos de inferioridad, si no tienes para pintar tus paredes ni para comprar un pinche foco para hace vídeos decentes menos para hacer una buena carne asada . | QT: Y eso que aún no ha visto el de Crítica al Clásico Regio o el de la Crítica a los 75 años del Monterrey. Se va a cagar en los pantalones cuando los vea.

Gracias por la publicidad, mi chavito. Los monterrellenos siempre han sido mis hijos.",Message,Text Only,1673,0,"Monterrey, Nuevo León, Mexico",,,0,0,0,0,
Twitter,https://twitter.com/Hazael20795852/statuses/1515412553421230086,Hazael20795852,4/16/2022 3:31 pm,"cesargalicia_ @Cinemex Por supuesto que no es una disculpa y no tienen porqué hacerlo. La empleada estaba en su derecho de SACARLOS. Y no es discriminación, si la empleada insulto y/u ofendió de alguna manera si.",Mention,Text Only,12,0,"Xochimilco, Mexico City, Mexico",,,0,0,0,0,
Twitter,https://twitter.com/JessTrinidadCo2/statuses/1515411607148408836,JessTrinidadCo2,4/16/2022 3:27 pm,"MarioAlbert1952 @Jenetth4T Busca una mejor excusa para sacar tus frustraciones políticas.
Clasistas, discriminativos, perversos y malos perdedores.",Mention,Text Only,44,0,"Miguel Aleman (La Doce), Sonora, Mexico",Women,,0,0,0,0,
Twitter,https://twitter.com/DanielAzain/statuses/1515410829465772036,DanielAzain,4/16/2022 3:24 pm,Estoy cada día más prieto 🥵🥵🏝,Message,Text Only,219,0,"Puerto Escondido, Oaxaca, Mexico",Men,,0,0,0,0,
Twitter,https://twitter.com/Mex1Pachelbel/statuses/1515408163805179906,Mex1Pachelbel,4/16/2022 3:13 pm,"laredcincoradio Perdón por interrumpir tu circo, naco p3ndejo @eduardorivera01 

#LaloAtayde",Mention,Text Only,1412,0,"Casa Blanca, Puebla, Mexico",,,0,0,0,0,Odio
Twitter,https://twitter.com/Kaathytorres_/statuses/1515403999918264321,Kaathytorres_,4/16/2022 2:57 pm,"La cantidad de mujeres que usa traje de baño con sus miles de imperfecciones (estrías, celulitis,cicatrices,etc) amo verlas sin ninguna pena andar por la playa luciendo su cuerpo👙 , ojalá nunca nos sintiéramos tan acomplejadas.",Message,Text Only,302,0,Mexico,Women,,0,0,0,0,Género
Twitter,https://twitter.com/ArturoRCastro/statuses/1515401286476185600,ArturoRCastro,4/16/2022 2:46 pm,chag_spc Eso es racismo nivel Coney,Mention,Text Only,286,0,"Las Delicias, Baja California, Mexico",Men,,0,0,0,0,
Instagram,https://www.instagram.com/p/CcbBEZ8OGdH/,,4/16/2022 2:33 pm,"20 años del arresto de Marwan Barghouti, ""Abu al-Qassam"", Líder palestino y un miembro del Comité Central del movimiento Fatah.

 Se informa que Al-Barghouti, es de la ciudad de Kober, ha estado detenido desde el 15/04/2002 “la segunda Intifada” por las fuerzas terroristas de la ocupación. 

20 عاما على اعتقال عضو اللجنة المركزية لحركة فتح القائد المناضل مروان البرغوثي ""ابو القسام"". 

‏يذكر ان البرغوثي من بلدة كوبر، معتقل منذ 15-4-2002 ومحكوم بالسجن المؤبد 5 مرات.

#Palestina #Jerusalén #Ataque #Brutal #Inhumanidad #Racismo #Ocupación #Injusticia #CrimenesDeGuerra #TerrorismoDeEstado #PalestinaLibre 

‎#فلسطين #القدس #عدالة #حرية #احتلال",Message,Photo,0,18,,,,18,0,0,0,Perfilamiento racial
Twitter,https://twitter.com/UnDiaComoLeon/statuses/1515396863536640005,UnDiaComoLeon,4/16/2022 2:29 pm,FedericoArreola @yoshgawen No se si @PelonGomis esté resentido con la 4T o con el hecho de vivir a la sombra de su padre.,Mention,Text Only,34126,0,Mexico,,,0,0,0,0,Backlash
Twitter,https://twitter.com/MtroDelgado/statuses/1515396087334457348,MtroDelgado,4/16/2022 2:25 pm,"¿Quién fue Rosario Ibarra de Piedra?. Fue una activista, iniciadora de la defensa de los DDHH en México. Excandidata presidencial que fundó el Comité ¡Eureka!, pionera de búsqueda de familiares de desaparecidos en el país.

Foto: Twitter

@diegosinhue
@Neto_Prieto
@LorenaAlfaroG https://t.co/9rCyRGjjEC",Message,Photo,1073,0,"Irapuato, Guanajuato, Mexico",Men,,0,0,0,0,
Twitter,https://twitter.com/SalmaLuevano/statuses/1515394164225024002,SalmaLuevano,4/16/2022 2:18 pm,"Cinemex ya basta ni una más ni una menos y te exigo  como mujer trans 🏳️‍⚧️, como sociedad civil te exigo alto a tu discriminación",Mention,Text Only,13545,0,"Venceremos, Querétaro, Mexico",Women,,0,0,0,0,Género
Twitter,https://twitter.com/MtroDelgado/statuses/1515392328399269893,MtroDelgado,4/16/2022 2:11 pm,"Murió Rosario Ibarra de Piedra. Confirma la CNDH. 
Foto: wikipedia

@diegosinhue @LibiaGarciaML @MORENA_Gto @Neto_Prieto @leonfelipe_peni @lcmanzano @elmundosuena @irapuatogob @LorenaAlfaroG @JLMartinezNava @JCesarPrieto @David_Saucedo_ @MiguelChicoOfl @JosJavieraguir6 https://t.co/egjJFfWd1V",Message,Photo,1073,0,"Irapuato, Guanajuato, Mexico",Men,,0,0,0,0,
Twitter,https://twitter.com/Kali_goth/statuses/1515390616166977544,Kali_goth,4/16/2022 2:04 pm,"fernandeznorona @SergioSarmiento @aifa_aeropuerto Supongo que la decencia es algo que no conoces compa ÑERO. No eres capaz de argumentar o emitir un juicio si no dices antes una majaderia. Eres un mononeural color cartón mojado e igual de inservible.
  Disculpate tú. Por ser siempre tan abyecto y vulgar.",Mention,Text Only,879,0,"Miguel Hidalgo, Mexico City, Mexico",Women,,0,0,0,0,
Twitter,https://twitter.com/JUANSIN98129733/statuses/1515390416962600961,JUANSIN98129733,4/16/2022 2:03 pm,"_ryo_hermoso De lo peor de la raza humana, eso que llaman aberraciones!!!",Mention,Text Only,134,0,"Jiutepec, Morelos, Mexico",,,0,0,0,0,
Twitter,https://twitter.com/juanpab09872332/statuses/1515389314049449992,juanpab09872332,4/16/2022 1:59 pm,"tryno Oaxaca ofrece mucho, más que algunos resentidos sociales.  ¡Visiten Jalisco, aquí todos son bienvenidos!",Mention,Text Only,206,0,"Guadalajara, Jalisco, Mexico",,,0,0,0,0,Backlash
Twitter,https://twitter.com/MrJonhy09/statuses/1515389127658815499,MrJonhy09,4/16/2022 1:58 pm,"Cuál acto de discriminación?

Un hombre vestido de mujer estaba enseñando los genitales en un baño público PARA MUJERES.
El CM dió una explicación clara de lo que había pasado porque un cliente se enojo sin razón alguna.

CHINGA TU PUTA MADRE PUTO DESVIADO | QT: @Cinemex “A toda la comunidad QUE SE SINTIÓ OFENDIDA…”

No Cinemex, esas no son disculpas (mucho menos reparación de daño ni lineamientos o medidas claras para evitar estos ACTOS DE DISCRIMINACIÓN). https://t.co/ng2dpheIEO",Message,Text Only,384,0,Mexico,,,0,0,0,0,"Sexodiversidad, Género"
Twitter,https://twitter.com/fdissolved/statuses/1515389129814642691,fdissolved,4/16/2022 1:58 pm,"La única culpa que tiene Cine*mex y un buen de empresas es que no capacitan a los empleados para actuar de manea cordial con la banda mal educada, clasista y que usa los baños públicos como su casa, sin importar el género, es un tema de uso espacios públicos.",Message,Text Only,375,0,"Acapulco de Juarez, Guerrero, Mexico",Women,,0,0,0,0,
Twitter,https://twitter.com/Lalitalucia63/statuses/1515389064840720395,Lalitalucia63,4/16/2022 1:58 pm,"GlodeJo07 Es un asesino, resentido, sediento de poder y no le importa nadie... no se dieron cuenta cuando lo pusieron en el poder??",Mention,Text Only,54,0,Mexico,Women,,0,0,0,0,Backlash
Twitter,https://twitter.com/fdissolved/statuses/1515388682546696196,fdissolved,4/16/2022 1:56 pm,"La única culpa que tiene Cine*mex y un buen de empresas es que no capacitan a los empleados para actuar cordialmente a banda mal educada, clasista y que usa los baños públicos como su casa, sin importar el género, es un tema de uso de espacios públicos.",Message,Text Only,375,0,"Acapulco de Juarez, Guerrero, Mexico",Women,,0,0,0,0,
Twitter,https://twitter.com/MrJonhy09/statuses/1515388130064576512,MrJonhy09,4/16/2022 1:54 pm,"Pues un cabron vestido de mujer estaba enseñando los genitales en un baño de mujeres, ese fue el pedo.
Y el ambiente familiar implica que todas las personas se puedan sentir cómodas con la situaciones que lo rodean y estoy seguro que ninguna de las mujeres estaba cómoda ahí | QT: @Cinemex La discriminación no es un ""malentendido"".
Además, ¿qué chingados tiene que ver el ""ambiente familiar""? ¿Acaso el que vayamos al baño de repente es un ""atentado en contra de la familia""? 
Se les nota la influencia cristiana cuando meten a la familia en temas que ni al caso.",Message,Text Only,384,0,Mexico,,,0,0,0,0,Género
Twitter,https://twitter.com/bonillasdaniel/statuses/1515387407155220483,bonillasdaniel,4/16/2022 1:51 pm,"“Oye carnal, pégale un trapazo a la mesa gacho, paro”.
Con esa voz de hombre que debe de tener.
Ta bien pelada. | QT: El clasismo de la Roma es impresionante. No me sorprende que venga de empleadxs de cafeterías. Siempre me siento profundamente discriminada y por eso mismo no me gusta entrar a las cafeterías, pero bueno, ya estoy aquí...",Message,Text Only,705,0,Mexico,,,0,0,0,0,
Instagram,https://www.instagram.com/p/Cca8ATgr9Mz/,,4/16/2022 1:49 pm,"furros

.
.
.
.
.
#nazımhikmet
#sexo #furros #tetasvenezolanas #stanloona #amongus #racismo #pou #hola",Message,Photo,0,51,,,,49,0,2,0,
Instagram,https://www.instagram.com/p/Cca7ux4L6b9/,,4/16/2022 1:46 pm,"Pensar que un hombre es más importante que una mujer, así por qué sí, es tan dañino como pensar que los seres humanos somos más importantes que otras especies animales. En otras palabras, es muy dañino para la humanidad seguir comiendo animales.

#especismo #racismo #sexismo #atropocentrismo #superior #inferior #discriminación #evolución #desarrollo",Message,Photo,0,6,,,,6,0,0,0,Género
Twitter,https://twitter.com/bonillasdaniel/statuses/1515385731409137668,bonillasdaniel,4/16/2022 1:44 pm,"vogelfeuers @Cinemex Discriminación sacar a un wey de un baño de mujeres?
No mames.",Mention,Text Only,705,0,Mexico,,,0,0,0,0,Género
Twitter,https://twitter.com/bonillasdaniel/statuses/1515385276012584966,bonillasdaniel,4/16/2022 1:42 pm,"PaveloRockstar @Cinemex Cuál discriminación, wey?
Sacar a un cabrón del baño de mujeres?
Léete un libro de historia, por Dios.",Mention,Text Only,705,0,Mexico,,,0,0,0,0,Género
Twitter,https://twitter.com/Piporro76/statuses/1515381981755846657,Piporro76,4/16/2022 1:29 pm,fernandeznorona @SergioSarmiento @aifa_aeropuerto En tus pinches sueños pinche naco de cagada!!!!!!,Mention,Text Only,485,0,Mexico,,,0,0,0,0,Odio
Twitter,https://twitter.com/StiviDeTivi/statuses/1515380352210120705,StiviDeTivi,4/16/2022 1:23 pm,"Tache, pésimo que intenten disfrazar un acto de discriminación con la palabra “Malentendido”. En sus instalaciones discriminaron a una persona y deben aceptar el error. Vuélvanlo a escribir y de paso chequen la redacción porque tampoco lo hicieron bien. | QT: Comunicado oficial. https://t.co/nyYPB6KT38",Message,Text Only,74816,0,Mexico,,,0,0,0,0,
Twitter,https://twitter.com/MoonLane26/statuses/1515379194372542468,MoonLane26,4/16/2022 1:18 pm,"MikInmamable Y puede sonar bien fantasioso, porque hay gente cuadrada que no la vas a sacar de ""una mujer trans no es mujer"" y gente de la comunidad que, pese a sentir el mismo miedo que las demás chicas al salir, no la vas a sacar de ""es discriminación""...",Mention,Text Only,922,0,"Ciudad Nezahualcoyotl, México, Mexico",,,0,0,0,0,Género
Twitter,https://twitter.com/anasoy_/statuses/1515373896983355392,anasoy_,4/16/2022 12:57 pm,"El pobre* es pobre porque odia.  
*El pobre acomplejado que se cree de la realeza y debe todas sus tarjetas por wannabe más la hipoteca de la casa, las colegiaturas y los coches. 🤭🤦🏼‍♀️",Message,Text Only,2355,0,"Colonia del Valle, Mexico City, Mexico",,,0,0,0,0,
Twitter,https://twitter.com/Bosssdr95/statuses/1515372457238188047,Bosssdr95,4/16/2022 12:52 pm,"Una razón más por la que prefiero @Cinepolis  que @Cinemex | QT: Cinemex ofreció una disculpa a quien se haya sentido ofendido, luego de difundirse un acto de discriminación en contra de dos clientes. 👇
https://t.co/CsUOlzcJbG",Message,Text Only,35,0,"Coyoacan, Mexico City, Mexico",,,0,0,0,0,
Twitter,https://twitter.com/CAF_1916/statuses/1515371993138356224,CAF_1916,4/16/2022 12:50 pm,O a un prieto con un resentimiento social que lo heredó de su mediocre  familia | QT: Pocas cosas tan sencillas cómo hacer llorar a un ruco generación de cemento,Message,Text Only,11,0,"Santa Rosa Jauregui, Querétaro, Mexico",,,0,0,0,0,Backlash
Twitter,https://twitter.com/lauradelialuque/statuses/1515369120107270149,lauradelialuque,4/16/2022 12:38 pm,"tabayuco @BlaSalces Separados al nacer, igual de clasistas, racistas y pendejos 🧑🏻‍🦲👨🏻‍🦲",Mention,Text Only,3390,0,"Miguel Hidalgo, Mexico City, Mexico",Women,,0,0,0,0,
Twitter,https://twitter.com/VictorGtzE64/statuses/1515365228376121349,VictorGtzE64,4/16/2022 12:23 pm,"LaraMexico3 Si. No es discriminación. El problema de los trans que aún tienen sus órganos sexuales masculinos y entran a un baño de mujeres están en riesgo de exhibirse y que les vea otra persona, sobre todo una niña y eso impacta emocionalmente en esta.",Mention,Text Only,1460,0,Mexico,,,0,0,0,0,Género
Twitter,https://twitter.com/baksbaksbukent/statuses/1515364409929080832,baksbaksbukent,4/16/2022 12:20 pm,"Exactamente. Si Oaxaca industrializara la venta de niñas sería potencia mundial y no necesitaría el turismo para existir.

Punto para el racismo.

🤫 | QT: Oaxaca no es hotel.
Fuera whitexican de él. https://t.co/o4P30mlqLh",Message,Text Only,237,0,"Merida, Yucatán, Mexico",Men,,0,0,0,0,
Twitter,https://twitter.com/elrayleon/statuses/1515364273006034951,elrayleon,4/16/2022 12:19 pm,"leosmith6669 Y tú lenguaje propio de un arrabalero, ¿NETA? ¿NACO? esa es la mejor EDUCACIÓN que dan en cuba? Felicidades ""MI SANGRE""",Mention,Text Only,39,0,"Ciudad Nezahualcoyotl, México, Mexico",Men,,0,0,0,0,Odio
Twitter,https://twitter.com/GloriaDaveport/statuses/1515363201675841549,GloriaDaveport,4/16/2022 12:15 pm,"Arwenya2005 @CartonCalderon @c4jimenez @OSWALDORIOSM @FiscaliaCDMX @CNDH @SSC_CDMX @Mzavalagc Mira.
Te está saludando!!
Y su sobrina también!
And abaut de bad gruating englich Yu nou gui ar in México, dont yu?
Que dirían en Inglaterra de tu festival de Edipo  Holder N. y Lea J.?
""Mama weer all crazee now""?
Esos whitexicans además de clasistas son tan ridículos 🤣 https://t.co/a7cvUgeCcG",Mention,Photo,2126,0,"San Mateo Otzacatipan, Morelos, Mexico",Women,,0,0,0,0,
Twitter,https://twitter.com/N27GC/statuses/1515362926718160906,N27GC,4/16/2022 12:14 pm,"AlbertoRT16 @calbert57 @AristeguiOnline Jajajaja .... si fue la mayor patrocinadora que.llegara el acomplejado a la presidencia, en vez de atacarla.pongale un elektra ...",Mention,Text Only,222,0,"Apodaca, Nuevo León, Mexico",,,0,0,0,0,
Twitter,https://twitter.com/Ninel_QR/statuses/1515362373326020615,Ninel_QR,4/16/2022 12:11 pm,"“malentendido” (?) 
Fue un acto de discriminación. 
Esto no es una disculpa. Tomen una postura, y sensibilicen a todo su personal. Tengan protocolos para actuar en caso de discriminación y violencia contra poblaciones que son vulneradas. | QT: Comunicado oficial. https://t.co/nyYPB6KT38",Message,Text Only,422,0,"Tlalpan, Mexico City, Mexico",,,0,0,0,0,
Twitter,https://twitter.com/2JaviVazquez4/statuses/1515362009977663497,2JaviVazquez4,4/16/2022 12:10 pm,Chale me llaman resentido y un tweet después me bloquean jajaja ya no entendí. 😭,Message,Text Only,1326,0,"San Bernardino Tlaxcalancingo, Puebla, Mexico",,,0,0,0,0,Backlash
Twitter,https://twitter.com/rtoortiz/statuses/1515361550172925958,rtoortiz,4/16/2022 12:08 pm,"-""cuidar el ambiente familiar""
-""cualquier situación que pueda resultar ofensiva""
-""toda la comunidad que se sintió 'ofendida'""
-""malentendido""
-""política de respeto"".
La discriminación NO es un malentendido ni un ""sentirse ofendido"". @Cinemex deja muy claro que antes que la... | QT: Comunicado oficial. https://t.co/nyYPB6KT38",Message,Text Only,643,0,"Pachuca de Soto, Hidalgo, Mexico",Men,,0,0,0,0,
Twitter,https://twitter.com/rtoortiz/statuses/1515361552261656583,rtoortiz,4/16/2022 12:08 pm,"inclusión de todes, le importa más cuidar las buenas costumbres de la familia tradicional.
También ha quedado evidente que les falta capacitación y sensibilización en temas de inclusión y no discriminación.
Su disculpa ha quedado corta @Cinemex",Mention,Text Only,642,0,"Pachuca de Soto, Hidalgo, Mexico",Men,,0,0,0,0,
Twitter,https://twitter.com/JAntonioRamirez/statuses/1515360725593636870,JAntonioRamirez,4/16/2022 12:05 pm,"RegeneracionMx @Anamariavazquez Le quedó corto lo de clasista, más bien es un fascista.",Mention,Text Only,1738,0,"Tlalnepantla, México, Mexico",Men,,0,0,0,0,
Twitter,https://twitter.com/JorgeAmbrosioT/statuses/1515360210080210945,JorgeAmbrosioT,4/16/2022 12:03 pm,"- Me sorprende como me discriminan pero venga, aquí estoy en un lugar en el que seguramente me van a discriminar.

- Oh, rayos, me acaban de discriminar nuevamente. No limpiaron mi mesa. 

Dios le da sus peores batallas a sus mejores guerreros. | QT: El clasismo de la Roma es impresionante. No me sorprende que venga de empleadxs de cafeterías. Siempre me siento profundamente discriminada y por eso mismo no me gusta entrar a las cafeterías, pero bueno, ya estoy aquí...",Message,Text Only,1136,0,"Ciudad Lopez Mateos, México, Mexico",Men,,0,0,0,0,
Twitter,https://twitter.com/janiszerep/statuses/1515359327271407623,janiszerep,4/16/2022 11:59 am,"Este tuit me dió mucha paz...se tenía que decir y se dijo | QT: Y ojo: no hablo de desactivarnos políticamente sino de politizar nuestros afectos. Activar políticamente sin la idea de que el feminismo es una cosa intachable porque ya vimos que no lo es. El feminismo también puede ser racista, transfóbico, agresor
Nos urge bajarlo del pedestal",Message,Text Only,97,0,"Zacatecas, Zacatecas, Mexico",Women,,0,0,0,0,
Twitter,https://twitter.com/Innegable/statuses/1515357560265744387,Innegable,4/16/2022 11:52 am,"Que coraje ver los comentarios llenos de ignorancia y transfobia, creer que un acto de discriminación es proteger a la familia, la infancia y las ""buenas costumbres"". Que asco de sociedad ignorante e hipócrita, pensar que la identidad de los demás es una perversión. | QT: Comunicado oficial. https://t.co/nyYPB6KT38",Message,Text Only,2335,0,"Morelia, Michoacán, Mexico",Men,,0,0,0,0,
Twitter,https://twitter.com/EduardoRamosSC/statuses/1515357475066695680,EduardoRamosSC,4/16/2022 11:52 am,"HernanGomezB @JesusMartinMx Facu, la gente Trans es gente enferma que requiere tratamiento, donde se creen algo que no son y por ello sufren. El discurso progre e imbécil que trae el grupo LGBT, al que perteneces, es un peligro para México y el mundo, no es un temita idiota de discriminación...",Mention,Text Only,197,0,"Cuauhtemoc, Mexico City, Mexico",Men,,0,0,0,0,Género
Twitter,https://twitter.com/JorgeEscobar/statuses/1515355352891641867,JorgeEscobar,4/16/2022 11:44 am,TioCommander @agccontador A chinga. El chairo cree que estamos en estados unidos🤣 y que toda crítica la desvía con acusaciones racismo?🤷🏿‍♂️,Mention,Text Only,183,0,"Veracruz, Veracruz, Mexico",Men,,0,0,0,0,
Twitter,https://twitter.com/Perce_Tejeida/statuses/1515354767228297221,Perce_Tejeida,4/16/2022 11:41 am,Qué es más naco que irse de vacaciones y publicar “parkour” (?),Message,Text Only,163,0,"Miguel Hidalgo, Mexico City, Mexico",,,0,0,0,0,Odio
Twitter,https://twitter.com/MoonLane26/statuses/1515354032906412046,MoonLane26,4/16/2022 11:38 am,"3. Sería bastante enfermo y seguiría siendo una queja por discriminación solicitar baños para la comunidad. Es regresarte a la época donde había baños para los negros...

Es un tema bien delicado, en la que ambas partes deben ser empáticas y hasta neutras.",Mention,Text Only,922,0,"Ciudad Nezahualcoyotl, México, Mexico",,,0,0,0,0,
Twitter,https://twitter.com/JessRomoMo/statuses/1515353054664658947,JessRomoMo,4/16/2022 11:34 am,"G3n3r4lR00t @MalthusGamba @mario_dico50 Cuando no tienes capacidad mental y eres un chairo pendejo, tratas de usas un discurso clasista para defender lo indefendible",Mention,Text Only,113,0,"Cuauhtemoc, Mexico City, Mexico",Women,,0,0,0,0,
Twitter,https://twitter.com/elmcmonterrey/statuses/1515352187102240773,elmcmonterrey,4/16/2022 11:31 am,"Sábado ABIERTO

Cerveza TKT Light o Indio de media $20 hasta las 9pm (límite 20 por persona) 
+
Cover 2x1 hasta las 9pm

Fútbol: Tigres-Toluca 7pm

La Banda del MC (ska y más) en VIVO + Boulevard SKA en el escenario del jardín desde las 9:30pm
+
Adentro DJ Dense Denso perreo 11pm https://t.co/IUwq69jwza",Message,Photo,4030,0,"Monterrey, Nuevo León, Mexico",,,0,0,0,0,Origen cultural
Twitter,https://twitter.com/fabricio__mm/statuses/1515347740229742593,fabricio__mm,4/16/2022 11:13 am,"Esta bien creo que sone muy clasista y mamon pero neta se maman, ya les había dado feria para que se chingan los lentes de mi jefa 🤦🏽‍♂️🤦🏽‍♂️",Message,Text Only,325,0,"Uruapan, Michoacán, Mexico",,,0,0,0,0,
Twitter,https://twitter.com/tanke67/statuses/1515334404897493000,tanke67,4/16/2022 10:20 am,"SuGar_Pz @JoseRamonHerdez Creo que este evento ha sacado lo peor de muchos. Estigmatizar a los trans y tacharlos de violentos y pervertidos, hablar de las buenas costumbres y justificar la discriminación.
La violencia como los insultan.

Es de verdad muy triste.",Mention,Text Only,3401,0,"Cuauhtemoc, Mexico City, Mexico",,,0,0,0,0,Género
Twitter,https://twitter.com/elmcmonterrey/statuses/1515332797640192003,elmcmonterrey,4/16/2022 10:14 am,"Sábado de Gloria

Cerveza TKT Light o Indio de media $20 hasta las 9pm (límite 20 por persona) 
+
Cover 2x1 hasta las 9pm

Fútbol: Tigres-Toluca

La Banda del MC en VIVO + Boulevard SKA en el escenario del jardín desde las 10:30pm 
+
Adentro DJ Dense Denso perreo intenso 11pm https://t.co/UOWcZfjLta",Message,Photo,4030,0,"Monterrey, Nuevo León, Mexico",,,0,0,0,0,Origen cultural
Twitter,https://twitter.com/2JaviVazquez4/statuses/1515330964523831298,2JaviVazquez4,4/16/2022 10:07 am,Habra algo más naco que la afición Chiva? Jajaja se habian tardado neta,Message,Text Only,1327,0,"Casa Blanca, Puebla, Mexico",,,0,0,0,0,Odio
Twitter,https://twitter.com/nurimaca/statuses/1515327923603091459,nurimaca,4/16/2022 9:55 am,"PedroHe64552161 @fmartinmoreno Personajes de esa calaña no merecen a un país como México..no se reconocen mexicanos, les da pena... pobrecitos clasistas",Mention,Text Only,200,0,"Guadalajara, Jalisco, Mexico",,,0,0,0,0,
Twitter,https://twitter.com/claudiaaimeegom/statuses/1515326648819798024,claudiaaimeegom,4/16/2022 9:50 am,"EnriqueIturral1 El simplón hablando y olvidando que otros se disfrazan de izquierda y son homofóbicos, clasistas e iracundos con los q tienen",Mention,Text Only,641,0,"Azcapotzalco, Mexico City, Mexico",,,0,0,0,0,Sexodiversidad
Twitter,https://twitter.com/lopezramirez_/statuses/1515325538390450179,lopezramirez_,4/16/2022 9:45 am,"""Somos racistas"": El papa Francisco critica a la UE por dividir a los refugiados ""en primera y segunda clase"" favoreciendo a los ucranianos

https://t.co/5kqdR0ATR1",Message,Link,1104,0,"Casa Blanca, Puebla, Mexico",Men,,0,0,0,0,
Twitter,https://twitter.com/abd_elmr/statuses/1515324831943647233,abd_elmr,4/16/2022 9:42 am,"AlexHH32 @mando1029 No es culpa del indio, sino de aquellos que votan por ellos sabiendo que son traidores.",Mention,Text Only,183,0,"Tepic, Nayarit, Mexico",,,0,0,0,0,Origen cultural
Twitter,https://twitter.com/leyv_angel/statuses/1515323146823475205,leyv_angel,4/16/2022 9:36 am,"JAJAJAJAJAJAJA

POBRES IZMIERDISTAS MEJIKANOS
FRUSTRADOS Y FRACASADOS EN TODO
BOLA SE RESENTIDOS SOCIALES | QT: Aunque se antoje agandallar a la postre si  no se respetan inversiones el pago por repudio internacional sale más caro siempre.

https://t.co/Ih0xBZmIfv",Message,Text Only,706,0,"Venustiano Carranza, Mexico City, Mexico",Men,,0,0,0,0,Backlash
Instagram,https://www.instagram.com/p/CcafAvFsXfy/,,4/16/2022 9:35 am,"🖊️ No te puedes perder el #Heduardicidio de hoy, sábado 16 de abril de 2022, por Heduardo Rodríguez.

Uno nuevo cada día por larepublica.pe y en todas nuestras redes sociales.

#LaRepública #peru #alfredobarnechea #colonialismo #racismo #belenbarnechea #martíncabellodeloscobos",Message,Photo,0,1580,,,,1502,0,78,0,
