Network,Message URL,Profile,Date,Message,Type,Content Type,Followers,Engagements,Location,Gender,Age,Likes,Dislikes,Comments,Shares,Theme
Instagram,https://www.instagram.com/p/CcfuTRBuAdZ/,,4/18/2022 10:25 am,"#LaOpinión ✊🏽 ARGENTINA NO ES BLANCA

✍ Eliana Cabrera 

🗣️ El politólogo y activista afroargentino Federico Pinta brindó en el 2020 una conferencia realizada para el INAP (Instituto Nacional de la Administración Pública) que tiene a su cargo la elaboración de políticas públicas de formación profesional y capacitación de funcionarios y empleados. Allí introduce un elemento fundamental que debería ser crucial en la gestión pública: la perspectiva étnico-racial.

💬 El autor sostiene que sólo adoptando un enfoque de este tipo pueden desarrollarse políticas públicas que combatan el racismo y la discriminación. En “¿De qué hablamos cuando hablamos de racismo? La necesidad de una perspectiva étnico-racial en el desarrollo, implementación y evaluación de las políticas públicas”, Pinta habla de racismo estructural, institucional, interpersonal y, por último, un racismo criollo, argentino.

◾ Hablar de racismo estructural implica hablar de procesos y prácticas que reproducen la inequidad racial. La base de esto se encuentra en la idea de supremacía de lo blanco (asociado a “lo bueno”) sobre lo negro (asociado a “lo malo”), que se traduce como superioridad blanca/inferioridad negra, “ideología conocida originalmente como racismo científico o biologicista que dividía a la raza humana en subrazas y, a su vez, las jerarquizaba”.

◾ La idea de raza fue una forma de legitimar las colonizaciones y conquistas. La imposición del pensamiento con perspectiva eurocéntrica logró que se impusiera y naturalizaran esas relaciones de dominación, “los pueblos conquistados y dominados fueron situados en una posición natural de inferioridad y, en consecuencia, también sus rasgos fenotípicos, así como sus descubrimientos mentales y culturales”.

📲 Link de la nota completa en nuestra BIO.

#ArgentinaNoEsBlanca #Racismo #discriminación",Message,Photo,0,63,,,,63,0,0,0,Odio
Twitter,https://twitter.com/miguel1019/statuses/1516058583686955015,miguel1019,4/18/2022 10:18 am,"Que sugieres @g_quadri ? después de q no fue aprobada la reforma que sigue. | QT: Hoy López, perverso y resentido, va a dar un coletazo a México, estatizando el litio. Cerrará toda posibilidad de desarrollo en la minería de este metal. Imposible que el gobierno explore, explote y procese. No tiene capacidad, ni recursos ni tecnología. Seremos como Bolivia...",Message,Text Only,466,0,"Casa Blanca, Puebla, Mexico",Men,,0,0,0,0,Backlash
Instagram,https://www.instagram.com/p/CcfrolMr2nN/,,4/18/2022 10:02 am,"Los abusos policiales, en especial contra los negros, son un problema crónico en Brasil. Un nuevo mecanismo de la ONU sobre el racismo estructural puede ayudar, pero necesita una invitación oficial. Más de 130 organizaciones, entre ellas hrw, piden al gobierno que inviten a los expertos de la #ONU
#racismo #nacionesunidas #altoalracismo #racismoestrutural #brasil🇧🇷",Message,Photo,0,14,,,,14,0,0,0,
Twitter,https://twitter.com/C4iSinaloa/statuses/1516052321796440071,C4iSinaloa,4/18/2022 9:53 am,"𝗠𝗔𝗭𝗔𝗧𝗟𝗔́𝗡
Fluidez vial en Av Ejército Mexicano y Lola Beltrán, Col. Palos Prietos
@sspsinaloa1 #vialidad #c4isinaloa #911emergencias #ssp #sesesp @AytodeMzt #UsaCubrebocas #SanaDistancia https://t.co/vgpFgCmwAX",Message,Video,5133,0,"Villa de Costa Rica, Sinaloa, Mexico",,,0,0,0,0,
Twitter,https://twitter.com/DavidCa56005480/statuses/1516048212758564864,DavidCa56005480,4/18/2022 9:37 am,"SinEmbargoMX @anafrancismor Patética, ridícula y clasista 🤢🤮 https://t.co/6RTW3XjzMF",Mention,Photo,607,0,"Colonia Lindavista, México, Mexico",Men,,0,0,0,0,
Twitter,https://twitter.com/juan_wiechers50/statuses/1516042017201168387,juan_wiechers50,4/18/2022 9:12 am,"mario_delgado Estás bien ardido Mario, que creías que la mayoría de los mexicanos profesionistas, exitosos y con inteligencia, íbamos a dejar que parásitos ineptos muertos de hambre, acomplejados y resentidos con la vida de tu partido Morena hicieran un retroceso en materia eléctrica? Jajajaja",Mention,Text Only,2,0,"Jesus del Monte, México, Mexico",Men,,0,0,0,0,Backlash
Instagram,https://www.instagram.com/tv/Ccfk3GllvaL/,,4/18/2022 9:04 am,"Con algo de retraso compartimos este macrotema en el que participamos. Una iniciativa cojonuda de nuestro hermanito abbiad_ . Dadle amor en su canal. Gracias a todos los que ñusieron sus barras para hacerlo posible 🙏🏾💚

#racismo #stopracismo #rapantiracismo #amor #lucha #hiphop #colaboracion #macrotema #megatema #new",Message,Video,0,12,,,,10,0,2,0,
Twitter,https://twitter.com/alfredobrito/statuses/1516037369216053250,alfredobrito,4/18/2022 8:54 am,"DamianAIcazar Malditos aquellos resentidos que manipulan y mienten al pueblo y no aceptan sus derrotas, las derrotas son parte de la democracia (Yo)",Mention,Text Only,1277,0,"Cuautla Morelos, Morelos, Mexico",Men,,0,0,0,0,Backlash
Twitter,https://twitter.com/otroconvoyente/statuses/1516032148058386437,otroconvoyente,4/18/2022 8:33 am,Que es esa perra mamada de que Goofy pasee a pluto? Disney mostrando sus pedos racistas #ResurreccionMañanera https://t.co/ppamtfiBhm,Message,Photo,442,0,"Pachuca de Soto, Hidalgo, Mexico",,,0,0,0,0,
Instagram,https://www.instagram.com/p/CcfWK5RujFS/,,4/18/2022 6:54 am,"El racismo y la discriminación por el color de la piel y el respeto por la identidad marrón requieren de políticas con perspectiva étnico-racial

Argentina no es blanca, un artículo de Eliana Cabrera

Leé la nota completa. Link en biografía

#argentinanoesblanca #racismo #laopinionsl",Message,Photo,0,10,,,,10,0,0,0,
Instagram,https://www.instagram.com/p/CcfVmEyDyb7/,,4/18/2022 6:49 am,"3⭐
¿Una novela que promete mucha intriga y un mensaje social sobre el racismo? Me interesa. Eso fue lo que me hizo querer leer este libro y quizás por lo que me ha decepcionado tanto. Creo que la premisa estaba bien pero el ritmo de la novela es muy lento al principio, hasta pasada la mitad de la misma no empieza la 'acción' como tal. 
La segunda mitad he de decir que se me ha pasado volando pero tampoco ha conseguido transmitirme mucho. Sí, la intriga está ahí: ¿quién está enviando esas notas? ¿es X quien dice ser? Por esa parte bien, pero la respuesta a estas preguntas deja mucho que desear. Quizás me esperaba un giro de guion mucho más sorprendente y una crítica mucho más potente. 
El racismo y las microagresiones están muy presentes en toda la novela y es lo que me ha gustado: la visibilización de las mismas. Pero por lo demás (la crítica final) me esperaba algo más contundente, digamos que más Shani y menos Hazel, haciendo alusión a los personajes. 😌
Pese a todo, Nella me ha parecido buena protagonista, me ha gustado mucho conocerla a ella y su forma de pensar. Malaika también me ha gustado y creo que la autora podría haber desarrollado un poco más su personaje. 

En general, la trama no está mal. Me ha gustado la forma de escribir de Zakiya y el hecho de que haya dado voz a estos personajes. Aunque mis expectativas no eran muy altas y no haya logrado superarlas, sí que os recomendaría la novela igualmente, puede que a vosotres os guste más, los temas que tratan son bastante importantes y no está de más escuchar lo que Nella tiene que decir. 🤎

 -🤎🤎🤎🤎🤎🤎🤎🤎🤎-

#books #libros #bookstagram #criticasocial #racismo #umbriel #libro",Message,Photo,0,325,,,,312,0,13,0,
Instagram,https://www.instagram.com/p/CcfQEdOrB0G/,,4/18/2022 6:01 am,"FLIPO PEPINILLOS.

SOLO con la sinopsis perpetúan TODOS los estereotipos de las mujeres racializadas. Y es que para el salvador/a blanc@, la mujer racializada:

- Son todas iguales (""como cualquier otra gitana"").
- Tienen el futuro marcao por otros (""destinada"").
- Este estigma es reproducido generacionalmente ad perpetuum (""generación tras generación"").
- Se reproducen como conejos y valen solo como incubadoras (""críar a tantos niños COMO SEA POSIBLE""). 
- Si tiene carrera o no es hetero es una ""rara avis"" (""gitana poco común"").

Y espérate, que es que he leído que se cree pro-gitana y tó, que le dedicó el Goya a Vox ""para que vea una historia de amor entre dos gitanas lesbianas"" (o algo así).

Y es que todas estas salvadoras blancas, viven en un mundo de yupi en el que ellas o no tienen cultura (sino una especie de ideología neutra regida por la lógica) O tienen una cultura positiva que puede evolucionar y despojarse del machismo sin abandonar sus rasgos. Y viven su fantasía de que existe ""la gitana libre"" pero solo ""de sangre"", no ""de cultura"". O la mujer musulmana que es libre cuando es ""ex-musulmana"". O una de mis favoritas: la mujer africana (así, a lo loco: sin cultura ni nacionalidad, solo continente) a la que le han practicao un horror como la ablación de clítoris y esa mujer ya no quiere saber de África ni en mapas.

¿Cuál es el común denominador? Que TODAS deben abandonar su cultura pa ""ser libres"" porque no encuentran otro rasgo positivo en ellas. Todos son tradicionales sin salvación menos el entorno de la salvadora blanca. Y claro, se vuelven ""Las Occidentalas"" 🤦🏻‍♂️ Porque las mujeres racializadas no luchan contra el machismo como hacen en Occidente: huyen por su vida como la que escapa de una secta, porque no hay avances sociales en sus comunidades 👀

No sé, a lo mejor lo de ser maricón, pagano y un poquito judío me nubla. ¿Qué piensan gypsy_project milduquelas sefora_vargas_martin afropoderossa o asaaribibang ?

Estarás orgullosa, Arantxa. No serás ""la directora lesbiana"", como temías, sino ""la racista"".

🎼Magane - Miwa (Worship the Most Ancient)🎵

#carmenylola #racismo #antigitanismo #complejodesalvadorblanco",Message,Photo,0,34,,,,28,0,6,0,"Sexodiversidad, Género"
Twitter,https://twitter.com/bselene021/statuses/1515950993514586118,bselene021,4/18/2022 3:10 am,"lopezdoriga También desecharemos a estos partidos políticos mentirosos, vendepatrias, ladrones, corruptos, miserables, conveniencieros, racistas, en las siguientes elecciones, fuera!!!!",Mention,Text Only,14,0,"Magdalena Contreras, Mexico City, Mexico",Women,,0,0,0,0,
Twitter,https://twitter.com/pongantechno/statuses/1515947547759628288,pongantechno,4/18/2022 2:57 am,"CHINGA A TU MADRE @Pharrell | QT: Gracias The Weeknd por unir a SHM y no como el pendejo de Pharrell que nos separó a Daft Punk, eres un naco y u estúpido Pharrell",Message,Text Only,200,0,"Casa Blanca, Puebla, Mexico",,,0,0,0,0,Odio
Twitter,https://twitter.com/juan_wiechers50/statuses/1515947010918125568,juan_wiechers50,4/18/2022 2:55 am,"juncalssolano Eres pasante de abogado, no titulada porque tu coeficiente intelectual no te da para más, y se entiende. Eres AMLOVER y solo te quejas por llevar la corriente de una Chaira mas acomplejada y resentida con la vida. Tratas de opinar para ser influencer de Ixtapalacra",Mention,Text Only,2,0,"Jesus del Monte, México, Mexico",Men,,0,0,0,0,
Twitter,https://twitter.com/enrique_vc/statuses/1515946838997835776,enrique_vc,4/18/2022 2:54 am,claza3 @ShelzyMx Ese viejo no aprende. Seguirá siendo el mismo resentido y vengativo que ha sido toda la vida,Mention,Text Only,944,0,"Tlalpan, Mexico City, Mexico",Men,,0,0,0,0,Backlash
Twitter,https://twitter.com/juan_wiechers50/statuses/1515946155867262982,juan_wiechers50,4/18/2022 2:51 am,DamianAIcazar Eres tan insignificante como actor y tus opiniones son dignas de un chairo acomplejado y resentido. Un muerto de hambre que hoy no tiene trabajo y que como otros se ilusiona que su mesías lo va a sacar de pobre y le dará de comer. Eso no va a pasar NUNCA! Sigue SOÑANDO CHAIRO!,Mention,Text Only,2,0,"Jesus del Monte, México, Mexico",Men,,0,0,0,0,Backlash
Twitter,https://twitter.com/Lidiapbarcenas/statuses/1515945634397933570,Lidiapbarcenas,4/18/2022 2:49 am,"Gracias querido y estimado @abrahamendieta por tu comentario, solo dire al respecto que gracias a la bella profesión de Asesora Legislativa que desempeñé durante dos legislaturas, hoy podemos defender con la frente en alto al pueblo de Mexico. | QT: Las diputadas del PRD intentaron humillar a una de nuestras mejores diputadas, @Lidiapbarcenas, por haber trabajado como asesora antes de ser diputada. 

Qué clasistas y que necios son: gracias, Lidia, por cómo destrozaste con brillantez a quienes traicionan la patria.",Message,Text Only,1574,0,"Venustiano Carranza, Mexico City, Mexico",Women,,0,0,0,0,
Twitter,https://twitter.com/juan_wiechers50/statuses/1515944978517745664,juan_wiechers50,4/18/2022 2:47 am,"AndreaChavezTre Jajajaja Chaira acomplejada Jajajaja estamos contentos que tus amigos morenacos de Morena, gente que salió como tú de hoyos en la tierra y del caño, no pudieron contra la clase media y menos contra los millones de mexicanos que queremos modernidad y desarollo. Feliz por Mexico!",Mention,Text Only,2,0,"Jesus del Monte, México, Mexico",Men,,0,0,0,0,Tono de piel
Twitter,https://twitter.com/ArturoMedina196/statuses/1515933840304328706,ArturoMedina196,4/18/2022 2:02 am,"bere2h @vegitox45 @CosmoEntorno @AristeguiOnline Ja ja ja ja ja ja ja ¿hacemos qué?
Das el consejo y te quedas sin él.
""cómo que hay algo de comentario en tu clasismo"".
Ja ja ja ja ja ja ja ja ja ja ja ja ja ja ja ja ja https://t.co/wCoF2AoLHx",Mention,Photo,603,0,"Guadalupe, Zacatecas, Mexico",Men,,0,0,0,0,
Twitter,https://twitter.com/Morganna_Love/statuses/1515930089342607361,Morganna_Love,4/18/2022 1:47 am,"Las mujeres, (TODAS las mujeres) entramos a los baños de mujeres.
Qué estupidez, tener qué explicar esto en pleno 2022. 
Qué estupidez, que siga habiendo discriminación hasta para entrar a un baño. https://t.co/QgEQdz2pfL",Message,Photo,18716,455,"San Miguel de Allende, Guanajuato, Mexico",,,419,0,14,22,Género
Twitter,https://twitter.com/Cori_Ortg/statuses/1515922495861407750,Cori_Ortg,4/18/2022 1:17 am,"Tqm @sushitrash 💚  
@coachella te pasaste de naco",Message,Text Only,436,0,"Tlalpan, Mexico City, Mexico",Women,,0,0,0,0,Odio
Twitter,https://twitter.com/valeriabalboaaa/statuses/1515922230814728197,valeriabalboaaa,4/18/2022 1:16 am,Las que critican a las mujeres operadas es porque quieren y no pueden y están acomplejadas. Fin 🙏,Message,Text Only,1799,0,"Ciudad Victoria, Tamaulipas, Mexico",,,0,0,0,0,Género
Twitter,https://twitter.com/BernieMX/statuses/1515919953857335296,BernieMX,4/18/2022 1:07 am,"BurningMoon07 @FtAdrianH 1: falso (nadie me ha dado oportunidades laborales por ser blanco)
2: falso (nunca he ocupado un puesto “importante” en una empresa)
3, 4 y 5: falso (tener prestaciones es POR LEY, mejor sueldo con base en resultados y trabajar 40 horas por semana, sin importar color de piel).",Mention,Text Only,2338,0,"Colonia del Valle, Mexico City, Mexico",Men,,0,0,0,0,
Twitter,https://twitter.com/Alfredo54267811/statuses/1515917119652773888,Alfredo54267811,4/18/2022 12:56 am,"mario_dico50 No mms, hoy se demostró  que esos partidos están al servicio de una oligarquía, rapaz, cínica, corrupta, racista y clasista. Encabezada por el Jr. de @ClaudioXGG el verdadero patrón de esos grupúsculos. @mario_dico50",Mention,Text Only,49,0,"Cuernavaca, Morelos, Mexico",Men,,0,0,0,0,
Twitter,https://twitter.com/borregosos/statuses/1515916314635812866,borregosos,4/18/2022 12:53 am,"mario_delgado No estoy llorando, ezdeke ustedes son corruptos neoliberales que no quieren al país, y no estoy llorando es el humo del cigarrillo que me hace llorar. MALDITOS CONSERVADORES, CLASISTAS, VENDE PATRIAS, GGGGUUUUAAAA, GGGGUUUUAAA!!! ya me voy a casa, no me siento bien. https://t.co/4QZEhr0IrB",Mention,Photo,188,0,"Ciudad Lopez Mateos, México, Mexico",Men,,0,0,0,0,Backlash
Twitter,https://twitter.com/BurningMoon07/statuses/1515914605725458432,BurningMoon07,4/18/2022 12:46 am,"pulidomartin Yo vivo en Oaxaca y cada vez es más notorio que la gente blanca saque de sus propias tierras a la gente y, peor aún, dejando sin trabajo, alimentos, viviendas y agua a comunidades enteras por los mismos saqueos. Eso sin contar el constante racismo y violencia.",Mention,Text Only,299,0,"Oaxaca de Juarez, Oaxaca, Mexico",,,0,0,0,0,
Twitter,https://twitter.com/Alfredo54267811/statuses/1515911641505931265,Alfredo54267811,4/18/2022 12:34 am,"julenrementeria Que hipocrita y cinico eres, los que se sienten dueños de México,  son ustedes que son los lamenbotas de una oligarquía rapaz, corrupta, entreguista y racista, que pronto van a pagar la factura por sus actos de traición a la patria. @julenrementeria",Mention,Text Only,49,0,"Cuernavaca, Morelos, Mexico",Men,,0,0,0,0,Backlash
Twitter,https://twitter.com/renekmp/statuses/1515910833192435713,renekmp,4/18/2022 12:31 am,"aracelibs @diputadospan @GPPRIDiputados @GPPRDmx @MovCiudadanoMX Nunca más el pais en manos de ineptos,resentidos  tomando decisiónes vitales para el progreso.",Mention,Text Only,1471,0,Mexico,,,0,0,0,0,Backlash
Twitter,https://twitter.com/dennysgomez/statuses/1515910039030190086,dennysgomez,4/18/2022 12:28 am,"Eres un Corrupto, mentiroso, resentido y cínico. Traidor a México. | QT: Ya lo dije en mi informe del martes: pase lo que pase ya estamos blindados contra la traición. Mañana lo vuelvo a explicar.",Message,Text Only,569,0,"Aguascalientes, Aguascalientes, Mexico",,,0,0,0,0,Backlash
Twitter,https://twitter.com/JaimeGonzalezSu/statuses/1515906330535641090,JaimeGonzalezSu,4/18/2022 12:13 am,"terrazas_prieto TRAICIÓN A LA PATRIA ES...

NO ABASTECER DE MEDICINAS AL PUEBLO!!!

QUE SE ESCUCHÉ FUERTE Y CLARO.",Mention,Text Only,2160,0,"San Nicolas de los Garza, Nuevo León, Mexico",Men,,0,0,0,0,
Twitter,https://twitter.com/PeTeRpHuNk/statuses/1515904140391583746,PeTeRpHuNk,4/18/2022 12:04 am,#vivelatino2022 #beerstagram #chela #indio en Autódromo Hnos. Rodríguez https://t.co/VmPytOZEjz,Message,Link,291,0,"Iztacalco, Mexico City, Mexico",,,0,0,0,0,Origen cultural
Twitter,https://twitter.com/Renegado_L/statuses/1515903817358921734,Renegado_L,4/18/2022 12:03 am,"La cínica diputada priísta que salió a burlarse de la gente que apoya la reforma eléctrica, dice que no salió a burlarse de la gente. Lo vimos todos. Y encima los llama ""acarreados"". Su clasismo es insultante, su cinismo más. | QT: Yo no me burlé del pueblo, fui a decirle a los acarreados de Morena, que nos han amenazado y amedrentado, que su reforma #NoVaAPasar. 

Burlarse del pueblo es que caduquen medicinas, que sigan matando a mexicanas y que niños con cáncer mueran por la ineptitud del gob. de Morena.",Message,Text Only,2441,1,"Poza Rica de Hidalgo, Veracruz, Mexico",,,0,0,0,1,
Twitter,https://twitter.com/Jupiter_57/statuses/1515900372602261506,Jupiter_57,4/17/2022 11:49 pm,"terrazas_prieto Lamentó mucho decirle que su mamá olvidó tomar Ácido folico, pada q usted fuera una persona normal. Lo lamentó",Mention,Text Only,1216,0,"Tlalpan, Mexico City, Mexico",Men,,0,0,0,0,
Twitter,https://twitter.com/MarioLo73735738/statuses/1515899540921933831,MarioLo73735738,4/17/2022 11:46 pm,"terrazas_prieto Eres un orgullo para el país,gracias.",Mention,Text Only,71,0,Mexico,Men,,0,0,0,0,
Twitter,https://twitter.com/Basultomares/statuses/1515898374385512452,Basultomares,4/17/2022 11:41 pm,terrazas_prieto QUE LAMENTABLE,Mention,Text Only,1883,0,"Tepic, Nayarit, Mexico",Men,,0,0,0,0,
Twitter,https://twitter.com/Alondraalunaaa/statuses/1515896604389261315,Alondraalunaaa,4/17/2022 11:34 pm,"Las personas religiosas son en su mayoría las más culeras, racistas, infieles, clasistas, víboras y aún así “sensibles” a Dios, que asco la hipocresía, que asco ser algo que no eres, es de terror las personas doble moral. | QT: I refuse to believe that a person who did this to another human being can teach me about God. https://t.co/BqKJ1GDDQu",Message,Text Only,484,0,"Puerto Escondido, Oaxaca, Mexico",Women,,0,0,0,0,
Twitter,https://twitter.com/JoeDoe2018/statuses/1515895528374124552,JoeDoe2018,4/17/2022 11:30 pm,terrazas_prieto Hacer más rico a Manuel Bartlet y a los hijos sanganos del kakas,Mention,Text Only,2019,0,Mexico,Men,,0,0,0,0,
Twitter,https://twitter.com/EseMugresLocote/statuses/1515893514965557248,EseMugresLocote,4/17/2022 11:22 pm,"Qué bueno que  Diputado Alfredo Femat Bañuelos acepta que Morena y el PT son unos resentidos sociales. Palabras más, palabras menos.",Message,Text Only,4,0,"Cuauhtemoc, Mexico City, Mexico",Men,,0,0,0,0,Backlash
Twitter,https://twitter.com/caromonnn/statuses/1515892522530213892,caromonnn,4/17/2022 11:18 pm,"Como se va a llamar o se llama la discriminación por tu signo zodiacal? 🤣 digo, porque ya veo muchas de esas mamadas en twitter y siento que se está haciendo real ser discriminado por eso 🤣",Message,Text Only,86,0,"Las Delicias, Baja California, Mexico",,,0,0,0,0,
Twitter,https://twitter.com/onungarayl/statuses/1515891338344026112,onungarayl,4/17/2022 11:13 pm,ManadaPolitica Ya duro más la sesión que la congruencia racista de @callodehacha,Mention,Text Only,9,0,"Santa Rosa Jauregui, Querétaro, Mexico",,,0,0,0,0,
Twitter,https://twitter.com/ALIZAND69159211/statuses/1515888811817029634,ALIZAND69159211,4/17/2022 11:03 pm,"terrazas_prieto Obvio, borrega al servicio del KKSLAGARTO OBRADOG.",Mention,Text Only,408,0,Mexico,,,0,0,0,0,
Twitter,https://twitter.com/jmartinez67/statuses/1515885844883820553,jmartinez67,4/17/2022 10:52 pm,"Seputv Si, seria genial ver a toda esa bola de resentidos empoderados, cuando se las metan doblada @Taibo2 dixit, y les escurra la lagrimita... https://t.co/k6nKYcVNNT",Mention,Photo,860,0,Mexico,Men,,0,0,0,0,Backlash
Twitter,https://twitter.com/jmartinez67/statuses/1515883293232844801,jmartinez67,4/17/2022 10:41 pm,"Ya les anda ardiendo el culo.
Toma, arrastrado y resentido.
Reparte a conveniencia

#GobiernoDeResentidos
#LopezFracasoPresidencial 
#ChayoteroDe4ta https://t.co/0fJPIq96E1 | QT: La diputada @Mzavalagc debería abstenerse de votar en la #ReformaEléctrica por conflicto de interé$. https://t.co/r3UoPcBvDW",Message,Photo,860,0,Mexico,Men,,0,0,0,0,Backlash
Twitter,https://twitter.com/ivanovic/statuses/1515877596151619587,ivanovic,4/17/2022 10:19 pm,"PPmerino Eres un pobre naco arrastrado, la vida te cobrará lo que hiciste, ivermectino…",Mention,Text Only,3137,0,"Coyoacan, Mexico City, Mexico",,,0,0,0,0,Odio
Twitter,https://twitter.com/anaruna19/statuses/1515877003689349125,anaruna19,4/17/2022 10:16 pm,rubenanguiano Me turbo caga el naco ese,Mention,Text Only,2134,0,"Guadalajara, Jalisco, Mexico",,,0,0,0,0,Odio
Twitter,https://twitter.com/magodguz/statuses/1515876320336564230,magodguz,4/17/2022 10:14 pm,"josegrillosr El poner ""mute"" cuando hablan estas personas, es violencia? Es discriminación?  O es instinto de conservación?",Mention,Text Only,207,0,"Monterrey, Nuevo León, Mexico",Men,,0,0,0,0,
Twitter,https://twitter.com/JEPH141099/statuses/1515874460607336451,JEPH141099,4/17/2022 10:06 pm,Ferrus2022 @alemorag @LouisAlbertVel1 @rebecabr97 @janellyfarias @Rayadas O sea que te dolería mucho que tu hija sea lesbiana o hijo sea homosexual??? Pinche resentido pendejo,Mention,Text Only,38,0,"Aguascalientes, Aguascalientes, Mexico",Men,,0,0,0,0,"Sexodiversidad, Backlash"
Twitter,https://twitter.com/ferkobustos/statuses/1515870967960068102,ferkobustos,4/17/2022 9:52 pm,"A prieto lo mataron Kevin | QT: @Agustguerrero @JerseysLeonfc Hahaha puta madre no los ubico bien ese quería decir, el que agarra chichis en las fotos",Message,Text Only,973,0,"Ixtapa, Jalisco, Mexico",,,0,0,0,0,
Twitter,https://twitter.com/cecyclon/statuses/1515870617408794626,cecyclon,4/17/2022 9:51 pm,Elisabe48599065 @Worthy_high @burgerking_es Que tienen que ver los ricos? No tener hijos puede ser decisión de cualquier clase social.,Mention,Text Only,775,0,"Monterrey, Nuevo León, Mexico",,,0,0,0,0,
Twitter,https://twitter.com/RafaelHCarrillo/statuses/1515867178326794244,RafaelHCarrillo,4/17/2022 9:37 pm,"terrazas_prieto Que le parece si de paso le solicita al gobierno federal las vacunas para los menores de 15 años?
#Vacunaparalosmenoresde15",Mention,Text Only,444,0,"San Miguel de Cozumel, Quintana Roo, Mexico",Men,,0,0,0,0,
Twitter,https://twitter.com/Cristian_GlzMej/statuses/1515865541881188356,Cristian_GlzMej,4/17/2022 9:31 pm,"Este tuit me representa 100% | QT: Quiero que esto se lea lo más clasista que se pueda, porque así es.

Morena, son unos gatos.",Message,Text Only,397,0,"Ixtapa, Jalisco, Mexico",,,0,0,0,0,
Twitter,https://twitter.com/JavierR58080761/statuses/1515857051171246082,JavierR58080761,4/17/2022 8:57 pm,"PedroGmezJunco1 @crankyblogmx @orramos @Cinemex @MarioRdCh @anodis @therobanda @rubmaza @baruchdom @LeonRiosManuel @OphCourse @HectorTrejo @PacoRobledo @monicagarzag Pobre hombresito clasista y marginado debe ser tan triste tu vida insulsa y vacía felicito que escondas tu cara tras una imagen, por qué debe dar vergüenza mostrarla.",Mention,Text Only,24,0,Mexico,Men,,0,0,0,0,
Twitter,https://twitter.com/JackAngel0/statuses/1515853772366532610,JackAngel0,4/17/2022 8:44 pm,"Chikoelektriko Y a los negros no se les dejaba en lugares visibles en restaurantes.

El latino siempre se le ha visto con desprecio (entre nosotros mismos vemos nuestras raíces con asco). Y discriminación es mala, no importa su nivel, es mala la discriminación.",Mention,Text Only,1421,0,"Naucalpan de Juarez, México, Mexico",,,0,0,0,0,
Twitter,https://twitter.com/MauGG/statuses/1515852016844693507,MauGG,4/17/2022 8:37 pm,Sí es clasista. | QT: No es clasista aspirar a que nuestros legisladores tengan la escolaridad mínima que les ayude a comprender lo que votan.,Message,Text Only,614,0,Mexico,Men,,0,0,0,0,
