Network,Message URL,Profile,Date,Message,Type,Content Type,Followers,Engagements,Location,Gender,Age,Likes,Dislikes,Comments,Shares,Theme
Twitter,https://twitter.com/AnaaMaryya1596/statuses/1504115829410914310,AnaaMaryya1596,3/16/2022 11:22 am,Quien habrá sido el wey que atropelló a un zorrillo en Naco az? 😂 huele horrible 😣,Message,Text Only,58,0,"Naco, Arizona, United States",Women,,0,0,0,0,Odio
Twitter,https://twitter.com/Gerardo13502558/statuses/1504114991145918465,Gerardo13502558,3/16/2022 11:18 am,"TheMelomaniac @SJcurioseando @siver06 @unam_enrique @AristeguiOnline Inga tu m.... Derechango resentido, reportar ? Jajajaja ve y denuncia primero a tu abuel..... Sinvergüenza y agachon",Mention,Text Only,69,1,"Iztapalapa, Mexico City, Mexico",Men,,0,0,1,0,Backlash
Instagram,https://www.instagram.com/p/CbK07dOuQlq/,,3/16/2022 11:08 am,"FAB5FREDDY OPINA SOBRE EL RACISMO EN EL MUNDO 420 🍁 Como miembro de la comunidad hip-hop y creativa, el fundador de B NOBLE nunca ha rehuido hablar del c4nn4bis y de su sólida historia mundial y su impacto en la salud y el bienestar. 

🥦 Últimamente, la comunidad se ha reunido para arrojar luz sobre el oscuro y sistemáticamente racista sistema del que forma parte el c4nn4b1s. En la película que dirigió titulada Grass is Greener se supo que, a pesar de sus vínculos con la salud y el bienestar, la m4rihu4na ha sido criminalizada durante mucho tiempo. Ésta es una forma de continuar con la esclavitud de las personas de color y de obtener beneficios económicos, ya que se trata de una industria en crecimiento que todavía está en sus primeras etapas.

💪 Ese punto de vista está cambiando. Ya en el 2021, 18 estados y el Distrito de Columbia han legalizado pequeñas cantidades de m4rihu4n4 para uso adulto. Además, el c4nn4bi5 se ha convertido en una industria de mil millones de dólares, alimentada por más de 7.000 dispensarios en todo Estados Unidos. 

💥 Sin embargo, la posesión de c4nn4b1s todavía puede acarrear penas de prisión, y las personas racializadas siguen teniendo 3,6 veces más probabilidades de ser arrestadas por esto que las blancas; por lo que todavía queda mucho trabajo por hacer.

👉 El artista Fab 5 Freddy comparte sus esfuerzos para traer justicia a presxs por c4nn4b1s y mucho más en elplanteo.com (link en bio). 

📸 vía harpersbazaarus

#Fab5Freddy #opinion #420 #racismo #rap #presosporcultivar 
Todo el material compartido por el.planteo tiene fines únicamente periodísticos e informativos.",Message,Photo,0,134,,,,133,0,1,0,
Twitter,https://twitter.com/QfbFlores/statuses/1504107710853300224,QfbFlores,3/16/2022 10:49 am,"Daisgu9 @JuanCar23323745 @RoninShaolin @jrsestaca @EVIDEGARAY @eliniestae Son unos hipócritas, pusilánimes y queda bien, creen que apoyando a las minorías se ven muy bien pero no demuestran más que su mojigateria, en el fondo son unos homofobos, misoginos y clasistas sobretodo el enano calvo ese que se cree rocky balboa.",Mention,Text Only,32,4,"Ciudad Nezahualcoyotl, México, Mexico",,,3,0,1,0,Sexodiversidad
Twitter,https://twitter.com/SalmaLuevano/statuses/1504104785460477954,SalmaLuevano,3/16/2022 10:38 am,arturoavila_mx @mario_delgado @Nora_Ruvalcaba @AndreaChavezTre @abrahamendieta @yeidckol @terrazas_prieto @MiguelTorrucoG @jramirorobledo La Reforma Eléctrica VA,Mention,Text Only,13186,0,"Cuauhtemoc, Mexico City, Mexico",Women,,0,0,0,0,
Twitter,https://twitter.com/Jo_ran_/statuses/1504102429729730561,Jo_ran_,3/16/2022 10:28 am,"rosa_ferndez @elpostlector @m_horno @medidorderuidos @ameriqo @lengwitch Un buen ejemplo de acentismo que lamentablemente es más común de lo que se cree. A veces deshacerse del acento le llaman ""mejora dicción"", pero no deja de ser acentismo, otra de las manifestaciones de la discriminación lingüística.",Mention,Text Only,1980,4,Mexico,Women,,3,0,1,0,
Twitter,https://twitter.com/JEnrique_CS/statuses/1504100056919650311,JEnrique_CS,3/16/2022 10:19 am,"eltepitazo @vampipe Concuerdo. Muchos invierten en universidades caras y no tienen las competencias suficientes. Muchos tienen grandes capacidades y competencias egresados de universidades como la ICEL. Es cuestión de actitud y ganas.

El clasismo no lleva a nada @vampipe ¿dónde estudiaste? 🤔",Mention,Text Only,326,26,"Cuauhtemoc, Mexico City, Mexico",Men,,21,0,5,0,
Twitter,https://twitter.com/DrAntorse/statuses/1504096082640482306,DrAntorse,3/16/2022 10:03 am,"kartero32 @j_olar @SCJN De hecho los casos de discriminación por embarazo han sido el parteaguas al respecto y ello es lo mejor!
Solo qué hay muchos otros casos de discriminación que incluso señalan agresores en específico y hay que tomar medidas diferentes a los casos de embarazo 🙌🏻",Mention,Text Only,2986,2,"Pachuca de Soto, Hidalgo, Mexico",Men,,1,0,1,0,
Twitter,https://twitter.com/alviruela/statuses/1504094306054909957,alviruela,3/16/2022 9:56 am,"ChumelTorres Otra paradoja de la derecha: Promover todos los días el racismo y, a la vez, sentirse tarahumara.",Mention,Text Only,12703,226,"El Pueblito, Querétaro, Mexico",Men,,195,0,6,25,
Twitter,https://twitter.com/chamuquito/statuses/1504072674049466372,chamuquito,3/16/2022 8:30 am,"""Todos esos proyectos son basura. Santa Lucía era el mejor, y nos ha dado una ganancia de 1%.""

Lean a @macariomx y lloren.

Los caprichos de un sociopata inepto y resentido cuestan. 

https://t.co/YGVvaWbm6i",Message,Link,1330,0,"Tesistan, Jalisco, Mexico",Men,,0,0,0,0,Backlash
Twitter,https://twitter.com/elbridon/statuses/1504064877240979462,elbridon,3/16/2022 7:59 am,"OvidioPeraltaS @senadomexicano @OITnoticias @NGomezUrrutiaMX @Pat_MercadoC @morena_tab @RedMorenaMex @SinLinea_Mx @SinEmbargoMX @LaDenuncia_Tab @ObradoristaMex @SenadoUGenero Haberlo hecho antes, por 18 años fui víctima de discriminación,  insultos y humillaciones en @ChryslerMX, a pesar de ser el mejor empleado en mi grupo. Hasta que sin motivo me despidieron en 2005.",Mention,Text Only,416,0,Mexico,Men,,0,0,0,0,
Twitter,https://twitter.com/GerA20076499/statuses/1504034806602084357,GerA20076499,3/16/2022 6:00 am,"SergioSarmiento Mente colonial, enana, clasista",Mention,Text Only,61,0,"Merida, Yucatán, Mexico",,,0,0,0,0,
Twitter,https://twitter.com/JuampiSwan/statuses/1504002155216359425,JuampiSwan,3/16/2022 3:50 am,"ohdiosa__ Si se educara sabría que :
1) La ""ideología de género"" no existe
2) La comunidad LGBT no dice que existan 112 géneros.
3) La diversidad sexual no es una ideología.
4) Tanto le arde la sexualidad ajena que tiene que mentir para justificar su discriminación?",Mention,Text Only,365,1,"Magdalena Contreras, Mexico City, Mexico",Men,,0,0,1,0,
Twitter,https://twitter.com/CHAVADOR71/statuses/1503997292260507650,CHAVADOR71,3/16/2022 3:31 am,CharliePeanutss @prieto_noah Le está gritoneando! https://t.co/RqQaMetORR,Mention,Photo,614,1,"Veracruz, Veracruz, Mexico",Women,,1,0,0,0,
Twitter,https://twitter.com/Rideonbeat/statuses/1503974568238755845,Rideonbeat,3/16/2022 2:00 am,"¿Qué tendrá que ver que personas de la misma edad nos veamos tan diferentes de edad?

¿Genética, color de piel?

Vi fotos de un par de amiges (Hombre y Mujer) que se ven mas grandes que yo, mucho.

¿Vida emocional?..",Message,Text Only,1907,4,"Ecatepec, México, Mexico",,,3,0,1,0,Género
Twitter,https://twitter.com/FrenteQueretano/statuses/1503973257300561920,FrenteQueretano,3/16/2022 1:55 am,"Por historias de EXCLUSIÓN como ésta 👇 es que en #Querétaro requerimos la Ley Anti Discriminación para proteger a las personas sin hogar!!!!

@DaniSalgadoXI 
@Legislatura_Qro https://t.co/DEQQO0wx5U | QT: Vivimos en un estado que discrimina y excluye a las personas que habitan las calles.
El día de hoy en la @AlcCuauhtemocMx se les negó la inscripción a un programa social a personas trans que viven en situación de calle o se encuentran en riesgo, solo por la falta de INE.
🧵 https://t.co/bNkutzxGE1",Message,Link,3062,14,"Santa Rosa Jauregui, Querétaro, Mexico",,,10,0,0,4,Género
Twitter,https://twitter.com/Zeligthecat/statuses/1503960042202189826,Zeligthecat,3/16/2022 1:03 am,"Voy caminando por https://t.co/NO0hJB5vyf y me encuentro a un pendejé simpático, le grito “¡eeh, pendejé! ¡Que simpático! ¡Tú y tus pendejadas! Ahora soy homofobico, homeless, pito chico y además prieto feo por no usar una foto mia🤷🏽‍♂️ https://t.co/rpFbXB4Xiv | QT: @Zeligthecat Pos tan te importa que hasta citaste mi tuit. 😂🤡

Y no estoy midiendo nada. Solo me encanta callar hocicos de pocoshuevos que no pueden ni dar la cara en redes y se ocultan en el anonimato… pero estoy seguro de que si nos la midiéramos, hasta eso tendría más grande que tú.☺️",Message,Link,75,0,Mexico,,,0,0,0,0,
Twitter,https://twitter.com/SrJuanPapas/statuses/1503956615854276608,SrJuanPapas,3/16/2022 12:49 am,vamajiz Tal vez es complejo de inferioridad. Solo se me hizo gracioso tu tuit porque más de una persona en mi tl puede sentir sentirse «related» y quería compartirlo con ellas.,Mention,Text Only,1436,1,"Guadalajara, Jalisco, Mexico",,,0,0,1,0,
Twitter,https://twitter.com/YessicastilloR/statuses/1503954795123589120,YessicastilloR,3/16/2022 12:42 am,Me dijeron clasista por salir con un wey que gana menos dinero que yo e invitarlo a comer a un lugar donde no puede pagar toda la cuenta pero sí su parte (?),Message,Text Only,2371,7,"Colonia del Valle, Mexico City, Mexico",,,5,0,2,0,
Twitter,https://twitter.com/VicMac123/statuses/1503952210107015171,VicMac123,3/16/2022 12:32 am,"carlos21009996 @jimmy_bad @LauraMex @elmichoacano36 Así es , factor inflacionario muy cabron , para todo se ocupa , el tema es que los clasistas acusan de clasista",Mention,Text Only,5813,3,"Medina, Guanajuato, Mexico",Men,,2,0,1,0,
Twitter,https://twitter.com/VicMac123/statuses/1503949214480486400,VicMac123,3/16/2022 12:20 am,"jimmy_bad @carlos21009996 @LauraMex @elmichoacano36 Sin entrar en polémica ayer me trató de Clasista una persona que sigue a López y el primero me dijo , que por qué reclamó lo de la gasolina QUE NI CARRO TENÍA ! Le dije , tengo 5 , y se ofendió , me dijo que no cierto era en fin, dijo que López Inc SM sin inflación",Mention,Text Only,5813,2,"Medina, Guanajuato, Mexico",Men,,1,0,1,0,
Twitter,https://twitter.com/7828900d8314452/statuses/1503945789034356739,7828900d8314452,3/16/2022 12:06 am,"HersRivera @BodegaAurrera Es un pésimo servicio de muchas tiendas de autoservicios, bodega Aurrerá, la comer, personal de seguridad mal capacitado que incluso tienen la primaria trunca, empresas de seguridad patito que solo molestan a clientes, discriminación.",Mention,Text Only,26,2,"Miguel Hidalgo, Mexico City, Mexico",Men,,2,0,0,0,
Twitter,https://twitter.com/Alejand20660454/statuses/1503944668022771724,Alejand20660454,3/16/2022 12:02 am,"SI LOS INMIGRANTES MEXICANOS TUBIERAN EL MISMO COLOR DE PIEL QUE LOS UCRANIANOS, NO SERIA TAN NOTORIO EL ESPANTOSO RACISMO DE LOS ANGLOSAJONES NORTEAMERICANOS Y LOS RECIBIRIAN CON LOS BRAZOS ABIERTOS.",Message,Text Only,10,0,"Jiutepec, Morelos, Mexico",Men,,0,0,0,0,
Twitter,https://twitter.com/ElRobDeLosAutos/statuses/1503938521937100804,ElRobDeLosAutos,3/15/2022 11:37 pm,"elbrigavive @AleB1808 El cerdo ni los zapatos se lustra, es un pinche naco.",Mention,Text Only,1372,1,"Miguel Hidalgo, Mexico City, Mexico",Men,,1,0,0,0,Odio
Twitter,https://twitter.com/JuampiSwan/statuses/1503937868707860484,JuampiSwan,3/15/2022 11:35 pm,"tiramisunga Sus comentarios solo reflejan la nula cultura que tiene sobre el tema.
Sus discursos de discriminación y difamación son un atentado contra los derechos humanos.
4) Edúquese",Mention,Text Only,365,0,"Magdalena Contreras, Mexico City, Mexico",Men,,0,0,0,0,
Twitter,https://twitter.com/MauricioEdoMex/statuses/1503931089143975940,MauricioEdoMex,3/15/2022 11:08 pm,"“Falso que los de la clase gobernante seamos racistas.  Los racistas son los indios y los nacos y la plebe y el infelizaje, que prefieren fracasar con tal de no tratarnos.” Carlos Monsiváis",Message,Text Only,59,4,"Cuautitlan, México, Mexico",Men,,4,0,0,0,"Odio, Origen cultural"
Twitter,https://twitter.com/jccoellar2001/statuses/1503930460644294657,jccoellar2001,3/15/2022 11:05 pm,"principales aplaudidores son los que ven la Rosa de Gpe., los de primaria trunca, los que son pobres por holgazanes, los resentidos, los ignorantes; los COMPRADOS con ntro. dinero a través de sus programas clientelares, etc. López es un asco. A esa",Mention,Text Only,3849,4,"Ixtapa, Jalisco, Mexico",Men,,3,0,1,0,Backlash
Twitter,https://twitter.com/Betty94222278/statuses/1503930120096165892,Betty94222278,3/15/2022 11:04 pm,"CarlosdelfinoM @Michitriste08 @LyKawai @DalasReview @CarolPizzii @aroiagarcia A lo mejor el acomplejado eres tú , decir que  engañan a alguien  sin  pruebas , basándose en "" jiji le dijo hola ,se rió de un chiste  jiji, a lo mejor no sabes cómo son las relaciones  , y piensas que si se saludan de  mano se pueden embarazar a personas",Mention,Text Only,0,1,Mexico,Women,,0,0,1,0,
Twitter,https://twitter.com/jccoellar2001/statuses/1503929715433873409,jccoellar2001,3/15/2022 11:02 pm,"Yo antes me abstenía de hacer comentarios clasistas, pero López provoca que los haga, porque él lleva 3 años clasicándonos: fifís, aspiracionistas, conservadores, clase media, nivel académico, estudios en el extranjero, etc., etc. Él me hace decir que sus",Message,Text Only,3849,6,"Ixtapa, Jalisco, Mexico",Men,,5,0,1,0,
Twitter,https://twitter.com/Betty94222278/statuses/1503927498542882817,Betty94222278,3/15/2022 10:53 pm,"Michitriste08 @LyKawai @DalasReview @CarolPizzii @aroiagarcia Acomplejado por qué, chíquitó , ves solo ustedes son capaces de repetir todo lo que diga su youtuber  si ( son acosadores  disfrazados de  de spam )",Mention,Text Only,0,1,Mexico,Women,,0,0,1,0,
Twitter,https://twitter.com/Marrioal1/statuses/1503923807664459779,Marrioal1,3/15/2022 10:39 pm,"#Francamente 

Veo a un individuo resentido, con graves problemas de megalomanía, desesperado, manipulador, distractor, cínico... pero lo peor lo peor son sus seguidores; ciegos, obstinados, ridículos, ingenuos, ignorantes, y cómplices de que nos esté llevando la chingada... 😕 https://t.co/XvT1CUExOZ | QT: #Francamente https://t.co/ljSZtlzq4K",Message,Link,210,0,"Venustiano Carranza, Mexico City, Mexico",Men,,0,0,0,0,Backlash
Twitter,https://twitter.com/Cass2809Sergio/statuses/1503920178739875840,Cass2809Sergio,3/15/2022 10:24 pm,"karlamotte Es un gran punto de vista, lástima que la cortedad de miras y el clasismo y aspiracionismo de la oposición no les permite comprenderlo",Mention,Text Only,1983,1,Mexico,Men,,1,0,0,0,
Twitter,https://twitter.com/EL_FRIJOL/statuses/1503919849654960128,EL_FRIJOL,3/15/2022 10:23 pm,econokafka @Garcimonero Neta? Tu pinché chiste malo y clasista? https://t.co/PTYwJsylHZ,Mention,Photo,431,3,"Santa Catarina, Nuevo León, Mexico",,,2,0,1,0,
Twitter,https://twitter.com/MD_Marvellous/statuses/1503914935671271425,MD_Marvellous,3/15/2022 10:03 pm,"IvDiesAtTheEnd Ay típico pelmazo resentido que se siente heroe del pueblo por atacar a médicos. 

Seguro huele a humedad.",Mention,Text Only,28218,6,Mexico,,,5,0,1,0,Backlash
Twitter,https://twitter.com/Gerardo13502558/statuses/1503908316493275139,Gerardo13502558,3/15/2022 9:37 pm,"magobanda @TopCat81069 @abrahamendieta @epigmenioibarra Pues aprisa a ver si así cierra la boca tanto derechango resentido y para que de verdad hablen,",Mention,Text Only,69,1,"Ciudad Nezahualcoyotl, México, Mexico",Men,,0,0,1,0,Backlash
Twitter,https://twitter.com/ChristMont/statuses/1503907506094952448,ChristMont,3/15/2022 9:34 pm,LaLic0ficial Tiene días así. Peleando contra todos defendiendo algo que no tiene que defender. Le salto lo clasista y algunas otras cositas que se le salen a uno cuando está furioso. Se nota su enojo su furia coraje y como dicen en mi pueblo. Lo varilla.,Mention,Text Only,788,6,"Miguel Aleman (La Doce), Sonora, Mexico",,,3,0,3,0,
Twitter,https://twitter.com/josepadilla2012/statuses/1503906859153084421,josepadilla2012,3/15/2022 9:31 pm,arturoavila_mx @jramirorobledo @mario_delgado @Nora_Ruvalcaba @SalmaLuevano @AndreaChavezTre @abrahamendieta @yeidckol @terrazas_prieto @MiguelTorrucoG Izquierda trasnochada tan ineficiente como corrupta,Mention,Text Only,612,1,Mexico,Men,,1,0,0,0,
Twitter,https://twitter.com/betocreativo/statuses/1503906222524682244,betocreativo,3/15/2022 9:29 pm,"Todos los filtros de belleza de apps como tik tok y similares son para ""blanquificar"" a la gente. 

Ahora es que caigo en cuenta.

Nojoda, lo del racismo en las apps es muy cierto.",Message,Text Only,1589,3,Mexico,,,2,0,1,0,
Twitter,https://twitter.com/NastyPepeRex/statuses/1503869408279777282,NastyPepeRex,3/15/2022 7:03 pm,"Querétaro y su gran desigualdad en las clases sociales. ⚠️ https://t.co/TFis70cuka | QT: @LuisBNava Terrible, apenas visibilizan unas cuantas cuadras de lo que es QUERÉTARO, cuando el municipio en general está echo un desastre. 
Colonias inseguras, sin calles ni banquetas, sin drenaje, pueblos abandonados y comunidades incomunicadas, etc. 
¿Qué presumen si de todo se carece?",Message,Link,7,0,"Santa Rosa Jauregui, Querétaro, Mexico",Men,,0,0,0,0,
Twitter,https://twitter.com/JuampiSwan/statuses/1503869154255900673,JuampiSwan,3/15/2022 7:02 pm,"ReliginFeminis1 @EliecerLondRuiz @puntalanza @Estamos_Listas @lorena_robayo @falsofeminismo @MamelaFialloFlo @tony73_ @SuperQwarrior @Vegasaez_ Igualdad, difamación, discriminación y calumnia.",Mention,Text Only,365,1,"Magdalena Contreras, Mexico City, Mexico",Men,,0,0,1,0,
Twitter,https://twitter.com/claraabril/statuses/1503868612955852811,claraabril,3/15/2022 6:59 pm,"antiaml01990 @cosio_joaquin @CaraveoBertha Uy, tú léxico de naco",Mention,Text Only,1231,0,"Coyoacan, Mexico City, Mexico",Women,,0,0,0,0,Odio
Twitter,https://twitter.com/BrujaaRoja/statuses/1503859863264190464,BrujaaRoja,3/15/2022 6:25 pm,Pinche resentido.,Message,Text Only,144,2,"Jardines de la Silla (Jardines), Nuevo León, Mexico",Women,,2,0,0,0,Backlash
Twitter,https://twitter.com/DrAntorse/statuses/1503856719830695940,DrAntorse,3/15/2022 6:12 pm,"Los casos no habían permitido aplicar la perspectiva de género para una condena de reinstalación, hasta el día de hoy 🤓.
Reinstalación reforzada para mujeres trabajadoras que alegan discriminación en el empleo 🙌🏻.
Ya estaría redactando una tesis si fuera secretario de TCC.",Message,Text Only,2986,189,"Pachuca de Soto, Hidalgo, Mexico",Men,,164,0,8,17,Género
Instagram,https://www.instagram.com/p/CbI_bHpu0xt/,,3/15/2022 6:01 pm,"#atentado a #izkiasiches en #temucuicui #Ercilla la #Izquierda #mapuchelover ya no pueden negar que hay #violencia #terrorista #separatista y #racista. 
#ministradelinterior #Chile #gobiernodechile #gobiernodeboric #pazparachile #pazparalaaraucanía #violenciaterrorista #carabineros #estadodeexcepción #araucania",Message,Photo,0,221,,,,204,0,17,0,
Twitter,https://twitter.com/CarlosVlz04/statuses/1503850567910801408,CarlosVlz04,3/15/2022 5:48 pm,"ChumelTorres El Tarahumara, jajajaja eres un racista, clasista de cagada y sales con estos discursos 😂",Mention,Text Only,19,0,Mexico,Men,,0,0,0,0,
Twitter,https://twitter.com/susybermudezc/statuses/1503847634217299968,susybermudezc,3/15/2022 5:36 pm,"#ComisiónDeJusticia 
Eliminar la discriminación de género y el libre desarrollo de la personalidad beneficia y abona a la igualdad sustantiva, por ello se propone la iniciativa del Código Civil que permita contraer a la mujer nuevas nupcias inmediatamente después del divorcio, https://t.co/0HHpzOgfDo",Message,Photo,414,5,"Irapuato, Guanajuato, Mexico",Women,,4,0,1,0,Género
Twitter,https://twitter.com/SaulRreal26/statuses/1503846227049254922,SaulRreal26,3/15/2022 5:30 pm,alejandrateeran Yo una vez ví un comentario que decía que Coco era clasista porque se veía como a Miguel lo quería toda su familia 🧐,Mention,Text Only,72,3,"Miguel Aleman (La Doce), Sonora, Mexico",,,2,0,1,0,
Twitter,https://twitter.com/Ricardo69127538/statuses/1503836782345007114,Ricardo69127538,3/15/2022 4:53 pm,ChumelTorres Vamos a aplaudir cuando te metan preso pendejo racista!!!!,Mention,Text Only,9,0,"Tesistan, Jalisco, Mexico",Men,,0,0,0,0,
Twitter,https://twitter.com/arturoavila_mx/statuses/1503831190830292995,arturoavila_mx,3/15/2022 4:31 pm,"¡¡Esto es y será la nueva visión energética de #México!! Un hecho inédito la Asamblea Informativa Aguascalientes

@mario_delgado
@Nora_Ruvalcaba
@SalmaLuevano
@AndreaChavezTre
@abrahamendieta
@yeidckol
@terrazas_prieto
@MiguelTorrucoG
@jramirorobledo https://t.co/QnFjhDPHU3",Message,Video,10840,167,"Aguascalientes, Aguascalientes, Mexico",Men,,114,0,7,46,
Twitter,https://twitter.com/raydavaloss/statuses/1503828693730279424,raydavaloss,3/15/2022 4:21 pm,"Racismo en su máxima expresión. https://t.co/E4agYPZ55K | QT: Oh... todos indignados por la mierda racista de Polonia, pero mira que, ""hasta ayer"", la amenaza ucraniana sobre los migrantes era: ""¡Listo para disparar""! (Sí, sí... la ucrania de Zelenski). https://t.co/7L4Xipz57E",Message,Link,2276,2,"Xalapa de Enriquez, Veracruz, Mexico",Men,,1,0,0,1,
Twitter,https://twitter.com/pablinskiki/statuses/1503825656983044101,pablinskiki,3/15/2022 4:09 pm,"elettrochoc No tienes fundamentos para decir que soy misógino, racista ni clasista 😉
Al final tú apoyas a violadores y asesinos, podría decir entonces que se puede esperar si estás igual, “mano”.",Mention,Text Only,1461,2,"Colonia del Valle, Mexico City, Mexico",,,0,0,2,0,Género
Twitter,https://twitter.com/irarturo2010/statuses/1503824419570995202,irarturo2010,3/15/2022 4:04 pm,"Simpáticos los miembros de la @premierleague @UEFA

Se hincan protestando contra el racismo y bloquean a los rusos en las competiciones y torneos

#RacismoInstitucional #EuroBorregos https://t.co/Ig630MXA7L",Message,Photo,1754,0,Mexico,,,0,0,0,0,
Twitter,https://twitter.com/jjcastillo34/statuses/1503823674238976008,jjcastillo34,3/15/2022 4:01 pm,"Juran y perjuran que el racismo a la inversa no existe, luego lees la sarta de tuits burlándose de los morros del vídeo que venden depas. Me dan asco ambas partes.",Message,Text Only,593,0,"Apatzingan, Michoacán, Mexico",,,0,0,0,0,
Twitter,https://twitter.com/_____basho/statuses/1503822396985417738,_____basho,3/15/2022 3:56 pm,"y ese día en el segundo turno...
BAMBOMAMBO
Celebrando el aniversario de Bambolina Café ❣️ 
feat. La Sebas / Fogoziita 96 / Bruja Prieta / Adakeo / Basho
@ Donceles 88
26/03

bye
https://t.co/DvoN2R17N7 https://t.co/5xd8TRzwPC",Mention,Photo,2024,17,"Cuauhtemoc, Mexico City, Mexico",,,12,0,3,2,
Twitter,https://twitter.com/diegomaury__/statuses/1503821365320814592,diegomaury__,3/15/2022 3:52 pm,Lo único que el conflicto de Ch*mel es generar una guerra de clasismo entre el Norte y Sur de México.,Message,Text Only,1060,0,"Merida, Yucatán, Mexico",Men,,0,0,0,0,
Twitter,https://twitter.com/venezolanarica/statuses/1503819737054253068,venezolanarica,3/15/2022 3:45 pm,No soporto la discriminación entre la comunidad y menos con señores q nada q ver con una #transexual MEJOR CALLADITOS Y RESPETAR,Message,Text Only,8499,3,"Colonia del Valle, Mexico City, Mexico",,,3,0,0,0,Género
Twitter,https://twitter.com/ivanmtzmdc/statuses/1503815816504135691,ivanmtzmdc,3/15/2022 3:30 pm,"jorgesuarezv @Navegaciones @TheWilsonCenter Y porque habria de dar veguenza? Aparte de corrupto, todo un clasista.

Tener trajer no te quita lo criminal.",Mention,Text Only,864,2,"Las Delicias, Baja California, Mexico",Men,,2,0,0,0,
Twitter,https://twitter.com/jjcastillo34/statuses/1503814682611793923,jjcastillo34,3/15/2022 3:25 pm,danieloso Me estás diciendo que Luis Miguel nunca tuvo nada exepto talento y ese lo ha sacado a delante y es por eso no se queja de nada y que Residente a pesar de haber tenido todo lo único que no tuvo o tiene es talento y por eso es un quejica. Vaya más que Residente es Resentido,Mention,Text Only,593,557,"Apatzingan, Michoacán, Mexico",,,522,0,8,27,Backlash
Twitter,https://twitter.com/claraabril/statuses/1503811082875555845,claraabril,3/15/2022 3:11 pm,"maquiavelo_fifi @JuanEdu36807811 @Totalalex1 @PonchoGutz Mejor que lo que tú seguramente conoces, sí 
Pobre acomplejado",Mention,Text Only,1231,0,"Coyoacan, Mexico City, Mexico",Women,,0,0,0,0,
Twitter,https://twitter.com/vicgneo/statuses/1503809753000071176,vicgneo,3/15/2022 3:05 pm,"Martes de promociones en @clubigneo01 

Acceso de 2 a 4 pm  $30
Acceso de 4 a 11 pm $50
Latón tecate o indio 4x$100

Y como promoción especial por cortesía de la imagen del club GIO
Caguamones Tecate Indio Corona y Victoria solo $50 de 5 a 8 pm. https://t.co/hmBjld8WAh",Message,Photo,688,2,"Coyoacan, Mexico City, Mexico",,,1,0,0,1,Origen cultural
Twitter,https://twitter.com/ElRobDeLosAutos/statuses/1503809098437087239,ElRobDeLosAutos,3/15/2022 3:03 pm,PonchoGutz No fuera tu abuelito el naco delirante del palacio porque chillas como marrano pinche estúpido.,Mention,Text Only,1372,0,"Miguel Hidalgo, Mexico City, Mexico",Men,,0,0,0,0,Odio
Twitter,https://twitter.com/BrawIslas/statuses/1503805923034292229,BrawIslas,3/15/2022 2:50 pm,"#AvanceInformativo
ACRIBILLAN AL SECRETARIO MUNICIPAL DE XOXOCOTLA

Fue acribillado hace unos momentos el secretario municipal del ayuntamiento Indigena de Xoxocotla, Juan Manuel, en el centro de este lugar.
Los politiconarcos en acción. https://t.co/7a0AR9VnyG",Message,Photo,1003,0,"Puente de Ixtla, Morelos, Mexico",,,0,0,0,0,
